连云港广电传媒集团有限公司,,,,
江苏省万资伟业集团有限公司,,,,
江苏国之峰建设工程有限公司,,,,
江苏寅昊智能装备有限公司,,,,
江苏泰格油墨有限公司,,,,
江苏朗力建设工程有限公司,,,,
江苏华阳照明工程有限公司,,,,
连云港市建筑科学研究院有限公司,,,,
连云港唯德复合材料设备有限公司,,,,
江苏百盈电力工程有限公司,,,,
连云港三瑞医疗器械制造有限公司,,,,
江苏苏曜建设工程有限公司,,,,
连云港市社会福利有奖募捐办公室（连云港市福利彩票发行中心）,,,,
江苏省联众生物科技发展有限公司,,,,
连云港市新坝丰泰农业资源开发有限公司,,,,
江苏登新流体科技有限公司,,,,
江苏连万村农业科技有限公司,,,,
连云港博大机械设备制造有限公司,,,,
虎虎科技（江苏）有限公司,,,,
江苏盟发建设工程有限公司,,,,
连云港金卓智能化工程有限公司,,,,
中旺华昱供应链连云港有限公司,,,,
江苏翔钢建设工程有限公司,,,,
江苏中建消防工程有限公司,,,,
连云港桐博贸易有限公司,,,,
江苏振大超级购物广场有限公司,,,,
江苏格力起重机械有限公司,,,,
江苏裕恺泽实业有限公司,,,,
江苏锦屏里旅游开发有限公司,,,,
江苏泰达工程项目管理有限公司,,,,
江苏丰之连建设有限公司,,,,
江苏宇之涛建设有限公司,,,,
连云港汤跃华国际贸易有限公司,,,,
江苏凯坤交通设施有限公司,,,,
江苏融达国际旅游有限公司,,,,
连云港天澜丰田汽车销售服务有限公司,,,,
连云港耐中贸易有限公司,,,,
江苏金翠农业技术开发有限公司,,,,
连云港市尚泰置业有限公司,,,,
江苏杰东建设工程有限公司,,,,
连云港美都家居市场建设有限公司,,,,
连云港镜花西游科技产业投资有限公司,,,,
江苏德发冷冻科技有限公司,,,,
连云港禾一安建筑劳务有限公司,,,,
江苏九策广告集团有限公司,,,,
江苏诚益达建设工程有限公司,,,,
连云港市智方科技有限公司,,,,
江苏双盾智能科技有限公司,,,,
江苏马牌化妆品有限公司,,,,
连云港天梦机械有限公司,,,,
江苏空阔贸易有限公司,,,,
连云港振荣传动件有限公司,,,,
江苏港泉农业开发有限公司,,,,
江苏汇卡电子科技有限公司,,,,
连云港中建环境工程有限公司,,,,
连云港丰电电气有限公司,,,,
江苏佳轩化工科技有限公司,,,,
江苏汉润企业管理有限公司,,,,
江苏润旭动物药业有限公司,,,,
江苏奇点工程咨询有限公司,,,,
江苏范记高平堂文化传播有限公司,,,,
江苏中澜邦海装饰工程有限公司,,,,
新唯信息科技（连云港）有限公司,,,,
连云港一乘空间装饰工程有限公司,,,,
连云港锐泰房地产开发有限公司,,,,
连云港市德铸贸易有限公司,,,,
江苏华夏工程管理咨询有限公司,,,,
连云港丽伟农业科技有限公司,,,,
江苏厚博建筑装饰工程设计有限公司,,,,
江苏御隽峰建筑工程有限公司,,,,
连云港鑫宏农业科技有限公司,,,,
江苏科兢来体育器材有限公司,,,,
江苏松源食品科技有限公司,,,,
连云港巧博建筑劳务有限公司,,,,
连云港君之行建筑有限公司,,,,
江苏佰卓实业有限公司,,,,
连云港纬窦建设工程有限公司,,,,
连云港桓宇电力设备有限公司,,,,
江苏聚宇网络科技有限公司,,,,
尚德企业信用征信（江苏）有限公司,,,,
江苏冰川消防工程有限公司,,,,
江苏山海西游旅游开发有限公司,,,,
连云港源唛食品有限公司,,,,
江苏馨菲涂料有限公司,,,,
江苏凯归建筑运输有限公司,,,,
江苏敏思教育科技有限公司,,,,
连云港强联建筑劳务有限公司,,,,
江苏谋士兔知识产权服务有限公司,,,,
江苏中旋建设工程有限公司,,,,
连云港市巨杉国际贸易有限公司,,,,
江苏之瑞穆建筑工程有限公司,,,,
连云港市安达经济信息咨询有限公司,,,,
江苏美窕生物科技有限公司,,,,
连云港华尔姿纺织有限公司,,,,
江苏九九归一科技有限公司,,,,
江苏爱上小影文化传播有限公司,,,,
江苏兴易航航空科技有限公司,,,,
江苏壹空间建筑装饰工程有限公司,,,,
连云港连大双发建设工程有限公司,,,,
连云港鑫方盛机电设备销售有限公司,,,,
连云港易皇五金销售有限公司,,,,
连云港吴家商贸有限公司,,,,
连云港正康医疗科技有限公司,,,,
连云港果源云商果业有限公司,,,,
连云港市超涵建筑劳务有限公司,,,,
江苏志诚医药科技有限公司,,,,
江苏吴点零眼镜贸易有限公司,,,,
连云港久永建设工程有限责任公司,,,,
江苏本起建设有限公司,,,,
江苏天清嘉园餐饮管理有限公司,,,,
连云港德恩建筑工程有限公司,,,,
江苏欧纳森食品有限公司,,,,
连云港佳普流体科技有限公司,,,,
江苏神龙餐饮管理有限公司,,,,
软丰科技（江苏）有限公司,,,,
江苏英克斯实业有限公司,,,,
江苏浩东文化传播有限公司,,,,
连云港强和机械设备制造有限公司,,,,
江苏东堡瑞瀛建设有限公司,,,,
江苏晶镍新材料科技有限公司,,,,
连云港硕成建材贸易有限公司,,,,
连云港融兴网络科技服务有限公司,,,,
江苏港泉环保设备有限公司,,,,
江苏汇享元电子科技有限公司,,,,
江苏浦街酒业有限公司,,,,
江苏泊河农业开发有限公司,,,,
江苏沧渤建设监理有限公司,,,,
江苏申通广告有限公司,,,,
小星信息科技（连云港）有限公司,,,,
辛巴达（江苏）航空科技有限公司,,,,
江苏一青生物科技有限公司,,,,
连云港市由页建筑装饰有限公司,,,,
连云港德翼生物科技有限公司,,,,
江苏柏儒建筑工程有限公司,,,,
江苏苏鲁大地酒业有限公司,,,,
江苏特姆玛特科技有限公司,,,,
连云港玖天温室设备有限公司,,,,
连云港友利投资有限公司,,,,
江苏冠力精密弹簧有限公司,,,,
江苏广日电子科技有限公司,,,,
江苏彩虹部落装饰工程有限公司,,,,
江苏玖壹安装工程有限公司,,,,
江苏马蹄铁汽车用品有限公司,,,,
江苏标洁工程设计咨询有限公司,,,,
江苏宏德价格评估工程咨询有限公司,,,,
江苏云N达新材料科技有限公司,,,,
江苏正和认证服务有限公司,,,,
江苏盛源堂医疗器械有限公司,,,,
江苏红猎企业管理咨询有限公司,,,,
江苏科爵建筑安装有限公司,,,,
连云港高通防雷科技服务有限公司,,,,
江苏誉港建设工程有限公司,,,,
连云港润派商贸有限公司,,,,
连云港聚享福励科技发展有限公司,,,,
江苏路君起重吊装有限公司,,,,
连云港皓居轩贸易有限公司,,,,
连云港顺发房地产开发有限公司,,,,
江苏辽际网络科技有限公司,,,,
江苏恩能实业有限公司,,,,
江苏卓研诚生物技术有限公司,,,,
江苏中泽信息科技有限公司,,,,
江苏道名网络科技有限公司,,,,
江苏众彩文化传媒有限公司,,,,
连云港晨莱贸易有限公司,,,,
江苏琳佳鑫成贸易有限公司,,,,
江苏金翌信息科技有限公司,,,,
江苏浦湾环保科技有限公司,,,,
连云港市宿城建筑安装公司,,,,
连云港华达工程材料有限公司,,,,
连云港潘端义建设工程有限公司,,,,
连云港晋能物流有限公司,,,,
连云港裕华矿产有限公司,,,,
连云港顺盟贸易有限公司,,,,
连云港腾旭旅游开发有限公司,,,,
江苏洋井化工服务有限公司,,,,
江苏中建建安工程有限公司,,,,
江苏坤泽新材料发展有限公司,,,,
连云港新大陆置业有限公司,,,,
江苏徐香生态旅游发展有限公司,,,,
连云港辰浩供应链管理有限公司,,,,
连云港坤强矿产资源有限公司,,,,
连云港东源置业有限公司,,,,
江苏新景石油化工有限公司,,,,
江苏泰明石化有限公司,,,,
连云港奔茂环保科技有限公司,,,,
江苏大奥实业有限公司,,,,
江苏平为福市政工程有限公司,,,,
江苏达宝矿产贸易有限公司,,,,
江苏丰硕能源有限公司,,,,
连云港市新港中学,,,,
连云港斯加达国际贸易有限公司,,,,
江苏中勋能源有限公司,,,,
同星石油化工（江苏）有限公司,,,,
江苏淮奥化工有限公司,,,,
江苏普睿国际贸易有限公司,,,,
连云港同捷贸易有限公司,,,,
江苏省瑞宇国际货运代理有限公司,,,,
江苏中连物流有限公司,,,,
连云港黄海人家物业管理有限公司,,,,
民众石油化工（江苏）有限公司,,,,
鹿岛（江苏）技术研究有限公司,,,,
江苏科奎供应链有限公司,,,,
连云港胜茂生物有限公司,,,,
连云港皇煌混凝土有限公司,,,,
连云港杜先生废旧物资回收有限公司,,,,
江苏中烃能源有限公司,,,,
江苏馨诚项目管理有限公司,,,,
江苏星网电力建设有限公司,,,,
江苏顺风建设工程有限公司,,,,
连云港卡服物流有限公司,,,,
江苏华鑫新能源有限公司,,,,
江苏宝路体育文化发展有限公司,,,,
江苏中哈国际贸易有限公司,,,,
江苏赞资供应链有限公司,,,,
江苏诚才环保科技有限公司,,,,
江苏合创石化有限公司,,,,
江苏金文石化有限公司,,,,
江苏松港腾石化有限公司,,,,
江苏振鑫能源有限责任公司,,,,
江苏益启康电子商务有限公司,,,,
洲海贸易（江苏）有限公司,,,,
江苏百邦工程机械租赁有限公司,,,,
江苏赛美特石化有限公司,,,,
江苏港安建筑设备租赁有限公司,,,,
江苏康诚正信能源有限公司,,,,
江苏海合慧建材有限公司,,,,
江苏炼艺坊文化传媒有限公司,,,,
江苏冠兴建设工程有限公司,,,,
江苏昊洋能源有限公司,,,,
江苏永巨技术有限公司,,,,
连云港梵烁能源有限公司,,,,
东海中泰资产管理集团有限公司,,,,
连云港市高吉建筑工程有限公司,,,,
倍合德华强（连云港）医药化工科技有限公司,,,,
连云港鼎昌塑料包装有限公司,,,,
东海县乐财石英科技有限公司,,,,
灌云天骄科技开发有限公司,,,,
连云港广庭建筑工程有限公司,,,,
灌云县三星食品有限公司,,,,
江苏威迪农业装备科技股份有限公司,,,,
连云港恒通房地产开发有限公司,,,,
灌云泰达纺织有限公司,,,,
连云港福盛房地产开发有限公司,,,,
灌云中奇建筑工程有限公司,,,,
连云港英格达电子科技有限公司,,,,
连云港润沃达高新科技有限公司,,,,
连云港永润化工有限公司,,,,
连云港可伟达物资贸易有限公司,,,,
东海县龙海置业有限公司,,,,
连云港腾宏科技化工有限公司,,,,
东海县金德瑞镍业有限公司,,,,
江苏九道建设工程有限公司,,,,
江苏一番食品有限公司,,,,
江苏海峰科技有限公司,,,,
江苏省东海蛇纹石矿,,,,
连云港琴川纺织科技有限公司,,,,
连云港升华机械制造有限公司,,,,
连云港饮地安矿泉水有限公司,,,,
东海县永拓混凝土有限公司,,,,
连云港松成电子有限公司,,,,
灌云名榭建筑工程有限公司,,,,
灌云铂鹏农业科技有限公司,,,,
连云港仟羽绿化工程有限公司,,,,
连云港三源木业有限公司,,,,
连云港润博环保科技有限公司,,,,
连云港金邦化工有限公司,,,,
连云港永之旺建材销售有限公司,,,,
灌云仁昱康复医院有限公司,,,,
连云港虎旺生态科技有限公司,,,,
连云港柏敏实业有限公司,,,,
江苏华苑老龄产业发展有限公司,,,,
连云港安峰山旅游开发有限公司,,,,
江苏盈工建设工程有限公司,,,,
连云港厚景实业有限公司,,,,
江苏少驰建设工程有限公司,,,,
灌云县金精门窗有限公司,,,,
江苏至美印刷科技有限公司,,,,
东海县向日葵光伏发电有限公司,,,,
灌云县繁荣物业管理有限公司,,,,
江苏德一源建设工程发展有限公司,,,,
连云港宇洋水泥制品有限公司,,,,
江苏肯美建材有限公司,,,,
东海县迎奥旅游开发有限公司,,,,
连云港日恒光伏设备有限公司,,,,
东海县安峰矿产综合开发公司,,,,
连云港台亚环保设备有限公司,,,,
连云港华鹏化工有限公司,,,,
灌云金石为开工程技术咨询服务有限公司,,,,
江苏神汇新材料科技有限公司,,,,
连云港福麟珠宝销售有限公司,,,,
连云港金淮旅游开发有限公司,,,,
连云港市鸿腾再生资源有限责任公司,,,,
江苏泉川实业有限公司,,,,
连云港盛昌纺织有限公司,,,,
江苏利涉大川环保科技有限公司,,,,
灌云博之瑞新材料有限公司,,,,
江苏纽胜建设工程有限公司,,,,
连云港恒益矿业有限公司,,,,
江苏瞻高建筑安装工程有限公司,,,,
江苏润诚仓储有限公司,,,,
东海县华东汽车销售服务有限公司,,,,
东海县海纳矿业有限公司,,,,
东海县润太石英科技有限公司,,,,
江苏格物环保咨询有限公司,,,,
东海县远雄置业有限公司,,,,
东海县如来珠宝有限公司,,,,
连云港欧澳实业发展有限公司,,,,
连云港厚祥建筑劳务有限公司,,,,
连云港玖翔混凝土有限公司,,,,
江苏顺越新材料有限公司,,,,
江苏金福地肥业有限公司,,,,
灌云县第一中学,,,,
灌云县嘉顺置业有限公司,,,,
江苏药生堂保健品有限公司,,,,
江苏顺鑫沥青新材料有限公司,,,,
江苏铭角建筑工程有限公司,,,,
江苏经纬人力资源有限公司,,,,
连云港吉远服饰有限公司,,,,
连云港明启船务有限公司,,,,
江苏奥动体育有限公司,,,,
连云港万明吊装有限公司,,,,
连云港倍通电力安装工程有限公司,,,,
东海县幼儿园,,,,
江苏坤固建设工程有限公司,,,,
连云港同高建材销售有限公司,,,,
连云港金马通物流有限公司,,,,
东海县召旺木材有限公司,,,,
江苏晨升传媒有限公司,,,,
灌云品伟粮食购销有限公司,,,,
江苏固科电子科技有限公司,,,,
江苏坤灵健康产业管理有限公司,,,,
东海县圣蓝湖蓝莓种植专业合作社,,,,
江苏尚瑞斯医疗器械有限公司,,,,
江苏福如体育文化有限公司,,,,
江苏嘉泰农资有限公司,,,,
江苏坤爵建设有限公司,,,,
东海县海纳百川装饰工程有限公司,,,,
连云港业友建筑材料科技有限公司,,,,
江苏澳克托铝业科技有限公司,,,,
江苏嵘本建设工程有限公司,,,,
连云港皎驹石英制品有限公司,,,,
连云港树东建设工程有限公司,,,,
连云港驰冶建筑工程有限公司,,,,
江苏神鸟贸易有限公司,,,,
江苏派隆建设工程有限公司,,,,
东海县康桥建筑工程有限公司,,,,
连云港同富建筑工程有限公司,,,,
东海县洲定商贸有限公司,,,,
灌云金元爱家装饰工程有限公司,,,,
连云港欣诚企业管理服务有限公司,,,,
连云港众到ㄉ韫こ逃邢薰司,,,,
连云港超匠建筑工程有限公司,,,,
连云港硕高文化传媒有限公司,,,,
江苏鲲龙运输有限公司,,,,
东海县柘塘果蔬种植专业合作社,,,,
东海县猫可珠宝有限公司,,,,
连云港赞卓贸易有限公司,,,,
江苏昕果儿食品贸易有限公司,,,,
江苏高冠景观装饰工程有限公司,,,,
江苏韶新珠宝有限公司,,,,
江苏恒林生物科技有限公司,,,,
连云港卓成建材有限公司,,,,
连云港蓝熙建设工程有限公司,,,,
江苏酥情文化传媒有限公司,,,,
连云港紫銮建设工程有限公司,,,,
连云港润泽通信设备有限公司,,,,
连云港策瑞商贸有限公司,,,,
灌云冬辰水产养殖专业合作社,,,,
东海县掘进建材有限公司,,,,
连云港苏盈建筑工程有限公司,,,,
连云港牛多宝农业有限公司,,,,
连云港禄奥商贸有限公司,,,,
连云港林创兴建筑有限公司,,,,
东海县兰多商贸有限公司,,,,
江苏恩力优教育咨询有限公司,,,,
连云港贝林建设工程有限公司,,,,
江苏北米网络科技有限公司,,,,
江苏起碧企业管理有限公司,,,,
江苏苏凰珠宝有限公司,,,,
东海县安安房产经纪有限公司,,,,
江苏渡米企业管理有限公司,,,,
江苏怡而悦贸易有限公司,,,,
灌云县锦云服装有限公司,,,,
江苏祥志服装有限公司,,,,
连云港科迈网络科技有限公司,,,,
连云港博智通科技有限公司,,,,
江苏满玺建筑材料有限公司,,,,
孕享家政服务（连云港）有限公司,,,,
江苏元科防水科技有限公司,,,,
灌云县维路布艺装饰有限公司,,,,
连云港宏新旺机械设备租赁有限公司,,,,
连云港市灌云县相恋你服装加工有限公司,,,,
连云港圣优再生资源有限公司,,,,
东海县利昌生物科技有限公司,,,,
连云港广超建设工程有限公司,,,,
连云港鑫琼贸易有限公司,,,,
江苏策力文化传播有限公司,,,,
东海县简一企业管理有限公司,,,,
连云港金康医药科技有限公司,,,,
连云港劲美智能家居有限公司,,,,
连云港安彩新能源有限责任公司,,,,
江苏恒舟医疗设备有限公司,,,,
连云港市连碧房地产开发有限公司,,,,
江苏世友炭材有限公司,,,,
江苏仕旗人力资源有限公司,,,,
江苏春豪国际贸易有限公司,,,,
连云港我帮您家政服务有限公司,,,,
江苏润都置业投资有限公司,,,,
连云港欣东昂铝业有限公司,,,,
连云港诚运工程管理有限公司,,,,
连云港苏兰林饲料有限公司,,,,
连云港高华工艺品有限公司,,,,
连云港海膳房商贸有限公司,,,,
连云港市清濯自动化设备有限公司,,,,
连云港玉月善食品有限公司,,,,
连云港沃泰贸易有限公司,,,,
连云港汇润建设工程有限公司,,,,
连云港骏驰混凝土有限公司,,,,
江苏力之金建设工程有限公司,,,,
连云港市群力新型建材科技有限公司,,,,
连云港宝盛宏现代农业有限公司,,,,
沃芯电子科技（江苏）有限公司,,,,
连云港沫巴叔叔食品有限公司,,,,
连云港善成石材有限公司,,,,
连云港龙运矿产资源有限公司,,,,
连云港铭莱纺织品有限公司,,,,
连云港海之韵食品有限公司,,,,
江苏路洲食品有限公司,,,,
江苏云鲸纪企业管理有限公司,,,,
连云港市赣马高级中学,,,,
江苏东沃环保密封技术有限公司,,,,
连云港双石特种玻璃有限公司,,,,
江苏亚腾房地产有限公司,,,,
连云港海之秀建筑工程有限公司,,,,
连云港伟诺生物科技有限公司,,,,
江苏澳绿食品有限公司,,,,
连云港金铂房地产开发有限公司,,,,
连云港花王农业科技有限公司,,,,
江苏启明星露营地管理有限公司,,,,
江苏团安建设工程有限公司,,,,
连云港市宁亮路桥工程有限公司,,,,
连云港仕梦建设工程有限公司,,,,
江苏宏图文化传媒有限公司,,,,
连云港绮捷晟实业发展有限公司,,,,
江苏广尊实业有限公司,,,,
江苏美捷瑞健生物科技有限公司,,,,
连云港恒瑞建筑工程有限公司,,,,
连云港岚隆矿石加工有限公司,,,,
江苏检本生态农业有限公司,,,,
江苏众行影视文化传媒有限公司,,,,
江苏祺氏水产科技有限公司,,,,
连云港双安生物科技有限公司,,,,
江苏赤金吊装有限公司,,,,
江苏文康建设工程有限公司,,,,
江苏远阔设备安装工程有限公司,,,,
连云港市德宝水产养殖有限公司,,,,
江苏鑫璞源电力工程有限公司,,,,
江苏东首实业有限公司,,,,
江苏尧之悦企业管理有限公司,,,,
江苏垂医疗器械有限公司,,,,
连云港丰庆医疗器械销售有限公司,,,,
连云港市明烁海洋科技有限公司,,,,
江苏户纳建设有限公司,,,,
连云港利王投资有限公司,,,,
连云港光之大环保再生资源有限公司,,,,
江苏华洋启航国际物流有限公司,,,,
江苏万穗农业科技有限公司,,,,
江苏佳百锦建筑工程有限公司,,,,
江苏绿生金环保工程有限公司,,,,
连云港利水源环保科技有限公司,,,,
江苏福力周新能源有限公司,,,,
连云港沃梓实业有限公司,,,,
江苏佰源电力工程有限公司,,,,
连云港固捷建筑工程有限公司,,,,
连云港超纳实业发展有限公司,,,,
连云港智茂新型建材有限公司,,,,
江苏长流环境能源技术研究院有限公司,,,,
连云港越扬铭实业发展有限公司,,,,
江苏路之航新型建材有限公司,,,,
连云港永悦碳素科技有限公司,,,,
江苏欧纪歌实业发展有限公司,,,,
连云港友淮实业发展有限公司,,,,
江苏敦丰生态农业科技发展有限公司,,,,
江苏雕航实业发展有限公司,,,,
江苏新妙尚商贸有限公司,,,,
连云港福玲居贸易有限公司,,,,
江苏卡德姆斯贸易有限公司,,,,
连云港奎霖实业发展有限公司,,,,
江苏薪可光环保工程有限公司,,,,
江苏镔之鑫物流有限公司,,,,
连云港业扩农业科技有限公司,,,,
连云港福来顺海洋科技有限公司,,,,
江苏康诚服饰有限公司,,,,
江苏手挑水产有限公司,,,,
连云港廷楚建设工程有限公司,,,,
江苏方为建设工程有限公司,,,,
连云港赣榆大彬水产养殖专业合作社,,,,
连云港中房城市建设投资开发有限公司,,,,
江苏天明机械集团有限公司,,,,
连云港广厦建设有限公司,,,,
江苏瑞杰项目管理顾问有限公司,,,,
江苏海州湾文化旅游发展集团有限公司,,,,
江苏东海老淮猪产业发展有限公司,,,,
江苏绿源工程设计研究有限公司,,,,
连云港赣榆旅游发展有限公司,,,,
江苏国基建设集团有限公司,,,,
江苏耕耘化学有限公司,,,,
连云港苏润建设工程有限公司,,,,
东海县晶隆玻璃有限公司,,,,
江苏省新海粮食储备直属库有限公司,,,,
江苏千府建设集团有限公司,,,,
珩星电子（连云港）股份有限公司,,,,
中国船舶燃料连云港有限公司,,,,
江苏灌河半岛实业有限公司,,,,
连云港赣榆众诚投资有限公司,,,,
连云港北方变速器有限责任公司,,,,
连云港虹洋热电有限公司,,,,
晶海洋半导体材料（东海）有限公司,,,,
连云港市海建建筑安装工程有限公司,,,,
连云港新圩港码头有限公司,,,,
中化国际聚合物（连云港）有限公司,,,,
连云港桥源贸易有限公司,,,,
连云港神州投资有限公司,,,,
三英医疗卫生用品（连云港）有限公司,,,,
江苏吉隆达化工有限公司,,,,
江苏金正阳矿业有限公司,,,,
中新房（连云港）房地产开发有限公司,,,,
江苏瑞馥食品有限公司,,,,
连云港市江山房地产开发有限公司,,,,
连云港伊甸园旅游开发有限公司,,,,
连云港东南置业有限公司,,,,
东海青松岭温泉疗养院有限公司,,,,
英晖（连云港）贸易有限公司,,,,
江苏华爱国际贸易有限公司,,,,
连云港新厉达投资有限公司,,,,
灌云建泽建筑工程有限公司,,,,
中化连云港石化码头有限公司,,,,
江苏阳云丰服装有限公司,,,,
江苏连港建设工程有限公司,,,,
微企企业管理有限公司,,,,
联瑞新材（连云港）有限公司,,,,
东海县厚博文化教育发展有限公司,,,,
灌南源鑫新型建材有限公司,,,,
星禾环保科技（江苏）有限公司,,,,
灌云尚风风电有限公司,,,,
连云港杰能新能源有限公司,,,,
江苏四季沐歌净水科技有限公司,,,,
灌云农环能源环境科技有限公司,,,,
连云港瑞农实业有限公司,,,,
连云港保润房地产发展有限公司,,,,
连云港赣榆住房保障投资发展有限公司,,,,
灌云永贯新能源科技有限公司,,,,
灌云县金拓农村小额贷款有限公司,,,,
连云港凤凰珠宝大厦有限公司,,,,
江苏汇元药业有限公司,,,,
连云港桥头堡跨境电商有限公司,,,,
连云港金涞再生资源有限公司,,,,
连云港金叶科技产业发展有限公司,,,,
江苏曙光住宅工业股份有限公司,,,,
四季农产品交易中心有限公司,,,,
连云港汇铭置业有限公司,,,,
云峰矿业（连云港）有限公司,,,,
江苏利灌建设工程有限公司,,,,
连云港友佳纸品机械有限公司,,,,
连云港中祥新能源有限公司,,,,
连云港金又来建材有限公司,,,,
江苏启点生态环保工程有限公司,,,,
江苏兴弘信金属科技有限公司,,,,
灌南县灌铁实业有限公司,,,,
连云港印象文化旅游发展有限公司,,,,
连云港硕仁实业有限公司,,,,
东海县高投水务有限公司,,,,
连云港顺同连泰管理咨询合伙企业（有限合伙）,,,,
恒邦智纺（连云港）科技有限公司,,,,
江苏庆延新材料科技有限公司,,,,
连云港树艺文化旅游发展有限公司,,,,
江苏得物企业管理有限公司,,,,
连云港沐熙贸易有限公司,,,,
江苏华世利德建设工程有限公司,,,,
江苏聚尚建筑劳务有限公司,,,,
连云港冠利化工有限公司,,,,
江苏天腾网络科技有限公司,,,,
连云港众志建筑新材料有限公司,,,,
连云港美邦建筑科技有限公司,,,,
连云港阔伏节能科技有限公司,,,,
连云港广聚建筑工程劳务分包有限公司,,,,
江苏亮耀新能源科技有限公司,,,,
江苏穆瑞金房地产开发有限公司,,,,
萍美国际物流（连云港）有限公司,,,,
北控城市发展（江苏）有限公司,,,,
连云港新航城物流发展有限公司,,,,
连云港市宇流旅游开发有限公司,,,,
连云港耀洲实业有限公司,,,,
连云港九泽船务有限公司,,,,
同源病理诊断中心（江苏）有限公司,,,,
连云港花果行养老服务有限公司,,,,
江苏颐康农业发展有限公司,,,,
江苏融顺元投资有限公司,,,,
连云港伦凯劳务工程有限公司,,,,
东海县哗众网络传媒有限公司,,,,
江苏茉莉花门窗科技有限公司,,,,
连云港兴崇岳建设有限公司,,,,
连云港立通新能源科技有限公司,,,,
江苏文艳电子商务有限公司,,,,
