江苏唐大广告文化传媒有限公司,,,,
江苏翱硕建设工程有限公司,,,,
连云港永敦贸易有限公司,,,,
江苏玺阔建设工程有限公司,,,,
连云港市港达置业有限公司,,,,
灌南县灌江菌业发展有限公司,,,,
江苏鸿昶乾木业有限公司,,,,
连云港高新拓建招商管理有限公司,,,,
江苏流清建筑工程有限公司,,,,
灌云瑞铭水泥制品有限公司,,,,
江苏洲凯商贸有限公司,,,,
连云港市晶空亮硅材料有限公司,,,,
连云港全权农业科技发展有限公司,,,,
中岩建筑劳务（江苏）有限公司,,,,
国朗石化（江苏）有限公司,,,,
连云港市新浦实验小学,,,,
连云港高级中学,,,,
江苏科威建材有限公司,,,,
连云港管家婆餐饮管理有限公司,,,,
连云港斯克斯机器人科技有限公司,,,,
连云港登泰实业有限公司,,,,
连云港华玺房地产有限公司,,,,
江苏伍江行贸易有限公司,,,,
灌南碧桂园房地产开发有限公司,,,,
连云港澄鑫化工有限公司,,,,
连云港聿丰环保科技有限公司,,,,
连云港光大化学有限公司,,,,
连云港利隆实业有限公司,,,,
江苏恒邦药业有限公司,,,,
连云港瑞丰化工有限公司,,,,
灌南嘉泰房地产开发有限公司,,,,
江苏金科企业管理有限公司,,,,
国农生物肥料连云港有限责任公司,,,,
连云港金玖门窗有限公司,,,,
江苏江悦环保科技有限公司,,,,
连云港腾鹿医用包装材料有限公司,,,,
江苏中理检验认证有限公司,,,,
连云港市福地房地产投资有限公司,,,,
连云港中重重型机械有限责任公司,,,,
江苏盈晟环境科技有限公司,,,,
连云港市华伦化工有限公司,,,,
连云港祥弘国际货运代理有限公司,,,,
连云港德云纺织品贸易有限公司,,,,
连云港恒大物流有限公司,,,,
江苏盖亚高分子新材料有限公司,,,,
江苏富山环保科技有限公司,,,,
江苏斑马快跑出租汽车有限公司,,,,
江苏金墨源国际贸易有限公司,,,,
连云港康润置业有限公司,,,,
连云港苏岩再生资源有限公司,,,,
连云港利睿享升商贸有限公司,,,,
江苏营展物业管理有限公司,,,,
连云港裕科机械制造有限公司,,,,
江苏爱之源建筑材料有限公司,,,,
灌南县景磊建筑工程有限公司,,,,
江苏世持贸易有限公司,,,,
江苏方润环保科技有限公司,,,,
江苏孔硕建筑安装工程有限公司,,,,
江苏万旺贸易有限公司,,,,
江苏威发建设工程有限公司,,,,
江苏裕灌包装材料有限公司,,,,
灌南亚胜包装材料销售有限公司,,,,
连云港昌隆置业有限公司,,,,
江苏朗恒木业有限公司,,,,
灌南县金汕角酒店有限公司,,,,
连云港天马物流有限公司,,,,
灌南县爱凤拆迁有限公司,,,,
连云港乐源机动车配件有限公司,,,,
灌南国法苗木种植有限公司,,,,
连云港康隆建筑工程有限公司,,,,
江苏硕悟建设有限公司,,,,
江苏博锐新材料有限公司,,,,
连云港群合贸易有限公司,,,,
江苏摇钱树生态农业科技有限公司,,,,
连云港广鹏木业有限公司,,,,
江苏金镶玉竹旅游用品有限公司,,,,
连云港畅缘机械设备有限公司,,,,
江苏众挺线缆有限公司,,,,
连云港昱亿电子有限公司,,,,
灌南县第二中学,,,,
江苏三姑食用菌有限公司,,,,
连云港华恒包装材料有限公司,,,,
连云港倍达利基础工程有限公司,,,,
连云港永尚管道工程有限公司,,,,
连云港迪耀贸易有限公司,,,,
江苏亿特国际货运代理有限公司,,,,
连云港同行电动车科技有限公司,,,,
连云港乐誉化工设备有限公司,,,,
连云港能旺建设有限公司,,,,
连云港钜盛矿产品销售有限公司,,,,
连云港西游科技创意有限公司,,,,
连云港市盈鼎机械制造有限公司,,,,
江苏磐冈工程机械租赁有限公司,,,,
镇江市浩发新能源科技有限公司,,,,
江苏王老二生态农业有限公司,,,,
江苏hh鸣科技服务有限公司,,,,
江苏省渝奥置业有限公司,,,,
连云港海储国际贸易有限公司,,,,
连云港市昌斌建筑安装工程有限公司,,,,
江苏怡福文化传播有限公司,,,,
连云港明志再生资源有限公司,,,,
江苏帝邦智友汇教育咨询有限公司,,,,
连云港吉润新能源科技有限公司,,,,
连云港众亿达企业孵化器有限公司,,,,
江苏]昊国际贸易有限公司,,,,
连云港港跃国际贸易有限公司,,,,
灌南顶立新材料科技有限公司,,,,
江苏传寿连能源物资有限公司,,,,
连云港祝万国际海运有限公司,,,,
连云港广腾建筑工程有限公司,,,,
江苏康之堂药业有限公司,,,,
江苏骏森国际货运代理有限公司,,,,
江苏特思普服务外包有限公司,,,,
连云港鑫茂国际贸易有限公司,,,,
江苏台耀建设工程有限公司,,,,
江苏雄风文化传媒有限公司,,,,
连云港铸亮物流有限公司,,,,
江苏恒之华贸易有限公司,,,,
江苏新胜建筑材料销售有限公司,,,,
江苏韶源进出口贸易有限公司,,,,
江苏集速驰环保科技有限公司,,,,
江苏傲来建筑工程有限公司,,,,
江苏酱酒世家酒业有限公司,,,,
连云港飞优贸易有限公司,,,,
江苏聚亿港务有限公司,,,,
江苏科华建筑劳务有限公司,,,,
江苏伊创文化发展有限公司,,,,
连云港盛莆木业有限公司,,,,
江苏晨点广告服务有限公司,,,,
连云港一君钢化玻璃有限公司,,,,
江苏阔享建设工程有限公司,,,,
江苏嘉桢商贸有限公司,,,,
连云港广兵新能源科技发展有限公司,,,,
江苏汤家沟酒业有限公司,,,,
江苏海桉建设工程有限公司,,,,
连云港纳锐斯建材有限公司,,,,
灌南县爱威夫管业有限公司,,,,
江苏瑞蕊环保科技有限公司,,,,
江苏品川安全科技有限公司,,,,
连云港盈嘉建筑劳务有限公司,,,,
