江苏鑫洪福建筑工程有限公司,,,,
连云港炎华农业科技开发有限公司,,,,
连云港鑫士浩景实业有限公司,,,,
江苏海啸信息资讯有限公司,,,,
连云港琼包装材料有限公司,,,,
茬牌酒股份有限公司,,,,
江苏鸿晟石化有限公司,,,,
翔士鑫新材料科技（连云港）有限公司,,,,
连云港众合文化城开发有限公司,,,,
江苏此生缘酒业集团有限公司,,,,
江苏泽富电力燃料有限公司,,,,
江苏广超金属材料有限公司,,,,
连云港万普贸易有限公司,,,,
连云港白龙涧风景区管理有限公司,,,,
连云港恒灌实业投资有限公司,,,,
江苏谱牒博物馆运营管理有限公司,,,,
江苏省连云港环境监测中心,,,,
连云港市海州湾小学,,,,
连云港正大农牧发展有限公司,,,,
连云港诺通企业资产管理合伙企业（有限合伙）,,,,
连云港合创节能科技有限公司,,,,
连云港苏锦混凝土制品有限公司,,,,
连云港光伸置业有限公司,,,,
连云港市连通路桥工程有限公司,,,,
江苏东大食品有限公司,,,,
江苏钰峰电力工程有限公司,,,,
连云港美通科技发展有限公司,,,,
连云港盛金鹏皓股权投资基金合伙企业（有限合伙）,,,,
江苏两相赢酒业有限公司,,,,
连云港三和油气储运设备有限公司,,,,
灌南大宇食品有限公司,,,,
连云港德立信包装材料有限公司,,,,
江苏传承中药有限公司,,,,
连云港笃翔化工有限公司,,,,
江苏晨旭东方广告有限公司,,,,
连云港固特建设有限公司,,,,
江苏恒好供应链管理有限公司,,,,
江苏伦邦环境工程有限公司,,,,
灌南县金诚船务有限公司,,,,
江苏智云健康管理有限公司,,,,
灌南县高达置业有限公司,,,,
江苏省利金新材科技有限公司,,,,
江苏兴腾建设有限公司,,,,
连云港联讯仓储有限公司,,,,
连云港一带一路综合保税服务有限公司,,,,
连云港市米沃奇五金工具有限公司,,,,
灌南福旺全屋定制家居有限公司,,,,
江苏鑫天向供应链管理有限公司,,,,
江苏客丰家具有限公司,,,,
连云港娜鸾ㄖ劳务有限公司,,,,
灌南阔金靖新能源有限公司,,,,
连云港万特科技有限公司,,,,
连云港东来装饰材料有限公司,,,,
连云港端固钢结构工程有限公司,,,,
灌南海胜铜业科技有限公司,,,,
连云港经济技术开发区建设工程检测中心有限公司,,,,
连云港中冠新材料科技有限公司,,,,
江苏耕润建筑工程有限公司,,,,
连云港常永建筑劳务分包有限公司,,,,
连云港恒旺五金工具制造有限公司,,,,
江苏端泽实业有限公司,,,,
连云港智慧城市路演文化有限公司,,,,
连云港盈泰纺织印染科技有限公司,,,,
江苏启路智能科技有限公司,,,,
江苏林虎建设工程有限公司,,,,
连云港浩飞新能源有限公司,,,,
连云港昭文鞋业有限公司,,,,
连云港味美顺食品有限公司,,,,
连云港宏伦贸易有限公司,,,,
灌南华诚物流有限公司,,,,
连云港泓源消防器材有限公司,,,,
江苏巨鑫国际货运代理有限公司,,,,
灌南县景添建筑工程有限公司,,,,
江苏偌熙建设工程有限公司,,,,
连云港品致机电工程有限公司,,,,
江苏瑞美嘉贸易有限公司,,,,
江苏海棣自控科技有限公司,,,,
江苏锦迎腾实业有限公司,,,,
连云港唐港实业发展有限公司,,,,
连云港尚润商贸有限公司,,,,
爱柔皙（连云港）环保科技有限公司,,,,
江苏东方巨龙酒业有限公司,,,,
江苏勤志贸易有限公司,,,,
江苏二连建设工程有限公司,,,,
连云港东安机电工程有限公司,,,,
江苏汤讲酒业有限公司,,,,
连云港川谷食品科技有限公司,,,,
江苏风清网络科技有限公司,,,,
连云港天裕物流有限公司,,,,
江苏手挽手实业有限公司,,,,
江苏摇钱树汽车销售服务有限公司,,,,
江苏拓域矿业有限公司,,,,
灌南县荣丰新型建材有限公司,,,,
连云港市前途建设工程有限公司,,,,
江苏世工建设工程有限公司,,,,
连云港建辉电子有限公司,,,,
江苏蓝象广告传媒有限公司,,,,
阿肯医视云网络信息（江苏）有限公司,,,,
连云港同道信息科技有限公司,,,,
江苏新圣田建设工程有限公司,,,,
江苏精玉掌网络科技有限公司,,,,
连云港和文贸易有限公司,,,,
江苏雪发金属制品有限公司,,,,
连云港华磊吊装有限公司,,,,
灌南县和泽再生资源有限公司,,,,
江苏宁连物流有限公司,,,,
连云港市世德建材有限公司,,,,
江苏普瑞建设工程有限公司,,,,
江苏嵩林碳素有限公司,,,,
连云港市睿乾机械设备有限公司,,,,
江苏云动通风设备安装工程有限公司,,,,
江苏千农桦农业科技有限公司,,,,
江苏予慕文旅科技发展有限公司,,,,
连云港细推国际贸易有限公司,,,,
江苏野生源农业科技发展有限公司,,,,
连云港市亚诺门窗有限公司,,,,
江苏一体华企业管理咨询有限公司,,,,
连云港三邦贸易有限公司,,,,
江苏六日电气有限公司,,,,
连云港益恒投资有限公司,,,,
江苏东岸国际贸易有限公司,,,,
灌南润森农业科技有限公司,,,,
江苏禅之味文化传媒有限公司,,,,
江苏品创自动化科技有限公司,,,,
豪海能源（江苏）有限公司,,,,
江苏捷盛杰建设工程有限公司,,,,
江苏泽之润贸易有限公司,,,,
江苏保军智能锁业有限公司,,,,
景锋（江苏）信息科技有限公司,,,,
连云港丰超贸易有限公司,,,,
江苏李小毛吊装搬运有限公司,,,,
江苏卓善建设工程有限公司,,,,
江苏本航工程有限公司,,,,
江苏连发安装有限公司,,,,
连云港港川煤炭有限公司,,,,
江苏众晟物流供应链管理有限公司,,,,
鹏锦石油化工贸易（江苏）有限公司,,,,
连云港海诺贸易有限公司,,,,
江苏普远量化科技有限公司,,,,
江苏拓享建筑工程有限公司,,,,
江苏涵凯贸易有限公司,,,,
灌南县大观园果树种植专业合作社,,,,
