江苏求真教育科技集团有限公司,,,,
江苏欧美斯国际贸易有限公司,,,,
江苏杨辉物业服务有限公司,,,,
连云港双惠机械有限公司,,,,
江苏东晟装饰设计工程有限公司,,,,
连云港振兴景观绿化工程有限公司,,,,
连云港清源物业服务有限公司,,,,
江苏德发房车科技有限公司,,,,
江苏津渡路桥工程有限公司,,,,
江苏省白集矿山机械销售中心,,,,
江苏昌润房地产开发有限公司,,,,
连云港红玫瑰文化艺术发展有限公司,,,,
连云港宝宏物业管理有限公司,,,,
连云港市益品佳贸易有限公司,,,,
江苏新巨隆项目管理有限公司,,,,
连云港上铁房地产开发有限公司,,,,
江苏广之煜建设工程有限公司,,,,
江苏东浦医药包装股份有限公司,,,,
江苏夯筑建设科技有限公司,,,,
江苏顺疏消防技术服务有限公司,,,,
连云港磐信环保设备工程有限公司,,,,
连云港海州物流有限公司,,,,
江苏高歌新材料有限公司,,,,
博雅（江苏）供应链管理有限公司,,,,
江苏特弘电力工程有限公司,,,,
连云港市连锡建设有限公司,,,,
连云港功成建设投资有限公司,,,,
连云港市凤鸣湖建筑安装工程有限公司,,,,
江苏高沛建筑工程有限公司,,,,
江苏省高速公路交通运输执法总队宁连支队,,,,
连云港润林电力设备有限公司,,,,
连云港汉和现代农业服务有限公司,,,,
江苏白塔装备制造有限公司,,,,
江苏昌崇建设工程有限公司,,,,
江苏东驰置业有限公司,,,,
连云港筑优混凝土有限公司,,,,
连云港恒泽工程劳务有限公司,,,,
江苏绿彩新旅高效生态农业综合开发有限公司,,,,
连云港中久建设工程有限公司,,,,
博鹏环保科技江苏有限公司,,,,
江苏巨生建筑安装工程有限公司,,,,
江苏奇知源工程项目管理咨询有限公司,,,,
连云港市农发水利投资有限公司,,,,
连云港瑞志建设工程有限公司,,,,
江苏淘巧超市有限公司,,,,
连云港长明装璜安装工程有限公司,,,,
连云港市久诚餐饮管理有限公司,,,,
连云港新云电力机械有限公司,,,,
江苏华祥建材有限公司,,,,
连云港市环境监测监控中心,,,,
连云港百益投资有限公司,,,,
江苏鑫邑福酒店管理有限公司,,,,
江苏铂诗顿贸易有限公司,,,,
江苏新时光生物科技有限公司,,,,
连云港广和置业有限公司,,,,
江苏花果山物业服务有限公司,,,,
江苏国栋装饰工程有限公司,,,,
江苏恩联节能设备有限公司,,,,
连云港市双岳电力设备有限公司,,,,
江苏朝博建筑工程有限公司,,,,
江苏联诺建设工程有限公司,,,,
连云港南拓建设工程有限公司,,,,
连云港苏锦农业科技有限公司,,,,
江苏威尔阀门有限公司,,,,
江苏柯亚建设工程有限公司,,,,
江苏中云建材有限公司,,,,
连云港市红十字中心血站,,,,
江苏酷盟科技有限责任公司,,,,
连云港润水工程检测有限公司,,,,
江苏淼阔建设工程有限公司,,,,
连云港晶富建筑工程有限公司,,,,
江苏歆馨泽建设有限公司,,,,
连云港宝顺建筑工程有限公司,,,,
风暴文化传媒（连云港）有限公司,,,,
江苏石上禾建筑装饰有限公司,,,,
江苏旭轩鼎建筑工程有限公司,,,,
江苏朐润建设有限公司,,,,
江苏智之莱建设有限公司,,,,
江苏建研新材料有限公司,,,,
江苏迈立恒钢结构有限公司,,,,
连云港优彩装饰工程有限公司,,,,
江苏凡酷建设有限公司,,,,
江苏海大广告装饰集团有限公司,,,,
江苏魁元计算机科技有限公司,,,,
江苏松栽傲纸ㄉ栌邢薰司,,,,
连云港市海想新材料有限公司,,,,
连云港沿海钢铁物流有限公司,,,,
江苏山语装饰有限公司,,,,
中腾国能（连云港）新能源科技有限公司,,,,
连云港博辉安防科技有限公司,,,,
连云港市野仙茶叶有限公司,,,,
江苏福喜富霖科技有限公司,,,,
江苏维豪鑫华生态科技有限公司,,,,
江苏恒医疗器械有限公司,,,,
江苏千峰建筑安装工程有限公司,,,,
江苏金之诺建设有限公司,,,,
江苏恒之铎建设工程有限公司,,,,
江苏屹泰喜建设工程有限公司,,,,
连云港市荣昌化工有限公司,,,,
江苏锦珩瑞建设有限公司,,,,
江苏星丰亚建设有限公司,,,,
江苏岚旗环保科技有限公司,,,,
江苏田利龙生物科技有限公司,,,,
江苏云杨项目管理有限公司,,,,
连云港朐海酒店管理有限公司,,,,
铭阳（江苏）生态科技有限责任公司,,,,
江苏海博照明电器有限公司,,,,
江苏俊宸资产价格评估有限公司,,,,
连云港翰贡将建设工程有限公司,,,,
江苏先有康健康服务有限公司,,,,
江苏品初建设有限公司,,,,
江苏博格智能科技有限公司,,,,
连云港聚巨宝贸易有限公司,,,,
连云港市丰隆电子工程有限公司,,,,
连云港市汇德商务信息咨询有限公司,,,,
江苏百晓生企业管理咨询有限公司,,,,
江苏港骏实业有限公司,,,,
江苏杰迅贸易有限公司,,,,
江苏亚个福建设工程有限公司,,,,
连云港文鸿工程管理有限公司,,,,
连云港畅恒环境工程有限公司,,,,
江苏童尚美容服务有限公司,,,,
连云港市希门自动化电器设备有限公司,,,,
江苏满业建材有限公司,,,,
连云港市鼎发物流有限公司,,,,
连云港市林玖实业有限公司,,,,
江苏斯塔福进出口贸易有限公司,,,,
连云港林泰企业管理咨询有限公司,,,,
江苏兴唐创远通信科技有限公司,,,,
博智（江苏）特种设备检测有限公司,,,,
连云港龙标影视文化传媒有限公司,,,,
江苏广盛元进出口贸易有限公司,,,,
江苏奥巨建设工程有限公司,,,,
连云港北固企业咨询有限公司,,,,
江苏紫玉墨晶建设工程有限公司,,,,
江苏树德装饰工程有限公司,,,,
江苏天鲜配餐饮管理服务有限公司,,,,
江苏维丰门业有限公司,,,,
江苏白鲨新能源环保科技有限公司,,,,
江苏连天下餐饮管理有限公司,,,,
江苏帝人实业有限公司,,,,
江苏远楚生物科技有限公司,,,,
江苏铭c亮化工程有限公司,,,,
连云港龙泰建筑工程有限公司,,,,
江苏怀文建材有限公司,,,,
连云港耀派建筑工程有限公司,,,,
连云港禾耀药业有限公司,,,,
江苏悦联工程项目管理有限公司,,,,
江苏硕城商业发展有限公司,,,,
江苏拓玛酒店用品贸易有限公司,,,,
江苏迈康信息技术有限公司,,,,
江苏跃亚机械设备租赁有限公司,,,,
连云港源荣自动化设备有限公司,,,,
江苏达斌科技有限公司,,,,
江苏鹏成之峰餐饮管理有限公司,,,,
江苏派和置业有限公司,,,,
江苏南涵标牌制作有限公司,,,,
江苏唐庭企业管理有限公司,,,,
江苏晖和建设工程有限公司,,,,
江苏天丽源环保科技有限公司,,,,
江苏科冠企业管理有限公司,,,,
连云港泰坤建筑工程有限公司,,,,
江苏徽商国际贸易有限公司,,,,
江苏辰沛建设工程有限公司,,,,
江苏恒末珠宝销售有限公司,,,,
江苏万联农业发展有限公司,,,,
江苏元睿物业服务有限公司,,,,
连云港市连云区墟沟经济发展总公司,,,,
江苏根源市政园林工程有限公司,,,,
连云港华德国际货运代理有限公司,,,,
连云港盛富达建设工程有限公司,,,,
江苏金石阳光环保科技有限公司,,,,
江苏凌丹实业有限公司,,,,
连云港市聚鑫源物流有限公司,,,,
连云港前岛水产养殖有限公司,,,,
连云港郁港保税服务有限公司,,,,
江苏慷智信息有限公司,,,,
江苏恒为能源有限公司,,,,
连云港锦鹏国际贸易有限公司,,,,
连云港蒙鲜达供应链有限公司,,,,
连云港生物工程中等专业学校,,,,
连云港星潮建设工程有限公司,,,,
连云港雷霆汽车租赁服务有限公司,,,,
江苏震洲石化有限公司,,,,
连云港瑞博尔新能源电力科技有限公司,,,,
连云港核润电气工程有限公司,,,,
连云港嘉美汽车有限公司,,,,
连云港苏冠国际贸易有限公司,,,,
亿尚景环保科技（连云港）有限公司,,,,
连云港云艺建筑工程有限公司,,,,
江苏同科广告传媒有限公司,,,,
连云港鑫辉建设工程机械租赁有限公司,,,,
江苏睿远企业服务有限公司,,,,
连云港诚益进出口有限公司,,,,
连云港新君工程安装有限公司,,,,
江苏润邦供应链管理有限公司,,,,
连云港力源矿业有限公司,,,,
江苏月久工程造价咨询有限公司,,,,
江苏古蒙建设工程有限公司,,,,
江苏亚坤机电设备有限公司,,,,
江苏如壹能源有限公司,,,,
连云港朱麻石材有限公司,,,,
连云港瑞怡酒店有限公司,,,,
江苏恒硕租赁有限公司,,,,
江苏桐曜生物技术有限公司,,,,
连云港连硕建筑劳务有限公司,,,,
连云港优鼎建设工程有限公司,,,,
江苏港工建筑工程有限责任公司,,,,
江苏品瑞再生资源有限公司,,,,
江苏柯源医疗器械有限公司,,,,
连云港尚滕装卸有限公司,,,,
江苏远坤能源科技有限公司,,,,
江苏百瑞利建设工程有限公司,,,,
连云港学勤装饰工程有限公司,,,,
江苏信圣石化有限公司,,,,
江苏方诺金思网络科技有限公司,,,,
江苏布润特建筑装饰有限公司,,,,
江苏安驰石化有限公司,,,,
连云港荣海国际船舶代理有限公司,,,,
江苏华盈能源有限公司,,,,
江苏飞智纺织品贸易有限公司,,,,
江苏金翠铂珠宝有限公司,,,,
连云港裕诚能源化工有限公司,,,,
江苏泰坤石化有限公司,,,,
江苏优拓供应链管理有限公司,,,,
江苏熙圣誉实业发展有限公司,,,,
一诺粮谷（江苏）食品有限公司,,,,
江苏航之锦建设工程有限公司,,,,
连云港泽信诚环境建设有限公司,,,,
江苏震天海援安全科技有限公司,,,,
江苏文之善商贸有限公司,,,,
东海县路桥工程有限公司,,,,
江苏汇祥食品有限公司,,,,
连云港明昊电子有限公司,,,,
江苏美特森切削工具有限公司,,,,
连云港易景房地产开发有限公司,,,,
江苏中农农业科技股份有限公司,,,,
连云港索欧服饰有限公司,,,,
江苏玖盟联飞化工有限公司,,,,
江苏五洋碳氢科技有限公司,,,,
连云港隆和矿产有限公司,,,,
乐美加日用品（连云港）有限公司,,,,
连云港丰东管桩有限公司,,,,
江苏泰同食品有限公司,,,,
东海县万晨新材料科技有限公司,,,,
连云港旭福置业有限公司,,,,
灌云连庆工程器材有限公司,,,,
灌云县润谷粮油贸易有限公司,,,,
连云港宵洋物流有限公司,,,,
江苏九德建设工程有限公司,,,,
江苏纳华光伏材料有限公司,,,,
江苏通旭建设工程有限公司,,,,
江苏玖兴型材有限公司,,,,
江苏大凯工程劳务有限公司,,,,
江苏垒尔建设工程有限公司,,,,
连云港远望汽车销售服务有限公司,,,,
江苏东万生物技术有限公司,,,,
江苏瑞曼照明电器有限公司,,,,
江苏宝芝林多抗生物工程技术研究有限公司,,,,
连云港食源紫菜有限公司,,,,
灌云县明强风力发电有限公司,,,,
连云港磊康建设工程有限公司,,,,
连云港于利高粮食贸易有限公司,,,,
江苏尹道真实业发展有限公司,,,,
东海县天鹅园粮食有限公司,,,,
江苏杨集粮食储备有限公司,,,,
江苏斯库特节能环保设备有限公司,,,,
连云港源广建筑劳务有限公司,,,,
江苏碳硅新材料科技有限公司,,,,
江苏百富勤电器有限公司,,,,
东海县丰谷粮食生产专业合作联社,,,,
东海县同亮照明电器有限公司,,,,
连云港昊坤建设工程有限公司,,,,
连云港巨龙机械装备有限公司,,,,
连云港建翔建设工程有限公司,,,,
连云港金宝铝业有限公司,,,,
连云港亚锐管件有限公司,,,,
东海县恒源木业有限公司,,,,
江苏茂诰建设工程有限公司,,,,
连云港忠发船务有限公司,,,,
东海县禹岳山泉水有限公司,,,,
连云港市龙文建筑工程有限公司,,,,
连云港惠果石英制品有限公司,,,,
连云港市爱的宝教育辅导培训有限公司,,,,
江苏艺厚建设有限公司,,,,
东海县晶和酒店管理有限公司,,,,
江苏欧洋精密模具有限公司,,,,
连云港尚米企业管理有限公司,,,,
江苏棉木建筑工程有限公司,,,,
连云港邦德建筑劳务有限公司,,,,
江苏小欢喜珠宝有限公司,,,,
江苏硕联电子科技有限公司,,,,
江苏硕邦农业发展有限公司,,,,
连云港正大果蔬贸易有限公司,,,,
连云港生春重工机械有限公司,,,,
灌云政文耐火材料有限公司,,,,
江苏大群医疗器械有限公司,,,,
江苏酷源建设工程有限公司,,,,
江苏宏之运建筑工程有限公司,,,,
连云港千大实业有限公司,,,,
江苏科智信自控设备有限公司,,,,
连云港奥内斯特进出口有限公司,,,,
东海县创启秸秆综合利用有限公司,,,,
江苏满旺建设工程有限公司,,,,
东海润云商贸有限公司,,,,
江苏宝千医疗器械销售有限公司,,,,
灌云鑫利建设工程有限公司,,,,
连云港光亿馨建筑劳务有限公司,,,,
江苏云孔建设工程有限公司,,,,
江苏远铭家具有限公司,,,,
连云港东海县亿祥新型建材有限公司,,,,
江苏润亿服饰有限公司,,,,
连云港倩雯传媒有限公司,,,,
连云港义之诺医疗器材销售有限公司,,,,
江苏创卫电电气科技有限公司,,,,
东海县福人吊装服务有限公司,,,,
连云港超骏物流有限公司,,,,
江苏茂多建设工程有限公司,,,,
连云港畅洲建筑劳务有限公司,,,,
连云港双佳实木家具有限公司,,,,
江苏法维诺科技有限公司,,,,
灌云县星球房地产有限公司,,,,
东海县绿品农业开发有限公司,,,,
东海县旁果水晶有限公司,,,,
江苏海红服装有限公司,,,,
东海县万庭装饰工程有限公司,,,,
东海县金泽建筑劳务有限公司,,,,
东海县佛冠建材有限公司,,,,
连云港焱炎能源有限公司,,,,
江苏创思博环保科技有限公司,,,,
连云港市飞达棉业有限公司,,,,
连云港超泰建设工程有限公司,,,,
东海县逸天装饰工程有限公司,,,,
连云港泰佳置业有限公司,,,,
江苏神汇新型陶瓷材料科技有限公司,,,,
东海县佐特石英制品有限公司,,,,
江苏周崔建设实业有限公司,,,,
连云港市巨阳新能源汽车有限公司,,,,
连云港博然建筑工程有限公司,,,,
连云港平梧新型建材有限公司,,,,
连云港市腾源建筑劳务分包有限公司,,,,
江苏厚鼎建设工程有限公司,,,,
东海县寻晶记文化传播有限公司,,,,
东海县喜豆食品有限公司,,,,
灌云晟嘉置业有限公司,,,,
东海县富春养牛专业合作社,,,,
江苏苏辽粮油贸易有限公司,,,,
连云港都市佳人商贸有限公司,,,,
连云港天倔建设工程有限公司,,,,
江苏富之路劳务服务有限公司,,,,
连云港立帅信息科技有限公司,,,,
连云港市振江电力科技有限公司,,,,
东海县晶度石英科技有限公司,,,,
连云港龙宝建筑工程有限公司,,,,
连云港爱刷智能科技有限公司,,,,
江苏佑康适老化家具有限公司,,,,
江苏帮教教学设备有限公司,,,,
连云港友发建筑工程有限公司,,,,
江苏森林新能源科技有限公司,,,,
江苏晨凯建设工程有限公司,,,,
江苏易灿中草药种植有限公司,,,,
连云港诚则信建设工程有限公司,,,,
东海县携烁水晶饰品有限公司,,,,
东海县云捷建设工程有限公司,,,,
江苏阳驰新能源科技有限公司,,,,
东海县诚拓建材有限公司,,,,
东海县岩雷建设工程有限公司,,,,
连云港茂发物业管理有限公司,,,,
东海县诚奥矿产品有限公司,,,,
连云港市成旺机车科技有限公司,,,,
江苏都港建设工程有限公司,,,,
江苏天峰建筑劳务有限公司,,,,
连云港富讯贸易有限公司,,,,
江苏行岭建筑劳务有限公司,,,,
灌云县碧广建材销售有限公司,,,,
连云港寇堂贸易有限公司,,,,
江苏支鹏百货便利有限公司,,,,
王会广告传媒工作江苏有限公司,,,,
东海县军凯建筑劳务有限公司,,,,
江苏开特建设工程有限公司,,,,
江苏亿般般景观绿化工程有限公司,,,,
灌云前锦稻麦种植家庭农场,,,,
江苏杨春芳工程机械租赁有限公司,,,,
江苏寿全工程有限公司,,,,
江苏洁纶生物医疗科技有限公司,,,,
江苏诺誉鑫建筑工程有限公司,,,,
连云港惠晶置业有限公司,,,,
江苏绍文广告装饰有限公司,,,,
江苏撒沃网络科技有限公司,,,,
连云港永湘源建筑材料销售有限公司,,,,
灌云帝景文化有限公司,,,,
连云港助民保洁服务有限公司,,,,
灌云雷明建材销售有限公司,,,,
灌云东旭服饰有限公司,,,,
江苏轩尼化工贸易有限公司,,,,
连云港金谛建设工程有限公司,,,,
雅讯（江苏）企业管理有限公司,,,,
连云港东升房产集团有限公司,,,,
连云港市华益建筑安装工程有限公司,,,,
江苏创联新型建材有限公司,,,,
连云港隆源海藻有限公司,,,,
连云港赣榆连隆房地产开发有限公司,,,,
连云港赣榆蓝湾海洋科技有限公司,,,,
连云港亲泰儿玩具有限公司,,,,
江苏海之渔现代渔业发展有限公司,,,,
连云港市赣榆商业总公司,,,,
连云港国腾环保科技有限公司,,,,
江苏玖壹辰诺投资有限公司,,,,
江苏淮港建设工程有限公司,,,,
连云港锦满天建材有限公司,,,,
连云港海恩电气有限公司,,,,
连云港华亿环境技术开发有限公司,,,,
连云港市冠超农业开发有限公司,,,,
江苏奥玛德肥业有限公司,,,,
连云港赣榆大安商业运营管理有限公司,,,,
连云港市点石资产经营管理有限公司,,,,
连云港市赣榆区石梁河灌区管理处,,,,
连云港兴锋电子材料科技有限公司,,,,
连云港市飞尔房地产开发有限公司,,,,
仟佰弘纺织（江苏）有限公司,,,,
连云港同章建筑材料销售有限公司,,,,
江苏苏阳太阳能科技有限公司,,,,
连云港锟岳冷链物流有限公司,,,,
连云港福满园塑料制造有限公司,,,,
连云港拓豪房地产开发有限公司,,,,
江苏万杰建设工程有限公司,,,,
江苏普瑞泽环保节能科技有限公司,,,,
连云港树华农业开发有限公司,,,,
连云港市青口中心小学,,,,
江苏沃田生物科技有限公司,,,,
连云港宝华新型建材有限公司,,,,
连云港康年健康体检中心有限公司,,,,
连云港哲浩建筑工程有限公司,,,,
江苏财铭商贸有限公司,,,,
连云港展彩建材销售有限公司,,,,
连云港苏久月食品有限公司,,,,
江苏励火环保科技有限公司,,,,
江苏丰智祥农业开发有限公司,,,,
江苏隆通建筑工程有限公司,,,,
江苏尊力新材料有限公司,,,,
连云港浩驰新材料科技有限公司,,,,
连云港宏泰镁业有限公司,,,,
连云港泓泉工程造价咨询有限公司,,,,
连云港德贤新能源科技有限公司,,,,
江苏爱得声乐器有限公司,,,,
江苏科发建设投资有限公司,,,,
连云港大爱无限建筑工程有限公司,,,,
江苏仁迪贸易有限公司,,,,
江苏万和装饰有限公司,,,,
连云港众润海洋经济开发有限公司,,,,
万象建筑设备租赁（江苏）有限公司,,,,
江苏艺家墅装饰工程有限公司,,,,
连云港普信建筑工程有限公司,,,,
江苏江峻昱投资有限公司,,,,
连云港市起飞水产有限公司,,,,
连云港帛翰金实业发展有限公司,,,,
连云港合寿建筑工程有限公司,,,,
江苏好邦家政服务有限公司,,,,
江苏建垒建筑工程有限公司,,,,
连云港地奎贸易有限公司,,,,
江苏冉点建设工程有限公司,,,,
连云港市恋文家庭农场,,,,
连云港市角落电子商务有限公司,,,,
江苏恒泰文化传媒有限公司,,,,
连云港诚轩拍卖有限公司,,,,
川军国际贸易（江苏）有限公司,,,,
连云港立德开元建筑工程有限公司,,,,
江苏南合北新材料科技有限公司,,,,
江苏凯祺拓商贸有限公司,,,,
江苏米乐智能科技有限公司,,,,
连云港佳恩特能源科技有限公司,,,,
江苏品派置业有限公司,,,,
连云港苏班建设工程有限公司,,,,
江苏j焱再生资源有限公司,,,,
江苏帆沐禾工程建设有限公司,,,,
江苏仟兴堂健康保健有限公司,,,,
连云港海科利特环境科技有限公司,,,,
连云港禾之祥实业发展有限公司,,,,
江苏磐之崇建筑工程有限公司,,,,
连云港双鑫包装科技有限公司,,,,
江苏轩之翔实业发展有限公司,,,,
江苏君循为实业发展有限公司,,,,
连云港鑫茂源房地产开发有限公司,,,,
连云港融合晟源建筑有限公司,,,,
连云港万胜新能源有限公司,,,,
连云港泰旭海洋科技有限公司,,,,
连云港兴之辰水产养殖有限公司,,,,
江苏山周建材销售有限公司,,,,
江苏常弘纸箱包装有限公司,,,,
江苏拓仁建设工程有限公司,,,,
连云港盛唐玩具有限公司,,,,
连云港艺轩农业开发有限公司,,,,
江苏金至福陵园管理有限公司,,,,
江苏瀚能新能源科技有限公司,,,,
连云港环远商贸有限公司,,,,
连云港赣榆蓬盛蔬菜种植专业合作社,,,,
连云港泽恩种养殖专业合作社,,,,
太阳雨集团有限公司,,,,
连云港市投资有限公司,,,,
江苏大匠建设工程有限公司,,,,
江苏省连云港汽车运输有限公司,,,,
连云港立本作物科技有限公司,,,,
江苏宝隆建设工程有限公司,,,,
江苏中建工程设计研究院有限公司,,,,
江苏君宸实业集团有限公司,,,,
江苏恒隆作物保护有限公司,,,,
连云港之星汽车销售有限公司,,,,
江苏方洋建设投资有限公司,,,,
中连投资控股有限公司,,,,
江苏洋井公用管廊有限公司,,,,
连云港港口物流有限公司,,,,
连云港福东正佑照明电器有限公司,,,,
江苏东海张农商村镇银行有限责任公司,,,,
江苏福如东海硅产业发展有限公司,,,,
连云港登宇实业有限公司,,,,
江苏丽鑫炭业有限公司,,,,
连云港科创不锈钢新材料有限公司,,,,
连云港雅玛珂紫菜有限公司,,,,
连云港鑫能污泥发电有限公司,,,,
江苏天展大发新材料股份有限公司,,,,
连云港聚鑫生物科技有限公司,,,,
连云港申轩智能电子科技有限公司,,,,
连云港利德电力设备有限公司,,,,
连云港市润银科技小额贷款有限公司,,,,
国能联合动力技术（连云港）有限公司,,,,
江苏中京电缆科技有限公司,,,,
连云港市苏明电器制造有限公司,,,,
连云港华德石油化工机械有限公司,,,,
连云港绿色动力新能源发展有限公司,,,,
连云港福东石英制品有限公司,,,,
江苏恒双自控设备制造有限公司,,,,
连云港港口国际石化港务有限公司,,,,
连云港中鸿包装有限公司,,,,
连云港润海经济发展有限公司,,,,
连云港赣榆奥杰贸易有限公司,,,,
江苏联港资产管理有限公司,,,,
江苏棚悦农业科技发展有限公司,,,,
惠通物产（连云港）机械设备有限公司,,,,
灌云畅茂农业开发有限公司,,,,
连云港旺旺食品有限公司,,,,
连云港市立丰木业有限公司,,,,
江苏素康生物科技有限公司,,,,
连云港市海城投资发展有限公司,,,,
连云港保利海连房地产开发有限公司,,,,
江苏连云港浦东国家粮食储备库有限公司,,,,
灌南县灌河交通项目建设管理有限公司,,,,
平高置业（连云港）有限公司,,,,
江苏国信灌云风力发电有限公司,,,,
连云港万茵绿化工程有限公司,,,,
连云港创大网络技术有限公司,,,,
连云港云山旅游发展有限公司,,,,
连云港亮晶新材料科技有限公司,,,,
连云港浦源工程管理有限公司,,,,
中研万科种业有限公司,,,,
江苏省连云港中医药高等职业技术学校,,,,
江苏蒙泰建设工程有限公司,,,,
江苏昆达国际贸易有限公司,,,,
连云港上合国际物流园开发有限公司,,,,
江苏森柏油脂有限公司,,,,
连云港鸿恒房地产开发有限公司,,,,
江苏杭南实业有限公司,,,,
江苏恩旺实业有限公司,,,,
东海县瑞晖新型材料有限公司,,,,
江苏振榆农业发展有限公司,,,,
连云港华魂实业有限公司,,,,
连云港亚旭矿业有限公司,,,,
江苏豪祥建设工程集团有限公司,,,,
连云港润德商业资产管理有限公司,,,,
江苏酩醍贸易有限公司,,,,
连云港恒赫机械设备租赁有限公司,,,,
连云港市赣榆区人民医院,,,,
方汇生物科技（泰州）有限公司,,,,
连云港恒建混凝土有限公司,,,,
东海县曼金实业有限公司,,,,
江苏久森能源有限公司,,,,
江苏启林化工设备制造有限公司,,,,
江苏时间新能源科技有限公司,,,,
连云港农旅农业发展有限公司,,,,
江苏金班汇置业有限公司,,,,
连云港大力新型建材有限公司,,,,
连云港市安老置业有限公司,,,,
连云港城阔木制品加工有限公司,,,,
连云港德实锦投资有限公司,,,,
灌云斗金米业有限公司,,,,
江苏永安汽车配件有限公司,,,,
江苏万光建筑工程有限公司,,,,
连云港枫香谷旅游开发有限公司,,,,
连云港市兴力船舶工程有限公司,,,,
连云港胜海建材有限公司,,,,
灌南国欧置业有限公司,,,,
江苏耘垦农业科技有限公司,,,,
江苏新纪联建设工程有限公司,,,,
江苏欧祥化工有限公司,,,,
连云港霖珀国际贸易有限公司,,,,
东海县梦古贸易有限公司,,,,
连云港巴宾商贸有限公司,,,,
江苏巩之成建设有限公司,,,,
江苏晟创供应链管理有限公司,,,,
若邦石油化工贸易（江苏）有限公司,,,,
灌南凡龙网络科技有限公司,,,,
连云港卓之立机械设备有限公司,,,,
连云港富国置业有限公司,,,,
