连云港市苍梧物业服务股份有限公司,,,,
连云港市天缘食品有限公司,,,,
连云港海通市民一卡通有限公司,,,,
连云港市花果山旅游公司,,,,
江苏联宇医疗器械有限公司,,,,
江苏力开建设集团有限公司,,,,
江苏连溧建设工程有限公司,,,,
连云港太平洋润辉光电科技有限公司,,,,
连云港祥源房地产开发有限公司,,,,
江苏峰尚投资发展股份有限公司,,,,
江苏寇三鲜餐饮管理有限公司,,,,
江苏北翱建设有限公司,,,,
江苏其利餐饮管理有限公司,,,,
连云港市云锦新能源科技有限公司,,,,
连云港市浦昌建筑工程有限公司,,,,
连云港天缘国际贸易有限公司,,,,
江苏亿银企业管理服务有限公司,,,,
连云港唐昌贸易有限公司,,,,
江苏捷善网络科技有限公司,,,,
连云港益洋建设工程有限公司,,,,
江苏贤东建设工程有限公司,,,,
连云港铸邦石化设备有限公司,,,,
连云港米谷建设工程有限公司,,,,
连云港九源医药有限公司,,,,
江苏铁顿建设工程有限公司,,,,
连云港鑫佳缘房地产开发有限公司,,,,
连云港力度实业有限公司,,,,
江苏宽小途建设工程有限公司,,,,
连云港金润电器有限公司,,,,
江苏汇邦纸业有限公司,,,,
江苏元尊建设工程有限公司,,,,
连云港怀德农业开发有限公司,,,,
连云港翰林壹号黄金珠宝有限公司,,,,
连云港市供销资产投资经营管理有限公司,,,,
江苏众联易付信息科技有限公司,,,,
连云港正航建筑劳务有限公司,,,,
连云港其泽商贸有限公司,,,,
江苏叶沁安建设工程有限公司,,,,
连云港市智立方装饰工程有限公司,,,,
江苏钧丰实业有限公司,,,,
江苏水卓建设工程有限公司,,,,
连云港恒驰建设工程有限公司,,,,
连云港迅途交通建设工程有限公司,,,,
连云港宝丽来装饰设计有限公司,,,,
连云港慷隆贸易有限公司,,,,
连云港邦能建设有限公司,,,,
江苏班匠防水工程有限公司,,,,
连云港市德开盈通企业管理有限公司,,,,
江苏鑫臻龙建设工程有限公司,,,,
连云港润连新型建材有限公司,,,,
江苏恒宸名业建设有限公司,,,,
江苏环奥物业管理有限公司,,,,
连云港全翔装饰工程有限公司,,,,
江苏佳得乐建设工程有限公司,,,,
江苏莫斯肯实业有限公司,,,,
连云港市东浦门窗有限公司,,,,
连云港兴乡环卫保洁有限公司,,,,
江苏夏水道环境科技有限公司,,,,
连云港拓联机电工程有限公司,,,,
连云港市九龙世贸城有限公司,,,,
江苏华之堂建设有限公司,,,,
连云港如是建筑劳务有限公司,,,,
江苏名庄传奇酒业有限公司,,,,
连云港市能佳机电设备有限公司,,,,
连云港速美欣网络科技有限公司,,,,
江苏造梦者医药科技有限公司,,,,
江苏博奥口腔门诊有限公司,,,,
江苏鸿之瑞建设有限公司,,,,
江苏金琮盈建设工程有限公司,,,,
连云港市精勤中心小学,,,,
江苏拾壹文化科技有限公司,,,,
江苏平安电梯销售有限公司,,,,
连云港市宏业生物科技有限公司,,,,
江苏众磊鑫塑业有限公司,,,,
江苏盈富企业管理有限公司,,,,
连云港同裕如实业有限公司,,,,
江苏安裕机电设备工程有限公司,,,,
江苏御向源建设工程有限公司,,,,
江苏荣道建设工程有限公司,,,,
江苏皇瑞建设工程有限公司,,,,
连云港腾奥贸易有限公司,,,,
连云港晶滢温泉产业投资有限公司,,,,
江苏德必思医疗器械销售有限公司,,,,
连云港市国荣建筑劳务工程有限公司,,,,
江苏佳朗实业有限公司,,,,
连云港摩卡乐娱乐有限公司,,,,
连云港悦海国际物流有限公司,,,,
连云港旭佳工程建设有限公司,,,,
江苏喜邦物业服务有限公司,,,,
江苏中三羊工程机械有限公司,,,,
连云港大合食品有限公司,,,,
连云港航森国际贸易有限公司,,,,
连云港港润港口工程有限公司,,,,
凯鸿针织服装（连云港）有限公司,,,,
江苏业通教育科技集团有限公司,,,,
江苏麒麟文化旅游发展有限公司,,,,
江苏青蓝文化传媒有限公司,,,,
江苏云驰供应链管理有限公司,,,,
江苏柘业节能科技有限公司,,,,
江苏汉耕机电设备有限公司,,,,
江苏帝翔工程机械租赁有限公司,,,,
江苏沪沃贸易有限公司,,,,
江苏群瑞建筑装饰有限公司,,,,
连云港超福建筑工程有限公司,,,,
连云港富驰物资贸易有限公司（原连云港市海州区物资公司）,,,,
连云港润勋景观绿化工程有限公司,,,,
江苏江报文化发展有限公司,,,,
连云港万顺电力工程有限公司,,,,
连云港角瑞国际贸易有限公司,,,,
连云港金石置业有限公司,,,,
连云港派瑞药业有限公司,,,,
连云港迅畅科技有限公司,,,,
江苏元之腾建设有限公司,,,,
江苏盖洛普企业管理有限公司,,,,
连云港维如路桥工程有限公司,,,,
江苏创汇文化传媒有限公司,,,,
连云港拓必胜实业有限公司,,,,
江苏枫树湾酒业有限公司,,,,
江苏奇卡酷科技有限公司,,,,
连云港未知装饰工程有限公司,,,,
江苏霖树湾建设有限公司,,,,
江苏康胜品信息科技有限公司,,,,
江苏龙跃知识产权服务有限公司,,,,
江苏海之云环境科技工程有限公司,,,,
江苏中诺名扬商标专利事务有限公司,,,,
连云港润展建筑工程有限公司,,,,
江苏军威建筑劳务工程有限公司,,,,
连云港鼎正石料有限公司,,,,
江苏中钦供应链管理有限公司,,,,
江苏兆赫建筑劳务有限公司,,,,
连云港海州农事通科技服务有限公司,,,,
江苏拓承环保科技有限公司,,,,
江苏中建海大建筑科技有限公司,,,,
江苏淮水工程管理有限公司,,,,
连云港诺展贸易有限公司,,,,
江苏汉尚致联服装贸易有限公司,,,,
江苏金泰达机电工程有限公司,,,,
江苏亚典汽贸有限公司,,,,
江苏奇方生化科技有限公司,,,,
连云港邦嘉乐贸易有限公司,,,,
连云港旭鼎建设工程有限公司,,,,
连云港锦云农业开发有限公司,,,,
连云港铭德药业有限公司,,,,
江苏思雅装饰工程有限公司,,,,
江苏邦鼎贸易有限公司,,,,
江苏华垦投资有限公司,,,,
江苏龙庭建筑工程有限公司,,,,
连云港青禾源农业开发有限公司,,,,
江苏慕雅国际贸易有限公司,,,,
江苏诺驰物业服务有限公司,,,,
连云港益翔盛建材有限公司,,,,
江苏润樽贸易有限公司,,,,
江苏福和慧餐饮管理有限公司,,,,
连云港大成农业技术发展有限公司,,,,
连云港市幸福路小学,,,,
润河山（江苏）实业有限公司,,,,
江苏阅文信息科技有限公司,,,,
中禾创（连云港）副食品有限公司,,,,
江苏千千物业服务有限公司,,,,
江苏禾众电子科技有限公司,,,,
连云港玄青舍商贸有限公司,,,,
江苏灰太狼传媒有限公司,,,,
江苏尚流文化传媒有限公司,,,,
江苏万色文化传媒有限公司,,,,
江苏拓茂建设有限公司,,,,
江苏美港装饰工程有限公司,,,,
江苏天眷售电有限公司,,,,
连云港家得福商贸有限公司,,,,
亚欧大陆桥国际商运股份有限公司,,,,
连云港市荣坤建筑工程有限公司,,,,
连云港群鑫工贸有限公司,,,,
江苏海州湾文教产业投资有限公司,,,,
连云港法起文化发展有限责任公司,,,,
连云港华意门窗制作有限公司,,,,
连云港市商港实业发展有限公司,,,,
连云港盛凯商业投资管理有限公司,,,,
江苏兆鱼积分宝信息科技股份有限公司,,,,
连云港宇源环保科技有限公司,,,,
连云港瑞磊工程建设有限公司,,,,
连云港市永忠物流有限公司,,,,
连云港傲莱仙境旅游发展有限公司,,,,
江苏中天汇源能源有限公司,,,,
江苏德瑞思国际贸易有限公司,,,,
连云港源来堂医药有限公司,,,,
连云港欧尼森国际贸易有限公司,,,,
江苏俊东石油化工有限公司,,,,
连云港东鑫企业资产管理有限公司,,,,
江苏云航智慧物流有限公司,,,,
江苏益鼎新材料科技有限公司,,,,
江苏鑫语工程项目管理有限公司,,,,
江苏月兆昕实业有限公司,,,,
江苏正瀛供应链管理有限公司,,,,
盈轩（连云港）咨询管理有限责任公司,,,,
江苏简一建筑工程有限公司,,,,
江苏华远国际货运代理有限公司,,,,
江苏天硕新能源科技有限公司,,,,
连云港华强国际船舶代理有限公司,,,,
连云港亿隆国际货运代理有限公司,,,,
连云港承前建筑工程有限公司,,,,
江苏首特科技发展有限公司,,,,
连云港恩泽兴港建设工程有限公司,,,,
江苏鑫垣能源有限公司,,,,
江苏汇良诚实业发展有限责任公司,,,,
江苏冠森酒业有限公司,,,,
连云港鑫鸿德商业运营管理有限公司,,,,
连云港天如商贸有限公司,,,,
江苏星展教育科技有限公司,,,,
连云港得油石化有限公司,,,,
江苏掌趣科技有限公司,,,,
江苏鸿创瑞祥企业管理服务有限公司,,,,
连云港森宇瀚国际物流有限公司,,,,
江苏鼎程石化有限公司,,,,
连云港乔莉贸易有限公司,,,,
江苏至善大数据有限公司,,,,
拼船网供应链管理（连云港）有限公司,,,,
连云港市中盛祥润矿业有限公司,,,,
连云港源源土石方工程建设有限公司,,,,
连云港恩西生物科技有限公司,,,,
江苏建双二手车交易有限公司,,,,
江苏宁航船舶燃料供应有限公司,,,,
江苏正明石油化工有限公司,,,,
连云港福瑞祥文化旅游有限公司,,,,
连云港安昌危险品运输有限公司,,,,
江苏万粟农业科技有限公司,,,,
连云港昌源建筑工程有限公司,,,,
江苏满鑫新能源工程技术有限公司,,,,
江苏亚欧国际物流有限公司,,,,
江苏北方仁正建筑工程有限公司,,,,
连云港荣诚化工产品有限公司,,,,
连云港市连云区英华双语学校,,,,
江苏蜀农石化有限公司,,,,
灌云恒润水利工程处,,,,
连云港马大姐食品有限公司,,,,
连云港市新禹水务工程有限公司,,,,
连云港科铭化工有限公司,,,,
江苏丽港稀土材料有限公司,,,,
连云港长源电力工程有限公司,,,,
江苏汇菇源生物科技有限公司,,,,
连云港市东海市政工程有限公司,,,,
连云港合兴化工有限公司,,,,
连云港海胜石料销售有限公司,,,,
江苏春晓医药化工科技有限公司,,,,
江苏良一电子科技有限公司,,,,
连云港市苏福石英制品有限公司,,,,
连云港晶州磁电设备有限公司,,,,
连云港艾立尔商贸有限公司,,,,
连云港鑫正光电科技有限公司,,,,
江苏天云查健康产业有限公司,,,,
东海县和安置业有限公司,,,,
连云港百菇源生物科技有限公司,,,,
江苏益谐建设工程有限公司,,,,
连云港菲爵贸易有限公司,,,,
江苏科源工程质量检测有限公司,,,,
江苏N亚新材料有限公司,,,,
江苏厚诰建设工程有限公司,,,,
江苏浣熊环保科技有限公司,,,,
江苏皓翱供应链管理有限公司,,,,
江苏翱锦供应链管理有限公司,,,,
连云港市艺林建设工程有限公司,,,,
连云港瑞森服饰有限公司,,,,
连云港沃农精密机械有限公司,,,,
江苏霈润现代农业开发有限公司,,,,
连云港和华置业有限公司,,,,
连云港鑫智顺商贸有限公司,,,,
连云港苏腾新材料科技有限公司,,,,
灌云县杨集高级中学,,,,
江苏克灵斯通网络技术有限公司,,,,
连云港杰强建材销售有限公司,,,,
灌云牧盛水泥制品有限公司,,,,
东海县鹏宇渣土运输有限公司,,,,
连云港在水一方农业开发有限公司,,,,
连云港至联房地产有限公司,,,,
连云港市锦程置业有限公司,,,,
东海县腾辉石英材料有限公司,,,,
灌云县融媒体中心,,,,
连云港众投餐饮管理有限公司,,,,
江苏宝久建设工程有限公司,,,,
连云港复云微纸业有限公司,,,,
东海县桃林中心小学,,,,
连云港鲲鹏广告装饰工程有限公司,,,,
东海县房山镇希望稻麦种植专业合作社,,,,
连云港洁美佳环境卫生管理有限公司,,,,
东海县万联水务工程有限公司,,,,
连云港汇眸电子商务有限公司,,,,
东海县质优建设工程有限公司,,,,
灌云晟宇置业有限公司,,,,
东海县方圆房地产开发有限公司,,,,
连云港华达置业有限公司,,,,
连云港君和实业有限公司,,,,
连云港途达机械制造有限公司,,,,
江苏润谷香米业有限公司,,,,
连云港慈元阁贸易有限公司,,,,
江苏五之鱼实业发展有限公司,,,,
连云港世科建筑工程有限公司,,,,
东海县御福旅游发展有限公司,,,,
连云港东澄国际贸易有限公司,,,,
汇茂网络科技（东海）有限公司,,,,
江苏孚莱孚新材料有限公司,,,,
连云港东裕盛装饰工程有限公司,,,,
连云港迈佳化工有限公司,,,,
江苏永强金属材料有限公司,,,,
灌云万源灯具有限公司,,,,
东海县南山光大投资有限公司,,,,
东海县恒昌石英科技有限公司,,,,
江苏元巢建筑材料有限公司,,,,
连云港云度信息科技有限公司,,,,
连云港智鲲健身器材有限公司,,,,
连云港锦富荣环保科技有限公司,,,,
江苏若云文化科技有限公司,,,,
江苏汪传飞实业有限公司,,,,
江苏中源珠宝玉石检测有限公司,,,,
江苏帕克英包装有限公司,,,,
江苏R晴餐饮有限公司,,,,
江苏邦超物业管理有限公司,,,,
江苏文祥肥业有限公司,,,,
东海县硕冠商贸有限公司,,,,
江苏润银商务信息咨询有限公司,,,,
连云港蜗牛集装箱制造有限公司,,,,
连云港泛东贸易有限公司,,,,
东海县昶佳实业有限公司,,,,
连云港鑫丰源房地产开发有限公司,,,,
江苏健捷医药科技有限公司,,,,
连云港宇成农业开发有限公司,,,,
连云港卫龙建筑工程有限公司,,,,
东海县天狼装潢工程有限公司,,,,
东海县华江生态农业有限公司,,,,
连云港市辣香汇餐饮有限公司,,,,
灌云五谷香果蔬种植有限公司,,,,
连云港迅畅文化传媒有限公司,,,,
东海县国宇建筑劳务有限公司,,,,
连云港筑匠基础工程有限公司,,,,
灌云北枫农业发展有限公司,,,,
江苏恩曼管道设备有限公司,,,,
连云港市佰乐食品有限公司,,,,
连云港满园春园林绿化工程有限公司,,,,
江苏麦迪克思生物科技有限公司,,,,
江苏图特光电科技有限公司,,,,
连云港市恒惠粮食贸易有限公司,,,,
江苏华清订制衣柜专卖有限公司,,,,
江苏安而拓贸易有限公司,,,,
江苏班帝门窗科技有限公司,,,,
连云港丰氏起重吊装有限公司,,,,
连云港刘成兵建筑材料有限公司,,,,
江苏诺鹏建筑工程有限公司,,,,
江苏田螺湾农业开发有限公司,,,,
东海县程鹏起重吊装有限公司,,,,
连云港英正生物科技有限公司,,,,
连云港畅凯建设工程有限公司,,,,
江苏亚特奇建设工程有限公司,,,,
江苏杰阳医疗器械有限公司,,,,
东海县社教石英制品有限公司,,,,
江苏于发好景观园林绿化工程有限公司,,,,
江苏森之宇物业管理有限公司,,,,
江苏绿灯广告装饰工程有限公司,,,,
江苏长乐影视传媒有限公司,,,,
江苏仁曦建筑工程有限公司,,,,
连云港鑫亿佰实业有限公司,,,,
江苏筑必森沥青工程有限公司,,,,
连云港腾超建设工程有限公司,,,,
连云港安杨新材料有限公司,,,,
江苏草登生物科技有限公司,,,,
东海县阔洋珠宝有限公司,,,,
连云港森贝建筑工程有限公司,,,,
东海县东巨珠宝有限公司,,,,
连云港市灌云县厚星废旧家电收购有限公司,,,,
连云港满顺建设工程有限公司,,,,
江苏涵洋塑业有限公司,,,,
江苏宁松生物科技有限公司,,,,
江苏平源建筑劳务有限公司,,,,
东海县斐奥建筑工程有限公司,,,,
连云港千能汽车贸易有限公司,,,,
东海县成泰酒店管理有限公司,,,,
东海县旺展石料有限公司,,,,
江苏丰而盈贸易有限公司,,,,
东海县卓金珠宝有限公司,,,,
东海县勤拙商贸有限公司,,,,
连云港春泉建筑装饰工程有限公司,,,,
连云港六鼎工程机械租赁有限公司,,,,
江苏祥祥农资贸易有限公司,,,,
连云港汉威建设工程有限公司,,,,
江苏沁旺内衣加工有限公司,,,,
东海县君创房地产有限公司,,,,
连云港驰铭环卫服务有限公司,,,,
连云港国润新材料科技有限公司,,,,
江苏凡池信息科技有限公司,,,,
灌云县焦云服装有限公司,,,,
江苏佳漂电子商务有限公司,,,,
江苏华丽服饰有限公司,,,,
江苏特铭建设工程有限公司,,,,
东海县胜邦建设工程有限公司,,,,
连云港帅安置业有限公司,,,,
东海县迪贸建筑工程有限公司,,,,
东海县紫羽农业发展有限公司,,,,
江苏赛运建设工程有限公司,,,,
连云港高进商贸有限公司,,,,
江苏渝质珠宝检测有限公司,,,,
连云港智品贸易有限公司,,,,
江苏双如农业服务有限公司,,,,
连云港市青源水务有限公司,,,,
江苏新大东电力工程有限公司,,,,
连云港新江环保材料有限公司,,,,
连云港强连铁塔制造有限公司,,,,
连云港市赣榆区海头中心卫生院（连云港市赣榆区海头镇妇幼保健计划生育服务站）,,,,
江苏索亚建筑装饰新材料有限公司,,,,
连云港东霞实业有限公司,,,,
连云港明均水产养殖有限公司,,,,
嘉吉饲料（连云港）有限公司,,,,
江苏万川农业发展有限公司,,,,
峰叠（江苏）实业发展企业有限责任公司,,,,
江苏捷利达环保科技有限公司,,,,
连云港利城园区开发有限公司,,,,
连云港市达进东方智能科技有限公司,,,,
江苏依顿农业科技开发有限公司,,,,
连云港金柱商业运营管理有限公司,,,,
连云港敬昕电气设备安装服务有限公司,,,,
江苏德高生物工程有限公司,,,,
江苏岩象精工科技有限公司,,,,
江苏几何体食品科技有限公司,,,,
连云港善源电力工程有限公司,,,,
连云港骏通挂车有限公司,,,,
连云港赣榆同泰船业发展有限公司,,,,
连云港赣榆鸿达石材有限公司,,,,
江苏汇承巨实业发展有限公司,,,,
连云港华欧木艺有限公司,,,,
连云港百瑞纳净水科技有限公司,,,,
连云港益成顺水果种植有限公司,,,,
江苏贵为峰建设有限公司,,,,
连云港仁成建筑工程有限公司,,,,
连云港赣榆新城污水处理有限公司,,,,
连云港瑞谷粮油有限公司,,,,
连云港民悦置业有限公司,,,,
连云港江恒餐饮服务有限公司,,,,
江苏威卡健身器材有限公司,,,,
江苏顺川物流有限公司,,,,
江苏鸿锦包装科技有限公司,,,,
江苏拓博建筑工程有限公司,,,,
江苏御禧园食品有限公司,,,,
江苏冠力食品有限公司,,,,
连云港满聚商贸有限公司,,,,
连云港远近悦海洋科技有限公司,,,,
连云港鑫平无缝钢管制造有限公司,,,,
连云港坤亿全实业发展有限公司,,,,
江苏世航新型材料科技有限公司,,,,
江苏鑫榕升贸易有限公司,,,,
连云港尚均养生服务有限公司,,,,
江苏旗美建筑工程有限公司,,,,
江苏深海礼遇供应链有限公司,,,,
江苏顺捷高新技术有限公司,,,,
邦博路桥建设工程（江苏）有限公司,,,,
连云港边锋物流有限公司,,,,
连云港翼航智能科技有限公司,,,,
连云港林帆包装材料有限公司,,,,
江苏美顺冷链物流有限公司,,,,
江苏宇鑫投资有限公司,,,,
江苏尚纤忆通信科技有限公司,,,,
江苏华港电子科技有限公司,,,,
连云港众旺水产养殖有限公司,,,,
连云港荣舟船务有限公司,,,,
连云港桃味缘农业开发有限公司,,,,
江苏中恺信环保科技有限公司,,,,
江苏丰运年肥料科技有限公司,,,,
连云港颠赢水产养殖有限公司,,,,
江苏新聚亚贸易有限公司,,,,
江苏硕盼实业发展有限公司,,,,
连云港恩兆建设工程有限公司,,,,
江苏涌泉贸易有限公司,,,,
江苏金年发实业发展有限公司,,,,
江苏达翔拓展训练有限公司,,,,
江苏圣莱尔新型材料有限公司,,,,
江苏源然企业服务有限公司,,,,
江苏阳泰食品供应链管理有限公司,,,,
江苏博强高空工程有限公司,,,,
江苏鑫澎威供应链有限公司,,,,
连云港比尔特精工科技有限公司,,,,
江苏骏群建筑工程有限公司,,,,
江苏鹊鸣实业发展有限公司,,,,
江苏益港污水处理有限公司,,,,
连云港金尔达物流有限公司,,,,
连云港苏顺渔具有限公司,,,,
连云港铸运玖贸易有限公司,,,,
江苏尚之锦建设有限公司,,,,
连云港森欧设备工程有限公司,,,,
江苏美其泰科技有限公司,,,,
江苏我呲溜子传媒有限公司,,,,
江苏鲁构钢结构工程有限公司,,,,
江苏环兆贸易有限公司,,,,
连云港赛维智能化工程有限公司,,,,
连云港爱特斯石化机械设备有限公司,,,,
连云港迈广建筑工程有限公司,,,,
江苏海雄商务信息咨询有限公司,,,,
连云港卓亿电气设备安装有限公司,,,,
连云港爱本实业发展有限公司,,,,
连云港悦驰建筑工程有限公司,,,,
江苏安尚消防技术服务有限公司,,,,
连云港美双商贸有限公司,,,,
连云港赣榆润民禽蛋专业合作社,,,,
赣榆县金红利食用菌专业合作社,,,,
东海县思源水务集团有限公司,,,,
大和置业发展连云港有限公司,,,,
江苏德邦化学工业集团有限公司,,,,
江苏苏港工程有限公司,,,,
连云港金海岸开发建设有限公司,,,,
江苏连云港国际物流园投资有限公司,,,,
连云港港口控股集团有限公司,,,,
江苏东海农村商业银行股份有限公司,,,,
江苏延展金属制品有限公司,,,,
江苏灌云民丰村镇银行有限责任公司,,,,
江苏绿色东海投资发展有限公司,,,,
江苏省金桥房地产开发有限公司,,,,
江苏金云置业有限公司,,,,
连云港凯港投资发展有限公司,,,,
中复碳芯电缆科技有限公司,,,,
连云港空港产业园投资开发有限公司,,,,
江苏二建建设集团有限公司,,,,
东海县城镇化建设开发有限公司,,,,
江苏新航电气有限公司,,,,
大陆汽车电子（连云港）有限公司,,,,
连云港步升机械有限公司,,,,
连云港中砼新型建筑科技有限公司,,,,
连云港苏房投置业有限公司,,,,
连云港通威饲料有限公司,,,,
连云港俊景房地产发展有限公司,,,,
灌南新苏国丰新能源有限公司,,,,
连云港圣奥化学科技有限公司,,,,
江苏盛吉化工有限公司,,,,
连云港久盛电力辅机有限公司,,,,
江苏益达管件股份有限公司,,,,
灌南县四通公路养护工程有限公司,,,,
连云港华建建筑安装工程有限公司,,,,
中化连云港石化仓储有限公司,,,,
连云港潮河湾旅游开发有限公司,,,,
江苏安好互联网信息服务有限公司,,,,
连云港新富海仓储有限公司,,,,
连云港市珠禄房地产开发有限公司,,,,
连云港新旭港液化烃码头有限公司,,,,
灌南县硕项湖酒店有限公司,,,,
永泰房地产集团（连云港）有限公司,,,,
江苏梅岭建设工程有限公司,,,,
连云港金正源房地产开发有限公司,,,,
连云港晟晖置业有限公司,,,,
江苏天润孙武宴酒业有限公司,,,,
江苏南华百味鲜食品有限公司,,,,
江苏泰鼎装备科技有限公司,,,,
江苏昱素景信息科技有限公司,,,,
江苏谦仁生物科技有限公司,,,,
江苏绵固生物科技有限公司,,,,
新恒富（江苏）能源有限公司,,,,
江苏汉肽生物医药有限公司,,,,
安阳双环助剂连云港有限公司,,,,
江苏通乾生态科技有限公司,,,,
灌云县诚鑫科技小额贷款有限公司,,,,
江苏拓新实业建设有限公司,,,,
连云港科创科技小额贷款有限公司,,,,
连云港根隆钢铁销售有限公司,,,,
灌南县丰旺贸易有限公司,,,,
连云港立善建材有限公司,,,,
江苏东飞建筑劳务工程有限公司,,,,
灌云益风风电有限公司,,,,
连云港太设房地产开发有限公司,,,,
江苏红旗船舶有限公司,,,,
连云港舜佳置业有限公司,,,,
连云港懋轩服装有限公司,,,,
海润港口有限公司,,,,
东海县城市更新建设发展有限公司,,,,
连云港高榆文化旅游发展有限公司,,,,
弘凯脚手架制造有限公司,,,,
连云港凯益实业有限公司,,,,
连云港裕城能源有限公司,,,,
江苏中寅广沣实业发展有限公司,,,,
连云港管田磨料有限公司,,,,
江苏中力兴城乡一体化建设投资发展有限公司,,,,
连云港市港九国际贸易有限公司,,,,
江苏鑫闽通能源科技有限公司,,,,
连云港尚雅德建材贸易有限公司,,,,
中财城投置业江苏有限公司,,,,
东海县中荣置业有限公司,,,,
江苏直通石油化工有限公司,,,,
渤海宏铄（江苏）环保科技有限公司,,,,
连云港苏达新材料有限公司,,,,
江苏甘之淼园林绿化工程有限公司,,,,
成达供应链管理（江苏）有限公司,,,,
江苏中开华通信有限公司,,,,
东海县加谷生物科技有限公司,,,,
江苏世民博旅游有限公司,,,,
连云港锦溪新材料科技有限公司,,,,
江苏材源利和建材实业有限公司,,,,
连云港爱明建筑劳务有限公司,,,,
中星龙（江苏）建设工程有限公司,,,,
灌云民德生态农业有限公司,,,,
江苏华砣农业科技有限公司,,,,
连云港沃赛实业有限公司,,,,
连云港万事源置业有限公司,,,,
江苏葛卓建设工程有限公司,,,,
江苏福蓝能源有限公司,,,,
连云港金泰石化贸易有限公司,,,,
连云港筑城置业有限公司,,,,
连云港锦之海海运有限公司,,,,
嘉华能源（江苏）有限公司,,,,
江苏北铭环保科技有限公司,,,,
东海县斐钧建材有限公司,,,,
