连云港阳耀建设发展有限公司,,,,
江苏港轩建设集团有限公司,,,,
连云港连疆建筑工程服务有限公司,,,,
灌南县鹏达市政工程有限公司,,,,
江苏货达天下供应链管理有限公司,,,,
江苏安之康建筑工程有限公司,,,,
江苏亚儒建筑劳务有限公司,,,,
江苏琦珀石油化工有限公司,,,,
连云港一松工贸有限公司,,,,
神树林氏建筑劳务（连云港）有限公司,,,,
江苏生鑫置业有限公司,,,,
江苏康赛斯国际贸易有限公司,,,,
连云港达远工程有限公司,,,,
江苏连云港市贞凤养生健康管理有限公司,,,,
连云港淀湖建筑劳务有限公司,,,,
江苏扬连电力设备有限公司,,,,
灌云花川绫服饰有限公司,,,,
连云港品川网络科技有限公司,,,,
连云港昶泰新能源科技有限公司,,,,
灌南县扬州路实验学校,,,,
连云港市宋跳小学,,,,
连云港神鹰复合材料科技有限公司,,,,
江苏金吉利建设工程有限公司,,,,
连云港金驰生物科技有限公司,,,,
连云港金烁建材有限公司,,,,
连云港联合皮业有限公司,,,,
连云港恒阳药业有限公司,,,,
江苏M潮荟餐饮管理有限公司,,,,
连云港北泽精密阀门有限公司,,,,
灌南县公路运输有限公司,,,,
连云港博润建材有限公司,,,,
连云港圣起船舶设备有限公司,,,,
江苏慧源建设工程咨询有限公司,,,,
江苏筑造建设工程有限公司,,,,
连云港天一置业有限公司,,,,
连云港长慧医药有限公司,,,,
灌南汤沟镇贵宾酒业有限公司,,,,
连云港圣润生物科技有限公司,,,,
连云港华特新技术有限公司,,,,
灌南同进建筑工程有限公司,,,,
连云港利发建设工程有限公司,,,,
连云港中井服智能井盖有限公司,,,,
连云港中山环保科技有限公司,,,,
连云港友鑫特种玻璃有限公司,,,,
连云港市东佳装饰工程有限公司,,,,
江苏拓海新能源有限公司,,,,
灌南世茂房地产开发有限公司,,,,
江苏协同项目管理有限公司,,,,
江苏汇森网络科技有限公司,,,,
连云港市正祥建筑劳务有限公司,,,,
连云港天时运营管理合伙企业（有限合伙）,,,,
江苏中醇国际贸易有限公司,,,,
连云港广源建筑劳务有限公司,,,,
江苏希力克新材料有限公司,,,,
连云港江福金属加工有限公司,,,,
连云港隆创电子科技有限公司,,,,
江苏省灌南高级中学,,,,
连云港高盛置业开发有限公司,,,,
连云港振航船务有限公司,,,,
连云港铭华木业有限公司,,,,
江苏泉通矿业有限公司,,,,
连云港普锐斯医疗器械有限公司,,,,
连云港能利科技有限公司,,,,
江苏硕余建设工程有限公司,,,,
连云港淞丰包装材料有限公司,,,,
江苏金袋鼠包装制品有限公司,,,,
阳光沙漠（江苏）生物科技有限公司,,,,
江苏奥通阀门制造有限公司,,,,
连云港云城建设工程有限公司,,,,
连云港平创实业有限公司,,,,
连云港安讯智能化系统有限公司,,,,
连云港恒胜通讯设备科技有限公司,,,,
连云港承博文化艺术有限公司,,,,
连云港安海文化旅游有限公司,,,,
江苏烨驰建设工程有限公司,,,,
江苏润卓新型建材有限公司,,,,
江苏吉驰建材有限公司,,,,
江苏晟昌供应链管理有限公司,,,,
灌南亨泰源合金铸造有限公司,,,,
连云港永顺建筑工程有限公司,,,,
江苏驰辉环保科技有限公司,,,,
江苏铎瑞建设工程有限公司,,,,
连云港东日建材有限公司,,,,
连云港中苏贸易有限公司,,,,
连云港海畔房地产开发有限公司,,,,
黑石石油化工（江苏）有限公司,,,,
连云港金鎏金属回收有限公司,,,,
连云港市路沥佳新材料科技有限公司,,,,
江苏青藤教育科技有限公司,,,,
连云港华峻网络科技有限公司,,,,
江苏凯乐医药科技有限公司,,,,
江苏九格建设工程有限公司,,,,
灌南县鹏振工程机械设备租赁有限公司,,,,
江苏傲跃企业管理有限公司,,,,
江苏亨如建设管理有限公司,,,,
江苏云海鲸歌文化传媒有限公司,,,,
江苏众核新能源有限公司,,,,
江苏古早贡酒股份有限公司,,,,
连云港吉尔木业有限公司,,,,
中通科云信息科技（连云港）有限公司,,,,
连云港裕善旅游开发有限公司,,,,
灌南县田楼实业有限公司,,,,
连云港昌慕实业有限公司,,,,
连云港能聚新能源有限公司,,,,
灌南县新安实业有限公司,,,,
江苏金海荣创商贸有限公司,,,,
连云港耀坤土石方工程有限公司,,,,
江苏秋盛国际贸易有限公司,,,,
江苏碧逾建设工程有限公司,,,,
江苏风顺节能科技有限公司,,,,
连云港市和利投资有限公司,,,,
连云港志亮建筑工程有限公司,,,,
灌南环宇建设工程有限公司,,,,
连云港联星汽车销售服务有限公司,,,,
连云港市正拓市政工程有限公司,,,,
江苏多乐蓓蓓科技有限公司,,,,
连云港宏琪瑞国际贸易有限公司,,,,
江苏拓欧医疗器械销售有限公司,,,,
连云港立宏水产养殖有限公司,,,,
连云港薛氏汽车服务有限公司,,,,
江苏凤念建设工程有限公司,,,,
江苏凡林纺织科技有限公司,,,,
江苏易和生物科技有限公司,,,,
江苏桑葚杉建设工程有限公司,,,,
江苏康巴咖信息科技有限公司,,,,
江苏寿源健身器材有限公司,,,,
江苏锦喜运酒业有限公司,,,,
连云港恒鹏食用菌科技有限公司,,,,
江苏隆智机电设备有限公司,,,,
江苏百之顺贸易有限公司,,,,
连云港御润海洋经济开发有限公司,,,,
江苏少秋建筑工程有限公司,,,,
江苏禹众同建设有限公司,,,,
江苏明煌供应链管理有限公司,,,,
连云港万为流体科技有限公司,,,,
连云港腾之宇农业发展有限公司,,,,
连云港志远建筑劳务有限公司,,,,
江苏东之杭电子商务有限公司,,,,
江苏康奕建建筑劳务有限公司,,,,
江苏久六家具有限公司,,,,
连云港创卫保洁服务有限公司,,,,
连云港盛伍建筑工程有限公司,,,,
江苏莱运供应链管理有限公司,,,,
江苏金睿轩纺织有限公司,,,,
