古诗名,内容,解析
琵琶行(白居易),"
元和十年，予左迁九江郡司马。明年秋，送客湓浦口，闻舟中夜弹琵琶者，听其音，铮铮然有京都声。问其人，本长安倡女，尝学琵琶于穆、曹二善才，年长色衰，委身为贾人妇。遂命酒，使快弹数曲。曲罢悯然，自叙少小时欢乐事，今漂沦憔悴，转徙于江湖间。予出官二年，恬然自安，感斯人言，是夕始觉有迁谪意。因为长句，歌以赠之，凡六百一十六言，命曰《琵琶行》。浔阳江头夜送客，枫叶荻花秋瑟瑟。主人下马客在船，举酒欲饮无管弦。醉不成欢惨将别，别时茫茫江浸月。忽闻水上琵琶声，主人忘归客不发。寻声暗问弹者谁，琵琶声停欲语迟。移船相近邀相见，添酒回灯重开宴。千呼万唤始出来，犹抱琵琶半遮面。转轴拨弦三两声，未成曲调先有情。弦弦掩抑声声思，似诉平生不得志。低眉信手续续弹，说尽心中无限事。轻拢慢捻抹复挑，初为《霓裳》后《六幺》。(六幺 一作：绿腰)大弦嘈嘈如急雨，小弦切切如私语。嘈嘈切切错杂弹，大珠小珠落玉盘。间关莺语花底滑，幽咽泉流冰下难。冰泉冷涩弦凝绝，凝绝不通声暂歇。(暂歇 一作：渐歇)别有幽愁暗恨生，此时无声胜有声。银瓶乍破水浆迸，铁骑突出刀枪鸣。曲终收拨当心画，四弦一声如裂帛。东船西舫悄无言，唯见江心秋月白。沉吟放拨插弦中，整顿衣裳起敛容。自言本是京城女，家在虾蟆陵下住。十三学得琵琶成，名属教坊第一部。曲罢曾教善才服，妆成每被秋娘妒。(服 一作：伏)五陵年少争缠头，一曲红绡不知数。钿头银篦击节碎，血色罗裙翻酒污。(银篦 一作：云篦)今年欢笑复明年，秋月春风等闲度。弟走从军阿姨死，暮去朝来颜色故。门前冷落鞍马稀，老大嫁作商人妇。商人重利轻别离，前月浮梁买茶去。去来江口守空船，绕船月明江水寒。夜深忽梦少年事，梦啼妆泪红阑干。我闻琵琶已叹息，又闻此语重唧唧。同是天涯沦落人，相逢何必曾相识！我从去年辞帝京，谪居卧病浔阳城。浔阳地僻无音乐，终岁不闻丝竹声。住近湓江地低湿，黄芦苦竹绕宅生。其间旦暮闻何物？杜鹃啼血猿哀鸣。春江花朝秋月夜，往往取酒还独倾。岂无山歌与村笛，呕哑嘲哳难为听。今夜闻君琵琶语，如听仙乐耳暂明。莫辞更坐弹一曲，为君翻作《琵琶行》。感我此言良久立，却坐促弦弦转急。凄凄不似向前声，满座重闻皆掩泣。座中泣下谁最多？江州司马青衫湿。
","译文元和十年，我被贬为九江郡司马。次年秋天，到湓浦口送客，听到邻舟有一女子在夜晚弹奏琵琶，细审那声音，铿铿锵锵颇有点京城的风味。我询问她的来历，原来是长安的乐伎，曾经跟穆、曹这两位琵琶名家学习技艺，后来年长色衰，嫁给一位商人为妻。于是我吩咐摆酒，请她尽情地弹几支曲子。她演奏完毕，神态忧伤，叙说自己年青时欢乐的往事，但如今漂泊沦落，憔悴不堪，在江湖之间飘零流浪。我出任地方官已将两年，一向心境平和，她的话却使我有所触动，这一晚竟然有被贬逐的感受。于是撰写了这首七言歌行，吟唱一番来赠送给她，一共有六百一十六字，命题
展开阅读全文 ∨
"
走马川行奉送封大夫出师(岑参),"
君不见走马川行雪海边，平沙莽莽黄入天。 轮台九月风夜吼，一川碎石大如斗，随风满地石乱走。 匈奴草黄马正肥，金山西见烟尘飞，汉家大将西出师。 将军金甲夜不脱，半夜军行戈相拨，风头如刀面如割。 马毛带雪汗气蒸，五花连钱旋作冰，幕中草檄砚水凝。 虏骑闻之应胆慑，料知短兵不敢接，车师西门伫献捷。(车师 一作：军师)
",译文您难道不曾看见吗？那辽阔的走马川紧靠着雪海边缘，茫茫无边的黄沙连接云天。轮台九月整夜里狂风怒号，到处的碎石块块大如斗，狂风吹得斗大乱石满地走。这时匈奴牧草繁茂军马肥，侵入金山西面烟尘滚滚飞，汉家的大将率兵开始征西。将军身著铠甲夜里也不脱，半夜行军戈矛彼此碰撞，凛冽寒风吹到脸上如刀割。马毛挂着雪花还汗气蒸腾，五花马的身上转眼结成冰，营幕中写檄文砚墨也冻凝。敌军听到大军出征应胆惊，料他不敢与我们短兵相接，我就在车师西门等待报捷。
轮台歌奉送封大夫出师(岑参),"
轮台城头夜吹角，轮台城北旄头落。羽书昨夜过渠黎，单于已在金山西。戍楼西望烟尘黑，汉军屯在轮台北。上将拥旄西出征，平明吹笛大军行。四边伐鼓雪海涌，三军大呼阴山动。虏塞兵气连云屯，战场白骨缠草根。剑河风急雪片阔，沙口石冻马蹄脱。(雪片阔 一作：云片阔)亚相勤王甘苦辛，誓将报主静边尘。古来青史谁不见，今见功名胜古人。
",译文轮台城头夜里吹起号角，轮台城北旄头星正降落。军书昨夜连夜送过渠黎，单于已在金山以西入侵。从哨楼向西望烟尘滚滚，汉军就屯扎在轮台北境。上将手持符节率兵西征，黎明笛声响起大军起程。战鼓四起犹如雪海浪涌，三军呐喊阴山发出共鸣。敌营阴沉杀气直冲云霄，战场上白骨还缠着草根。剑河寒风猛烈大雪鹅毛，沙口石头寒冷马蹄冻脱。亚相勤于王政甘冒辛苦，立誓报效国家平定边境。古来青垂史名屡见不鲜，如今将军功名胜过古人。
白雪歌送武判官归京(岑参),"
北风卷地白草折，胡天八月即飞雪。忽如一夜春风来，千树万树梨花开。散入珠帘湿罗幕，狐裘不暖锦衾薄。将军角弓不得控，都护铁衣冷难着。(难着 一作：犹著)瀚海阑干百丈冰，愁云惨淡万里凝。中军置酒饮归客，胡琴琵琶与羌笛。纷纷暮雪下辕门，风掣红旗冻不翻。轮台东门送君去，去时雪满天山路。山回路转不见君，雪上空留马行处。
",译文北风席卷大地吹折了白草，塞北的天空八月就飘降大雪。仿佛一夜之间春风吹来，树上犹如梨花争相开放。雪花飞进珠帘沾湿了罗幕，狐裘不保暖盖上锦被也嫌单薄。将军战士们冷得拉不开弓，铠甲冻得难以穿上。无边沙漠结着厚厚的冰，万里长空凝聚着惨淡愁云。主帅帐中摆酒为归客饯行，胡琴琵琶羌笛合奏来助兴。傍晚辕门前大雪落个不停，红旗冻僵了风也无法牵引。轮台东门外欢送你回京去，你去时大雪盖满了天山路。山路曲折已不见你的身影，雪地上只留下一行马蹄印迹。 
宣州谢x楼饯别校书叔云(李白),"
弃我去者，昨日之日不可留；乱我心者，今日之日多烦忧。长风万里送秋雁，对此可以酣高楼。蓬莱文章建安骨，中间小谢又清发。俱怀逸兴壮思飞，欲上青天揽明月。(揽 一作：览；明月 一作：日月)抽刀断水水更流，举杯消愁愁更愁。(消愁 一作：销愁)人生在世不称意，明朝散发弄扁舟。
",译文弃我而去的昨天，早已不可挽留。乱我心绪的今天，使人无限烦忧。万里长风吹送南归的鸿雁，面对此景，正可以登上高楼开怀畅饮。先生的文章颇具建安风骨，而我的诗风，也像谢I那样清新秀丽。我们都满怀豪情逸兴，飞跃的神思像要腾空而上高高的青天，去摘取那皎洁的明月。拔刀断水水却更加汹涌奔流，举杯消愁愁情上却更加浓烈。人生在世不能称心如意，不如披头散发，登上长江一叶扁舟。
庐山谣寄卢侍御虚舟(李白),"
我本楚狂人，凤歌笑孔丘。手持绿玉杖，朝别黄鹤楼。五岳寻仙不辞远，一生好入名山游。庐山秀出南斗傍，屏风九叠云锦张，影落明湖青黛光。金阙前开二峰长，银河倒挂三石梁，香炉瀑布遥相望，回崖沓嶂凌苍苍。翠影红霞映朝日，鸟飞不到吴天长。登高壮观天地间，大江茫茫去不还。黄云万里动风色，白波九道流雪山。好为庐山谣，兴因庐山发。闲窥石镜清我心，谢公行处苍苔没。早服还丹无世情，琴心三叠道初成。遥见仙人彩云里，手把芙蓉朝玉京。先期汗漫九垓上，愿接卢敖游太清。
","译文我本是像那个接舆楚狂人，高声唱着凤歌去嘲笑孔丘。手里拿一根镶绿玉的棍杖，大清早辞别著名的黄鹤楼。攀登五岳寻仙道不畏路远，这一生就喜欢踏上名山游。秀美的庐山挺拔在南斗旁，九叠云屏像锦绣云霞铺张，湖光山影相互映照泛青光。金阙岩前双峰矗立入云端，三石梁瀑布有如银河倒挂，飞泻而下。香炉峰瀑布与它遥遥相望，重崖叠嶂耸云霄莽莽苍苍。翠云红霞与朝阳相互辉映，鸟儿也飞不过吴天广又长。登高远望天地间壮观景象，大江悠悠东流去永不回还。天上万里黄云变动着风色，江流波涛九道如雪山奔淌。我喜
"
梦游天姥吟留别(李白),"
海客谈瀛洲，烟涛微茫信难求；越人语天姥，云霞明灭或可睹。天姥连天向天横，势拔五岳掩赤城。天台四万八千丈，对此欲倒东南倾。(四万 一作：一万)我欲因之梦吴越，一夜飞度镜湖月。湖月照我影，送我至剡溪。谢公宿处今尚在，渌水荡漾清猿啼。脚著谢公屐，身登青云梯。半壁见海日，空中闻天鸡。千岩万转路不定，迷花倚石忽已暝。熊咆龙吟殷岩泉，栗深林兮惊层巅。云青青兮欲雨，水澹澹兮生烟。列缺霹雳，丘峦崩摧。洞天石扉，訇然中开。青冥浩荡不见底，日月照耀金银台。 霓为衣兮风为马，云之君兮纷纷而来下。虎鼓瑟兮鸾回车，仙之人兮列如麻。忽魂悸以魄动，恍惊起而长嗟。惟觉时之枕席，失向来之烟霞。世间行乐亦如此，古来万事东流水。别君去兮何时还？且放白鹿青崖间，须行即骑访名山。安能摧眉折腰事权贵，使我不得开心颜！
","译文听海外来客们谈起瀛洲，在烟波浩渺的遥远地方，实在难以找到。越中来人说起天姥山，在云霞的明灭掩映之间有时候能看见。天姥山高耸入云，连着天际，横向天外；山势高峻超过五岳，遮掩过赤城山。天姥山极为高峻，就连四万八千丈高的天台山，面对着它好像要向东南倾斜拜倒一样。我想根据越人说的话梦游到吴越，一天夜晚飞渡过明月映照下的镜湖。镜湖上的月光照着我的身影，一直送我到剡溪。谢灵运住的地方如今还在，清澈的湖水荡漾，猿猴清啼。我脚上穿着谢公当年特制的木鞋，攀登直上云霄的山路。上到半山腰就看见了从海
"
金陵酒肆留别(李白),"
风吹柳花满店香，吴姬压酒劝客尝。(劝客 一作：唤客)金陵子弟来相送，欲行不行各尽觞。请君试问东流水，别意与之谁短长？
",译文春风吹起柳絮酒店满屋飘香，侍女捧出美酒，劝我细细品尝。金陵年轻朋友纷纷赶来相送。欲走还留之间，各自畅饮悲欢。请你问问东流江水，离情别意与它比谁短谁长？
韩碑(李商隐),"
元和天子神武姿，彼何人哉轩与羲。誓将上雪列圣耻，坐法宫中朝四夷。淮西有贼五十载，封狼生生罴。不据山河据平地，长戈利矛日可麾。帝得圣相相曰度，贼斫不死神扶持。腰悬相印作都统，阴风惨澹天王旗。逦涔磐ㄗ餮雷Γ仪曹外郎载笔随。 行军司马智且勇，十四万众犹虎貔。入蔡缚贼献太庙，功无与让恩不訾。帝曰汝度功第一，汝从事愈宜为辞。愈拜稽首蹈且舞，金石刻画臣能为。古者世称大手笔，此事不系于职司。当仁自古有不让，言讫屡颔天子颐。公退斋戒坐小阁，濡染大笔何淋漓。点窜《尧典》《舜典》字，涂改《清庙》《生民》诗。文成破体书在纸，清晨再拜铺丹墀。表曰臣愈昧死上，咏神圣功书之碑。碑高三丈字如斗，负以灵鳌蟠以螭。句奇语重喻者少，谗之天子言其私。长绳百尺拽碑倒，粗砂大石相磨治。公之斯文若元气，先时已入人肝脾。汤盘孔鼎有述作，今无其器存其辞。呜呼圣王及圣相，相与@赫流淳熙。公之斯文不示后，曷与三五相攀追。愿书万本诵万遍，口角流沫右手胝。传之七十有二代，以为封禅玉检明堂基。
","译文元和天子禀赋神武英姿，可比古来的轩辕、伏羲。他立誓要洗雪历代圣王的耻辱，坐镇皇宫接受四夷的贡礼。淮西逆贼为祸五十年，割据一方世代绵延。自恃强大，不去占山河却来割据平地；梦想挥戈退日，胆敢反叛作乱。圣君得到贤相名叫裴度，逆贼暗杀未成，自有神灵卫护。他腰悬相印，统兵上战场，天子的军旗在寒风中飘扬。得力的将官有、武、古、通，仪曹外郎任书记随军出征；还有那智勇双全的行军司马韩愈，十四万大军，龙腾虎跃陷阵冲锋。攻下了蔡州，擒住叛贼献俘太庙，功业盖世皇上加恩无限；天子宣布裴度功劳第一，命令韩愈撰写赞辞。韩愈在朝堂拜舞行礼接受诏命说歌功的文章他能够胜任。从来撰述
"
听董大弹胡笳声兼寄语(李颀),"
蔡女昔造胡笳声，一弹一十有八拍。胡人落泪沾边草，汉使断肠对归客。古戍苍苍烽火寒，大荒沉沉飞雪白。(沉沉 一作：阴沉)先拂商弦后角羽，四郊秋叶惊骸６夫子，通神明，深山窃听来妖精。言迟更速皆应手，将往复旋如有情。空山百鸟散还合，万里浮云阴且晴。嘶酸雏雁失群夜，断绝胡儿恋母声。川为静其波，鸟亦罢其鸣。乌孙部落家乡远，逻娑沙尘哀怨生。幽音变调忽飘洒，长风吹林雨堕瓦。迸泉飒飒飞木末，野鹿呦呦走堂下。长安城连东掖垣，凤凰池对青琐门。高才脱略名与利，日夕望君抱琴至。
","韵译当年蔡琰曾作胡笳琴曲，弹奏此曲总共有十八节。胡人听了泪落沾湿边草，汉使对着归客肝肠欲绝。边城苍苍茫茫烽火无烟，草原阴阴沉沉白雪飘落。先弹轻快曲后奏低沉调，四周秋叶受惊瑟瑟凋零。董先生通神明琴技高妙，深林鬼神也都出来偷听。慢揉快拨十分得心应手，往复回旋仿佛声中寓情。声如山中百鸟散了又集，曲似万里浮云暗了又明。象失群的雏雁夜里嘶叫，象胡儿恋母痛绝的哭声。江河听曲而平息了波澜，百鸟闻声也停止了啼鸣。仿佛乌孙公主远怀故乡，宛如文成公主之怨吐蕃。幽咽琴声忽转轻松潇
"
听安万善吹v篥歌(李颀),"
南山截竹为v篥，此乐本自龟兹出。流传汉地曲转奇，凉州胡人为我吹。傍邻闻者多叹息，远客思乡皆泪垂。世人解听不解赏，长飙风中自来往。枯桑老柏寒飕v，九雏鸣凤乱啾啾。龙吟虎啸一时发，万籁百泉相与秋。忽然更作渔阳掺，黄云萧条白日暗。变调如闻杨柳春，上林繁花照眼新。岁夜高堂列明烛，美酒一杯声一曲。
",译文从南山截段竹筒做成v篥，这种乐器本来是出自龟兹。 流传到汉地曲调变得新奇，凉州胡人安万善为我奏吹。 座旁的听者个个感慨叹息，思乡的游客人人悲伤落泪。 世人只晓听曲不懂得欣赏，乐人就像独行于暴风之中。 又像风吹枯桑老柏沙沙响，还像九只雏凤鸣叫啾啾啼。 好似龙吟虎啸同时都爆发，又如万籁齐响秋天百泉汇。 忽然变调成低沉悲壮的渔阳掺，顿使白日转昏暗乌云翻飞。 再变如同杨柳枝热闹欢快，仿佛看到上林苑繁花似锦。 除夕夜高堂上明烛放光芒，喝杯美酒再欣赏一曲v篥。
古意(李颀),"
男儿事长征，少小幽燕客。赌胜马蹄下，由来轻七尺。杀人莫敢前，须如猬毛磔。黄云陇底白云飞，未得报恩不得归。辽东小妇年十五，惯弹琵琶解歌舞。今为羌笛出塞声，使我三军泪如雨。
",译文男子汉当以国事为重，从军远征，从小就在幽燕纵横驰骋。经常与人在马上比试胜负，从不珍惜七尺身躯。奋勇搏杀，没人敢上前招应；气宇轩昂，脸上的胡子像刺猬的毛丛生。陇下黄沙弥漫，上面白云飘飞，未报朝廷恩情怎能轻易言归。辽东少妇年方十五，她弹熟了琵琶能歌善舞。今日用羌笛吹一支出塞乐曲，感动得全军将士泪下如雨。
送陈章甫(李颀),"
四月南风大麦黄，枣花未落桐阴长。(阴 一作：叶)青山朝别暮还见，嘶马出门思旧乡。陈侯立身何坦荡，虬须虎眉仍大颡。腹中贮书一万卷，不肯低头在草莽。东门酤酒饮我曹，心轻万事如鸿毛。醉卧不知白日暮，有时空望孤云高。长河浪头连天黑，津口停舟渡不得。郑国游人未及家，洛阳行子空叹息。闻道故林相识多，罢官昨日今如何。
",译文四月南风吹大麦一片金黄，枣花未落梧桐荫已遮满道路。早晨辞别青山晚上又相见，出门闻马鸣令我想念故乡。陈侯的立身处世襟怀坦荡，虬须虎眉前额宽仪表堂堂。你胸藏诗书万卷学问深广，怎么能够低头埋没在草莽。在城东门买酒同我们畅饮，心宽看万事都如鸿毛一样。喝醉酒酣睡不知天已黄昏，有时独自将天上孤云眺望。今日黄河波浪汹涌连天黑，行船在渡口停驻不敢过江。你这郑国的游人不能返家，我这洛阳的行子空自叹息。听说你在家乡旧相识很多，罢官回去他们如何看待你？
琴歌(李颀),"
主人有酒欢今夕，请奏鸣琴广陵客。月照城头乌半飞，霜凄万树风入衣。(万树 一作：万木)铜炉华烛烛增辉，初弹渌水后楚妃。一声已动物皆静，四座无言星欲稀。清淮奉使千余里，敢告云山从此始。
",译文主人摆酒今晚大家欢聚，琴师拨动琴弦助兴酒宴。明月照向城头乌鸦纷飞，寒霜降临寒风吹透衣衫。炉火暖融融华烛添光辉。艺人先弹《渌水》后奏《楚妃》。他的琴声一响万物寂静，四座无言屏气凝神倾听。奉命去远离乡关清淮，敬告大家我要归隐云山。
古柏行(杜甫),"
孔明庙前有老柏，柯如青铜根如石。霜皮溜雨四十围，黛色参天二千尺。君臣已与时际会，树木犹为人爱惜。云来气接巫峡长，月出寒通雪山白。忆昨路绕锦亭东，先主武侯同s宫。崔嵬枝干郊原古，窈窕丹青户牖空。落落盘踞虽得地，冥冥孤高多烈风。扶持自是神明力，正直原因造化工。大厦如倾要梁栋，万牛回首丘山重。不露文章世已惊，未辞翦伐谁能送？苦心岂免容蝼蚁，香叶终经宿鸾凤。志士幽人莫怨嗟：古来材大难为用。
","译文孔明庙前有一株古老的柏树，枝干色如青铜根柢固如盘石。树皮洁白润滑树干有四十围，青黑色朝天耸立足有二千尺。刘备孔明君臣遇合与时既往，至今树木犹在仍被人们爱惜。柏树高耸云雾飘来气接巫峡，月出寒光高照寒气直通岷山。想昔日小路环绕我的草堂东，先生庙与武侯祠在一个s宫。柏树枝干崔嵬郊原增生古致，庙宇深邃漆绘连绵门窗宽空。古柏独立高耸虽然盘踞得地，但是位高孤傲必定多招烈风。它得到扶持自然是神明伟力，它正直伟岸原于造物者之功。大厦如若倾倒要有梁栋支撑，古柏重如丘山万牛也难拉动。它
"
韦讽录事宅观曹将军画马(杜甫),"
国初已来画鞍马，神妙独数江都王。将军得名三十载，人间又见真乘黄。曾貌先帝照夜白，龙池十日飞霹雳。内府殷红玛瑙盘，婕妤传诏才人索。盘赐将军拜舞归，轻纨细绮相追飞。贵戚权门得笔迹，始觉屏障生光辉。昔日太宗拳毛m，近时郭家狮子花。今之新图有二马，复令识者久叹嗟。此皆骑战一敌万，缟素漠漠开风沙。其余七匹亦殊绝，迥若寒空动烟雪。霜蹄蹴踏长楸间，马官厮养森成列。可怜九马争神骏，顾视清高气深稳。借问苦心爱者谁，后有韦讽前支遁。忆昔巡幸新丰宫，翠华拂天来向东。腾骧磊落三万匹，皆与此图筋骨同。自从献宝朝河宗，无复射蛟江水中。君不见金粟堆前松柏里，龙媒去尽鸟呼风。
","译文开国以来善画鞍马的画家中，画技最精妙传神只数江都王。曹将军画马出名已有三十载，人间又见古代真正神马“乘黄”。他曾描绘玄宗先帝的“照夜白”，画得象池龙腾飞十日声如雷。皇宫内库珍藏的殷红玛瑙盘，婕妤传下御旨才人将它取来。将军接受赐盘叩拜皇恩回归，轻纨细绮相继赐来快速如飞。贵戚们谁得到曹将军亲笔迹，谁就觉得府第屏障增加光辉。当年唐太宗著名宝马“拳毛?”。近代郭子仪家中好驹“狮子花”。而今新画之中就有这两匹马，使得识马的人久久感慨赞夸。这都是战骑以一胜万的好马，展开画绢如见奔马扬起风沙
"
丹青引赠曹霸将军(杜甫),"
将军魏武之子孙，于今为庶为清门。英雄割据虽已矣，文采风流今尚存。学书初学卫夫人，但恨无过王右军。丹青不知老将至，富贵于我如浮云。开元之中常引见，承恩数上南薰殿。凌烟功臣少颜色，将军下笔开生面。良相头上进贤冠，猛将腰间大羽箭。褒公鄂公毛发动，英姿飒爽来酣战。先帝天马玉花骢，画工如山貌不同。是日牵来赤墀下，迥立阊阖生长风。诏谓将军拂绢素，意匠惨澹经营中。斯须九重真龙出，一洗万古凡马空。玉花却在御榻上，榻上庭前屹相向。至尊含笑催赐金，圉人太仆皆惆怅。弟子韩干早入室，亦能画马穷殊相。干惟画肉不画骨，忍使骅骝气凋丧。将军画善盖有神，必逢佳士亦写真。即今漂泊干戈际，屡貌寻常行路人。途穷反遭俗眼白，世上未有如公贫。但看古来盛名下，终日坎安其身。
","译文曹将军是魏武帝曹操后代子孙，而今却沦为平民百姓成为寒门。英雄割据的时代一去不复返了，曹家文章丰采却在你身上留存。当年为学书法你先拜师卫夫人，只恨得没有超过王羲之右将军。你毕生专攻绘画不知老之将至，荣华富贵对于你却如空中浮云。开元年间你常常被唐玄宗召见，承恩载德你曾多次登上南薰殿。凌烟阁的功臣画象年久褪颜色，曹将军你挥笔重画又别开生面。良相们的头顶都戴上了进贤冠，猛将们的腰间皆佩带着大羽箭。褒公鄂公的毛发似乎都在抖动，他们英姿飒爽好象是正在酣战。开元时先帝的天马名叫玉花骢，多少画家画出的都与原貌不同。当天玉花骢被牵到殿中红阶下，昂首屹立宫门更增添它的威风。皇上命令你展开丝绢
"
寄韩谏议(杜甫),"
今我不乐思岳阳，身欲奋飞病在床。美人娟娟隔秋水，濯足洞庭望八荒。鸿飞冥冥日月白，青枫叶赤天雨霜。玉京群帝集北斗，或骑麒麟翳凤凰。芙蓉旌旗烟雾落，影动倒景摇潇湘。星宫之君醉琼浆，羽人稀少不在旁。似闻昨者赤松子，恐是汉代韩张良。昔随刘氏定长安，帷幄未改神惨伤。国家成败吾岂敢，色难腥腐餐枫香。周南留滞古所惜，南极老人应寿昌。美人胡为隔秋水，焉得置之贡玉堂。
",译文眼下我心情不佳是思念岳阳，身体想要奋飞疾病逼我卧床。隔江的韩注他品行多么美好，常在洞庭洗足放眼望八方。鸿鹄已高飞远空在日月之间，青枫树叶已变红秋霜已下降。玉京山众仙们聚集追随北斗，有的骑着麒麟有的驾着凤凰。芙蓉般的旌旗被烟雾所淹没，潇湘荡着涟漪倒影随波摇晃。星宫中的仙君沉醉玉露琼浆，羽衣仙人稀少况且不在近旁。听说他仿佛是昔日的赤松子，恐怕是更象汉初韩国的张良。当年他随刘邦建业定都长安，运筹帷幄之心未改精神惨伤。国家事业成败岂敢坐视观望，厌恶腥腐世道宁可餐食枫香。太史公留滞周南古来被痛惜，但愿他象南极寿星长泰永昌。品行高洁之人为何远隔江湖，怎么才能将他置于未央宫上？
夜归鹿门山歌(孟浩然),"
山寺钟鸣昼已昏，渔梁渡头争渡喧。人随沙岸向江村，余亦乘舟归鹿门。鹿门月照开烟树，忽到庞公栖隐处。岩扉松径长寂寥，惟有幽人自来去。
",译文黄昏时山寺的钟声在山谷中回响，渔梁渡口处人们争着过河，喧闹不已。人们沿着沙岸向江村走过去，我也乘坐一叶小舟返回鹿门。鹿门山在月光映照下山树渐渐显现出来，好似忽然来到了庞公隐居之地。相对的山岩和松间小路幽幽静静，只有隐居的人在此来来去去。
渔翁(柳宗元),"
渔翁夜傍西岩宿，晓汲清湘燃楚竹。烟销日出不见人，G乃一声山水绿。回看天际下中流，岩上无心云相逐。
",译文渔翁晚上停船靠着西山歇宿，早上汲取清澈的湘水，以楚竹为柴做饭。旭日初升，云雾散尽四周悄然无声，渔翁摇橹的声音从碧绿的山水中传出。回身一看，他已驾舟行至天际中流，山岩顶上，只有无心白云相互追逐。
