江苏惠明森生态科技有限公司,,,,
连云港大鲲工业科技有限公司,,,,
江苏六路重工科技有限公司,,,,
江苏华贵建筑工程有限公司,,,,
江苏万腾新能源集团有限公司,,,,
连云港市枫卓电子信息科技有限公司,,,,
连云港德禄人汽车贸易有限公司,,,,
百阿腾（江苏）大数据服务有限公司,,,,
灌南永达新能源科技有限公司,,,,
连云港市建振建筑劳务有限公司,,,,
江苏碧鹏实业发展有限公司,,,,
江苏无忧殡葬服务有限公司,,,,
北星斗电商产业园（连云港）有限公司,,,,
江苏雄厚置业有限公司,,,,
东海县及时雨文化旅游发展有限公司,,,,
灌云县宏鑫新能源科技有限公司,,,,
江苏帝狮威木业有限公司,,,,
江苏显陆ㄉ韫こ逃邢薰司,,,,
连云港唯易健建筑工程有限公司,,,,
江苏国尊新型建材科技有限公司,,,,
连云港东特建筑工程有限公司,,,,
灌云县云湖实验小学,,,,
连云港市赣榆区石桥镇大沙村居家养老服务中心,,,,
连云港德翔新材料有限公司,,,,
江苏裕灌食品工业有限公司,,,,
灌南县华为建材有限公司,,,,
禧玛诺（连云港）实业有限公司,,,,
连云港路友重工有限公司,,,,
灌南朋怀建材贸易有限公司,,,,
灌南正方模具钢材料有限公司,,,,
连云港国诚房地产开发有限公司,,,,
连云港连化水务有限公司,,,,
江苏国辰设备安装有限公司,,,,
江苏广润环保科技有限公司,,,,
连云港旭龙城旅游开发有限公司,,,,
江苏轩海化工包装容器有限公司,,,,
连云港月辉环保科技有限公司,,,,
连云港拜尔特化工有限公司,,,,
灌南县旺恒房地产开发有限公司,,,,
连云港浩阳房地产开发有限公司,,,,
江苏弘大实验设备有限公司,,,,
连云港天路电器成套设备有限公司,,,,
江苏一润国际贸易有限公司,,,,
十方健康管理（江苏）有限公司,,,,
江苏嘉瑞起重设备租赁有限公司,,,,
连云港腾源化工有限公司,,,,
连云港正阳路面工程有限公司,,,,
灌南县哲思曼酒业有限公司,,,,
连云港凯凡国际贸易有限公司,,,,
灌南苏盛能源有限公司,,,,
连云港市汉传贸易有限公司,,,,
连云港凯耀机械制造有限公司,,,,
江苏中豪石油化工有限公司,,,,
灌南兴源电力工程有限公司,,,,
灌南宏耀纺织服饰有限公司,,,,
灌南滨特尔无纺布有限公司,,,,
灌南县瀚信贸易有限公司,,,,
江苏百世千缘酒业有限公司,,,,
连云港创荣贸易有限公司,,,,
连云港中邦投资管理有限公司,,,,
连云港市中云中心小学,,,,
江苏光大豪锐信息产业投资有限公司,,,,
连云港轩诺环保科技有限公司,,,,
连云港狮子山生态园有限公司,,,,
连云港途瑞贸易有限公司,,,,
连云港众润建材有限公司,,,,
江苏财易新能源有限公司,,,,
连云港君临天盛科技发展有限公司,,,,
连云港嘉伟木业有限公司,,,,
江苏师伟国际贸易有限公司,,,,
连云港艾普瑞自动化设备贸易有限公司,,,,
连云港南方家园实业有限公司,,,,
连云港和旭防腐保温工程有限公司,,,,
灌南县汤源木业有限公司,,,,
江苏启仓食品有限公司,,,,
江苏港投能源有限公司,,,,
江苏圣海尔海洋工程服务有限公司,,,,
连云港为翔金属材料加工有限公司,,,,
江苏智科电子有限公司,,,,
江苏新清朗物流园有限公司,,,,
连云港银桥物流有限公司,,,,
连云港发成装饰材料有限公司,,,,
江苏大拇指国际贸易有限公司,,,,
连云港联晟合企业管理有限公司,,,,
江苏连邦建筑装饰工程有限公司,,,,
连云港博马精密机械有限公司,,,,
连云港h芽泉饮用水有限公司,,,,
江苏天鑫环境工程有限公司,,,,
连云港四春土石方工程有限公司,,,,
江苏寻贻生物科技有限公司,,,,
恒盛（连云港）国际贸易有限公司,,,,
江苏振辉宏腾建筑工程有限公司,,,,
江苏夏禹项目管理咨询有限公司,,,,
江苏虹派国际供应链管理有限公司,,,,
江苏威赫氏生物科技有限公司,,,,
江苏红地球食品有限公司,,,,
连云港欣然机械吊装有限公司,,,,
江苏韩信酒业有限公司,,,,
江苏港城一品酒业有限公司,,,,
江苏骏艺安防工程有限公司,,,,
灌南佰金翰科技有限公司,,,,
江苏鹏远国际贸易有限公司,,,,
连云港盈洲物流有限公司,,,,
连云港宝祺国际贸易有限公司,,,,
连云港传柱建筑工程有限公司,,,,
连云港与顺网络科技有限公司,,,,
江苏锐玛建设工程有限公司,,,,
连云港研顺土石方工程有限公司,,,,
灌南县鼎原旅行社有限公司,,,,
江苏维德铂尔能源工程有限公司,,,,
灌南县张店实业有限公司,,,,
江苏抹瘦生物科技有限公司,,,,
连云港彦霏土石方工程有限公司,,,,
连云港鸿铠建设工程有限公司,,,,
连云港成标建筑劳务有限公司,,,,
江苏瑞点药业有限公司,,,,
连云港锐默化工产品销售有限公司,,,,
连云港涛洋市政工程建设有限公司,,,,
灌南县文杰废旧物资回收有限公司,,,,
江苏传坤工程有限公司,,,,
江苏大长成供应链管理有限公司,,,,
江苏中森机械工程有限公司,,,,
江苏侬情艺语园艺工程有限公司,,,,
连云港天思医疗设备有限公司,,,,
灌南县思国恩农业生态园有限公司,,,,
江苏群鲸互联网科技有限公司,,,,
江苏牛猫科技有限公司,,,,
江苏吾好鲜生科技有限公司,,,,
连云港创u供应链管理有限公司,,,,
江苏飞旗管理咨询有限公司,,,,
江苏艾拉纺织有限公司,,,,
灌南县灌江电子商务有限公司,,,,
江苏朗铭建筑装饰工程有限公司,,,,
连云港晟盖国际贸易有限公司,,,,
江苏奥德涂料科技有限公司,,,,
江苏上宸广告设计工程有限公司,,,,
江苏连旭大件起重吊装有限公司,,,,
江苏科曼医疗器械有限公司,,,,
江苏福穗农业发展有限公司,,,,
江苏德密微电子科技有限公司,,,,
连云港博泰家畜有限公司,,,,
江苏恒诺生物科技有限公司,,,,
江苏多思农牧机械有限公司,,,,
江苏津渡矿业有限公司,,,,
江苏保前房产开发有限公司,,,,
江苏君世广告有限公司,,,,
