江苏品正医药科技集团有限公司,,,,
江苏高兴建设工程有限公司,,,,
江苏万达工程造价事务所有限公司,,,,
连云港海创电子科技有限公司,,,,
连云港龙港建筑安装工程有限责任公司,,,,
江苏博海建筑装饰工程有限公司,,,,
江苏登壹建设工程有限公司,,,,
江苏戈雅建筑装饰工程有限公司,,,,
优必得流体科技设备（江苏）有限公司,,,,
连云港硕淦建筑材料有限公司,,,,
连云港市菜篮子电子商务有限公司,,,,
江苏巨生实业有限公司,,,,
江苏顺泓电力工程有限公司,,,,
连云港市清新环保科技有限公司,,,,
连云港市机关服务中心（连云港市公务用车服务中心）,,,,
连云港市宣宁建设工程有限公司,,,,
连云港天创科技开发有限公司,,,,
江苏安聚保建设工程有限公司,,,,
连云港市澜天置业有限公司,,,,
连云港佑丰电力设备有限公司,,,,
江苏国大物业管理有限公司,,,,
连云港之宝汽车销售服务有限公司,,,,
连云港市德泰房地产开发有限公司,,,,
连云港信富稀土有限公司,,,,
连云港六棵树潮童童装有限公司,,,,
江苏可味源农业科技发展有限公司,,,,
江苏升易有限公司,,,,
江苏长业建设有限公司,,,,
江苏英美达建设工程有限公司,,,,
江苏瑞琪现代农业开发有限公司,,,,
江苏金塘水产养殖有限公司,,,,
连云港大穆混凝土有限公司,,,,
江苏新七建设工程有限公司,,,,
连云港国瑞变压器有限公司,,,,
江苏兴兵保安服务有限公司,,,,
连云港卓润钢材有限公司,,,,
江苏佰中佰超市有限公司,,,,
江苏禄普建筑装饰工程有限公司,,,,
江苏优益泰建设工程有限公司,,,,
连云港市吉鑫机械设备有限公司,,,,
江苏国正检测有限公司,,,,
江苏勤觉建筑工程有限公司,,,,
连云港鲜品尚电子商务有限公司,,,,
连云港汇鑫堂餐饮管理有限公司,,,,
连云港港大建设有限公司,,,,
连云港久泰电力节能设备有限公司,,,,
连云港市海州区新坝水利管理所,,,,
连云港厚发国际贸易有限公司,,,,
江苏木桂建设有限公司,,,,
江苏万成警用装备有限公司,,,,
连云港市公路收费服务中心,,,,
江苏云泰航空国际旅行社有限公司,,,,
江苏鑫景湾置业有限公司,,,,
连云港铭泰汽车服务有限公司,,,,
江苏龙展环保科技有限公司,,,,
江苏建联工程管理有限公司,,,,
江苏云锦项目管理咨询有限公司,,,,
江苏航尔建设工程有限公司,,,,
连云港国汇汽车销售服务有限公司,,,,
海州区锦屏山旅游发展中心,,,,
江苏壹壹伍科技工程有限公司,,,,
江苏热面网络科技有限公司,,,,
连云港金声玉振实业有限公司,,,,
江苏夏华农业发展有限公司,,,,
中科汇融（江苏）科技发展有限公司,,,,
江苏颐年德泰健康管理有限公司,,,,
江苏佰美信息科技有限公司,,,,
江苏麦焙乐食品有限公司,,,,
连云港华庭装饰工程有限公司,,,,
连云港深达石化装备有限公司,,,,
江苏道一建设工程有限公司,,,,
江苏舜钦建筑工程有限公司,,,,
连云港市华晋电力辅机有限公司,,,,
连云港玺鹏豪建设工程有限公司,,,,
连云港正阳企业资产管理有限公司,,,,
江苏尚达高科技发展有限公司,,,,
江苏登皇建设有限公司,,,,
江苏希嘉装饰工程有限公司,,,,
江苏圣众生态养殖实业发展有限公司,,,,
宝罗电动汽车销售连云港有限公司,,,,
连云港市博哲贸易有限公司,,,,
江苏鸿稼农业发展有限公司,,,,
连云港安海港务工程有限公司,,,,
连云港泰诚企业管理有限公司,,,,
江苏玄德机电工程有限公司,,,,
江苏国胜石化装备科技有限公司,,,,
江苏伊清园餐饮管理有限公司,,,,
江苏如年智能装备科技有限公司,,,,
连云港市远鸿劳保用品有限公司,,,,
江苏乐之泓建设工程有限公司,,,,
连云港市宣龙项目管理有限公司,,,,
连云港土山园林绿化工程有限公司,,,,
江苏鸿鼎建设工程有限公司,,,,
连云港西柚贸易有限公司,,,,
江苏合泽财务咨询有限公司,,,,
江苏跃越电力有限公司,,,,
江苏启鼎建设工程有限公司,,,,
江苏格耀建设工程有限公司,,,,
江苏雪山生命科技有限公司,,,,
连云港中姿再生资源有限公司,,,,
江苏路洲市政工程有限公司,,,,
江苏旭雅建设工程有限公司,,,,
连云港叶锦建设工程有限公司,,,,
江苏蔻达实业有限公司,,,,
江苏建仪测试仪器有限公司,,,,
江苏建茂建设工程有限公司,,,,
连云港市久爱网络工程有限公司,,,,
江苏益加益建设工程有限公司,,,,
江苏山海食品有限公司,,,,
江苏金之开建设有限公司,,,,
江苏优驰企业信息咨询有限公司,,,,
江苏子和文化传媒有限公司,,,,
江苏港惠文化发展有限公司,,,,
江苏泉印酝建设工程有限公司,,,,
江苏赛鹏信息技术有限公司,,,,
江苏乾艮商贸有限公司,,,,
江苏江自流信息科技有限公司,,,,
连云港福佑轩建设工程有限公司,,,,
江苏西游漫居项目管理有限公司,,,,
连云港晟宏电气设备有限公司,,,,
江苏亚字照明电器有限公司,,,,
连云港乡韵家庭农场有限公司,,,,
江苏戴托纳文化传媒有限公司,,,,
连云港森旭工程机械有限公司,,,,
连云港玺园商贸有限公司,,,,
连云港市东旭节能科技有限公司,,,,
江苏天弘盛饰建筑装饰工程有限公司,,,,
连云港溪水物业管理有限公司,,,,
连云港市美尔装饰工程有限公司,,,,
江苏芳香之城工艺品有限公司,,,,
连云港市正云贸易有限公司,,,,
连云港正徐地基基础工程有限公司,,,,
江苏鼎固新能源科技有限公司,,,,
江苏厚造建设装饰工程有限公司,,,,
江苏诚慧成建设工程有限公司,,,,
江苏康耘置业有限公司,,,,
连云港瑞斯钥贸易有限公司,,,,
江苏庄主邦旅游开发有限公司,,,,
连云港嘉博暖通有限公司,,,,
连云港泊磊网络科技有限公司,,,,
江苏今玉缘生物科技有限公司,,,,
江苏跃卡贸易有限公司,,,,
江苏方德国际贸易有限公司,,,,
连云港新诚吊装起重有限公司,,,,
连云港市坝丰农业开发有限公司,,,,
连云港市鑫达建设工程有限公司,,,,
连云港传力体育工程有限公司,,,,
江苏石猴酒业有限公司,,,,
连云港航建建设工程有限公司,,,,
江苏尚乐建筑装饰工程有限公司,,,,
江苏水尊健康管理有限公司,,,,
江苏崇进建设工程有限公司,,,,
江苏嘉乐琦装饰工程有限公司,,,,
连云港运亨建筑工程有限公司,,,,
江苏臻品汇生物科技有限公司,,,,
江苏菲尔斯机械设备有限公司,,,,
江苏聆思雅文化传播有限公司,,,,
连云港市辰丰贸易有限公司,,,,
江苏纳智网络科技有限公司,,,,
江苏光摄知识产权有限公司,,,,
连云港聚力起重吊装有限公司,,,,
江苏福科思建设工程有限公司,,,,
江苏康飞医疗科技有限公司,,,,
江苏美时天下文化传媒有限公司,,,,
江苏剑齿虎网络科技有限公司,,,,
安斯沃斯（江苏）医药科技有限公司,,,,
江苏志迈供应链管理有限公司,,,,
盛虹石化（连云港）港口储运有限公司,,,,
连云港众诚国际物流有限公司,,,,
江苏海州湾旅游发展有限公司,,,,
江苏建邦市政工程有限公司,,,,
连云港市连云区宝盛元农村小额贷款有限公司,,,,
连云港香兰电子商务有限公司,,,,
连云港徐圩港口船舶服务有限公司,,,,
连云港市富翔置业有限公司,,,,
连云港水世界贸易有限公司,,,,
连云港鑫沐顺建设工程有限公司,,,,
江苏融晴新能源科技有限公司,,,,
连云港善建物流有限公司,,,,
连云港市兴纳斯供应链管理有限公司,,,,
连云港明轮保税仓储有限公司,,,,
连云港雅发实业有限公司,,,,
江苏丰禾粮食仓储物流有限公司,,,,
江苏沃弗森新材料科技有限公司,,,,
江苏山田生物化工有限公司,,,,
瑞奇（江苏）体育文化发展有限公司,,,,
连云港方洋食品科技有限公司,,,,
义鸣国际货运代理连云港有限公司,,,,
连云港新港船舶燃料供应有限公司,,,,
连云港永骁物资有限公司,,,,
连云港仙桥紫菜有限公司,,,,
连云港凰窝旅游实业有限公司,,,,
连云港梓铭钢结构安装工程有限公司,,,,
连云港凯时捷进出口贸易有限责任公司,,,,
连云港鼎禧国际贸易有限公司,,,,
江苏双旺纺织有限公司,,,,
江苏森蓝环境工程有限公司,,,,
江苏吉欧生物科技有限公司,,,,
连云港大洋美诺国际贸易有限公司,,,,
连云港春恒建设工程有限公司,,,,
江苏瑞翔养殖有限公司,,,,
江苏润梵景观工程有限公司,,,,
江苏中垠瑞科生态环境有限公司,,,,
江苏润达能源有限公司,,,,
江苏鸿巨网络科技有限公司,,,,
江苏龙超石化有限公司,,,,
连云港旅健福实业有限公司,,,,
江苏侨冉实业有限公司,,,,
江苏四季盛达进出口有限公司,,,,
连云港隆润酒店管理有限公司,,,,
江苏瑞尊新能源科技有限公司,,,,
江苏天下汇贸易有限公司,,,,
江苏逆行者商贸有限公司,,,,
江苏丝路花雨旅游有限公司,,,,
江苏泊语基因科技有限公司,,,,
江苏中曙能源有限公司,,,,
江苏佳沃国际贸易有限公司,,,,
连云港市精化能源有限公司,,,,
连云港蓝誊汇商贸有限公司,,,,
连云港中潘供应链管理有限公司,,,,
江苏运通石油化工有限公司,,,,
江苏榕山建材有限公司,,,,
江苏忠城建筑安装有限公司,,,,
江苏天洲建设工程有限公司,,,,
连云港海川机电设备有限公司,,,,
江苏盛福鑫供应链管理有限公司,,,,
连云港安途建筑劳务有限公司,,,,
江苏汇添富石化有限公司,,,,
江苏瑞文弱电建设工程有限责任公司,,,,
江苏润同新材料科技有限公司,,,,
江苏盐建给水设备有限公司,,,,
连云港泰格市政工程有限公司,,,,
连云港陇海矿山机械制造有限公司,,,,
江苏东海水泥厂,,,,
连云港顺腾农业发展有限公司,,,,
连云港顺中金属材料有限公司,,,,
连云港鹏涛污水管道安装有限公司,,,,
江苏秦裕燃气管道设备安装有限公司,,,,
连云港天邦米业有限公司,,,,
连云港晶彩小镇商业管理有限公司,,,,
东海县晶城物业管理有限公司,,,,
江苏潮河湾酒业股份有限公司,,,,
连云港碧发置业有限公司,,,,
连云港市润浦置业有限公司,,,,
江苏东海老淮猪肉食品有限公司,,,,
连云港清泰化工有限公司,,,,
东海县依婷时装有限公司,,,,
江苏新秀科技投资有限公司,,,,
江苏中染化工有限公司,,,,
东海县亿金建材有限公司,,,,
连云港市东海卫生职工中等专业学校,,,,
连云港和美置业有限公司,,,,
灌云仙居房地产开发有限公司,,,,
江苏峰之屹食品有限公司,,,,
连云港沃漫方景园实业有限公司,,,,
连云港德正金属材料有限公司,,,,
东海县明俊混凝土有限公司,,,,
连云港知途跨境电商科技有限公司,,,,
江苏玉根路桥工程有限公司,,,,
东海县气象局,,,,
连云港欣立澳贸易有限公司,,,,
江苏翔N设备安装有限公司,,,,
连云港助群实业有限公司,,,,
江苏沪之通金属制品有限公司,,,,
连云港厚泽房地产开发有限公司,,,,
连云港佳帝土石方工程有限公司,,,,
东海县丰泽房地产开发有限公司,,,,
连云港得周拆除工程有限公司,,,,
瑞欣（连云港）路面材料有限公司,,,,
江苏大杨家纺有限公司,,,,
连云港市博远建设工程有限公司,,,,
江苏荣欣知识产权服务有限公司,,,,
东海县融媒体中心,,,,
江苏盛翌博机电工程有限公司,,,,
江苏亚信机电设备制造有限公司,,,,
连云港君诺建筑劳务有限公司,,,,
鼠你惠吃电子商务（江苏）有限公司,,,,
东海县安峰中心小学,,,,
连云港博昂贸易有限公司,,,,
东海县天泽农业开发有限公司,,,,
连云港一水清山纯净水制造有限公司,,,,
东海县卡煌商贸有限公司,,,,
东海县安峰中心卫生院,,,,
连云港市大陆旋耕机厂,,,,
连云港荷弘建设工程有限公司,,,,
连云港鼎充景行新能源科技有限公司,,,,
江苏行行文化传媒有限公司,,,,
江苏腾鹰海洋工程有限公司,,,,
灌云鹏程房地产开发有限公司,,,,
江苏梵本运输有限公司,,,,
江苏宪科能源科技有限公司,,,,
连云港丰禾有机农业开发有限公司,,,,
灌云山水农业开发有限公司,,,,
东海县安邦路桥工程有限公司,,,,
连云港智奥防水材料有限公司,,,,
江苏万腾科技有限公司,,,,
东海县惠润超市有限公司,,,,
东海县奎山水晶文化发展有限公司,,,,
江苏柠曲逸建设工程有限公司,,,,
东海县衡庐建设工程有限公司,,,,
江苏玖瑞生物科技有限公司,,,,
江苏奶诨繁？萍加邢薰司,,,,
连云港龙钦船务工程有限公司,,,,
连云港法狮图智能科技有限公司,,,,
灌云新未来房产有限公司,,,,
连云港非一酒店管理有限公司,,,,
连云港德尊商贸有限公司,,,,
江苏鼎润珠宝有限公司,,,,
连云港嘉丽云华置业有限公司,,,,
江苏卡利文化传媒科技有限公司,,,,
连云港市环华建设工程有限公司,,,,
连云港市润本能源科技有限公司,,,,
江苏禾康建筑工程有限公司,,,,
江苏恒亚宠物用品有限公司,,,,
灌云县恒鼎桥梁模板厂,,,,
灌云蔚宇淡水养殖有限公司,,,,
江苏博伦项目管理有限公司,,,,
江苏奥润建设工程有限公司,,,,
东海县华创商务服务有限公司,,,,
连云港全明机械制造有限公司,,,,
连云港虬玛商贸有限公司,,,,
江苏德之爱文化传媒有限公司,,,,
连云港华博农业开发有限公司,,,,
江苏干的快景观绿化工程有限公司,,,,
东海县亿朋温室工程有限公司,,,,
东海县国富建筑劳务有限公司,,,,
江苏众享购网络科技有限公司,,,,
江苏刘高陆拾陆文化传媒有限公司,,,,
灌云县腾达渣土运输有限公司,,,,
江苏驰康医疗器械有限公司,,,,
东海县神州新型建筑材料厂,,,,
江苏米宝建筑劳务有限公司,,,,
连云港嘉庆环保科技有限公司,,,,
东海县崇道贸易有限公司,,,,
连云港旭通纸制品有限公司,,,,
灌云忠美建筑工程有限公司,,,,
东海县旷达建筑工程有限公司,,,,
江苏钻美会珠宝有限公司,,,,
东海县九泰光伏科技有限公司,,,,
连云港市庆畅建筑工程有限公司,,,,
江苏连云港阳瑞运输有限公司,,,,
连云港金泓瑞贸易有限公司,,,,
连云港装鑫建材销售有限公司,,,,
东海县通菲装饰工程有限公司,,,,
江苏慧思聪文化传播有限公司,,,,
东海县适g校车服务有限公司,,,,
灌云县金良缘大酒店有限公司,,,,
江苏八德机械工程有限公司,,,,
灌云金之凯实业有限公司,,,,
连云港康政农业科技有限公司,,,,
连云港市海泰运力供应链管理有限公司,,,,
连云港吉永建筑工程有限公司,,,,
东海县迈腾建筑劳务有限公司,,,,
连云港沃尔铌金属销售有限公司,,,,
连云港准时达物流有限公司,,,,
江苏木益坊装饰工程有限公司,,,,
连云港邦驰石英科技有限公司,,,,
连云港威速物流有限公司,,,,
江苏苔趣多食品有限公司,,,,
东海县建和粮食收购有限公司,,,,
灌云歌巢娱乐有限公司,,,,
东海县潇荣珠宝有限公司,,,,
连云港市盛之居建筑工程有限公司,,,,
江苏云伊堂中医药科技有限公司,,,,
东海县大圣建筑工程有限公司,,,,
江苏海之翼电子商务有限公司,,,,
连云港翔国工贸有限公司,,,,
连云港森建筑工程有限公司,,,,
连云港登杰文化传媒有限公司,,,,
东海县建泽建筑工程有限公司,,,,
江苏道生元企业管理咨询有限公司,,,,
东海县晨博吊装有限公司,,,,
连云港硅特国际贸易有限公司,,,,
连云港固利贸易有限公司,,,,
连云港邦苏建设工程有限公司,,,,
江苏丰之烨贸易有限公司,,,,
江苏跑不了百货服装有限公司,,,,
江苏邦凯劳务服务有限公司,,,,
东海县翠朵石英制品有限公司,,,,
连云港市灌云县居义可餐饮经营有限公司,,,,
东海县玖旺吊装服务有限公司,,,,
江苏雄酷建设工程有限公司,,,,
事为（江苏）安装技术有限公司,,,,
江苏冰逸酥建设工程有限公司,,,,
江苏顺林电动车修理有限公司,,,,
连云港市灌云县秀茹秀百货贸易有限公司,,,,
江苏宏安苑物业管理有限公司,,,,
江苏德跃|建筑工程有限公司,,,,
东海县艾涵进出口贸易有限公司,,,,
连云港市灌云县正友办公耗材销售有限公司,,,,
连云港卓启建筑安装工程有限公司,,,,
江苏万宇新材料有限公司,,,,
江苏品辉新材料科技有限公司,,,,
连云港箜篌工程机械租赁有限公司,,,,
江苏骁之阳工程机械有限公司,,,,
江苏迈纳新材料科技有限公司,,,,
东海县恒阳商贸有限公司,,,,
连云港梓津橙贸易有限公司,,,,
江苏新万格医疗科技有限公司,,,,
连云港中海生物科技有限公司,,,,
连云港华明泰材料科技有限公司,,,,
江苏东霞户外用品有限公司,,,,
连云港市赣榆区城头中心卫生院（连云港市赣榆区城头镇妇幼保健计划生育服务站）,,,,
连云港市威泰矿业有限公司,,,,
江苏三兴房地产开发有限公司,,,,
江苏中茂工艺品制造有限公司,,,,
江苏笨农生态农业有限公司,,,,
连云港市赣榆区小塔山水库管理处,,,,
江苏盈昱科技发展有限公司,,,,
连云港市赣榆区嘉合农村小额贷款有限公司,,,,
江苏康尔泰药业有限公司,,,,
连云港佳宇置业有限公司,,,,
连云港国瑞纺织有限公司,,,,
连云港黑林水务有限公司,,,,
江苏康必盛贸易有限公司,,,,
连云港恒安电子商务有限公司,,,,
连云港明东工艺品有限公司,,,,
连云港和安机电设备制造有限公司,,,,
连云港精益智能科技有限公司,,,,
连云港开成置业有限公司,,,,
连云港中大饲料有限公司,,,,
连云港天铖机械工程有限公司,,,,
连云港金亿达建设工程有限公司,,,,
连云港市泰锐电力设备有限公司,,,,
连云港伟盛设备制造有限公司,,,,
连云港如泰环保材料有限公司,,,,
连云港天成投资有限公司,,,,
江苏正星智能科技有限公司,,,,
连云港福晟商业运营管理有限公司,,,,
连云港榆美文化传媒有限公司,,,,
连云港润拓管理服务有限公司,,,,
连云港融锦建筑劳务有限公司,,,,
江苏翰硕建筑工程有限公司,,,,
连云港融鑫农贸市场有限公司,,,,
连云港信丰汽车贸易有限公司,,,,
连云港新蓝湾码头有限公司,,,,
连云港耀林房地产有限公司,,,,
连云港宗信仓储物流有限公司,,,,
江苏榆乐音频设备有限公司,,,,
江苏淘康国际贸易有限公司,,,,
江苏丛星电力工程有限公司,,,,
连云港中京冶建设工程有限公司,,,,
连云港山禾净水科技有限公司,,,,
江苏瑞之昌国际贸易有限公司,,,,
江苏汇智教育科技有限公司,,,,
连云港必牛实业发展有限公司,,,,
连云港暖桩贸易有限公司,,,,
江苏土生金生物科技有限公司,,,,
江苏纳全建设工程有限公司,,,,
江苏欧凯林肥业有限公司,,,,
连云港鑫珑达建筑劳务有限公司,,,,
连云港家宇建筑劳务承包有限公司,,,,
连云港永诚生猪养殖有限公司,,,,
连云港和瑞装饰工程有限公司,,,,
江苏巨之能环保科技有限公司,,,,
连云港凯创物流有限公司,,,,
连云港卢鑫建材有限公司,,,,
连云港林茂绿化工程有限公司,,,,
连云港亚宇建筑工程有限公司,,,,
连云港碧泽农业开发有限公司,,,,
贝芮（江苏）文化传媒有限公司,,,,
连云港科博物流有限公司,,,,
连云港大纳物流有限公司,,,,
江苏海千食品有限公司,,,,
连云港隆之昌建筑工程有限公司,,,,
连云港济林酒店管理有限公司,,,,
江苏省捷迈汽车贸易有限公司,,,,
江苏登之源实业发展有限公司,,,,
连云港赛健实业发展有限公司,,,,
连云港赛魅宝贸易有限公司,,,,
江苏春禄农业发展有限公司,,,,
连云港赣榆东舟果木种植农场,,,,
连云港金厉通实业发展有限公司,,,,
连云港硕瑞建筑劳务有限公司,,,,
哈里波顿（江苏）实业发展有限公司,,,,
连云港市赣榆区三峰饭店,,,,
江苏荣道体育发展有限公司,,,,
连云港作记建筑安装有限公司,,,,
连云港祥派建筑工程有限公司,,,,
江苏慈妃健康产业发展有限公司,,,,
江苏鹊立贸易有限公司,,,,
江苏赛贵设备安装服务有限公司,,,,
连云港海羊鲜食品有限公司,,,,
连云港惟之华建筑劳务有限责任公司,,,,
江苏泰密建设工程有限公司,,,,
连云港恒安新能源科技有限公司,,,,
连云港市信鑫v贸易有限公司,,,,
江苏利之川环保科技有限公司,,,,
江苏鑫屹旺实业发展有限公司,,,,
江苏硕健食品有限公司,,,,
江苏万峰装饰工程有限公司,,,,
连云港明慈水产品有限公司,,,,
江苏大锴供应链管理有限公司,,,,
连云港聚宝再生资源有限公司,,,,
江苏晨炊实业发展有限公司,,,,
连云港赣榆吉金农机服务专业合作联社,,,,
赣榆县盛源蓝莓专业合作社,,,,
连云港港口集团有限公司,,,,
江苏润普食品科技股份有限公司,,,,
连云港弘大旅游发展有限公司,,,,
江苏灌云农村商业银行股份有限公司,,,,
江苏省镔鑫钢铁集团有限公司,,,,
江苏海通建设工程有限公司,,,,
江苏华特建筑装饰股份有限公司,,,,
江苏雅仕投资集团有限公司,,,,
江苏瑞丰医药有限公司,,,,
江苏同科建设工程有限公司,,,,
灌云新农村农业综合开发有限公司,,,,
连云港图港贸易有限公司,,,,
连云港通裕天然气有限公司,,,,
江苏铭博建设工程有限公司,,,,
连云港金公果业有限公司,,,,
江苏龙腾化工有限公司,,,,
江苏恒特建设集团有限公司,,,,
连云港海德益食品有限公司,,,,
连云港双菱风电设备科技有限公司,,,,
江苏鹰游纺机有限公司,,,,
连云港天明装备有限公司,,,,
连云港港口集团财务有限公司,,,,
江苏云洲智能科技有限公司,,,,
光大环保（连云港）废弃物处理有限公司,,,,
江苏巨有建设工程有限公司,,,,
江苏仁欣环保科技有限公司,,,,
江苏泽禾环保工程建设有限公司,,,,
连云港富驰智造科技有限公司,,,,
江苏新龙港港口有限公司,,,,
连云港柏兴无纺布制品有限公司,,,,
江苏天马电商产业园有限公司,,,,
连云港博云生物科技有限公司,,,,
江苏维德新材料有限公司,,,,
连云港自贸区连海供应链管理有限公司,,,,
连云港金大地新型建材有限公司,,,,
连云港苏阳混凝土有限公司,,,,
连云港中彩科技有限公司,,,,
七洲绿色化工（连云港）有限公司,,,,
江苏海通融资担保有限公司,,,,
连云港瑞泰投资有限公司,,,,
宸芳源（江苏）农业科技开发有限公司,,,,
江苏连云港鸿瑞企业管理合伙企业（有限合伙）,,,,
连云港天地经纬房地产开发有限公司,,,,
江苏港利房地产开发有限公司,,,,
连云港虞舜置业有限公司,,,,
江苏巨瑞建设工程有限公司,,,,
连云港启锦建设开发有限公司,,,,
灌云县聚立商品混凝土有限公司,,,,
太阳雨工程技术有限公司,,,,
灌云连鑫能源科技有限公司,,,,
连云港牡丹园置业有限公司,,,,
连云港泰润融资租赁有限公司,,,,
江苏广之宇建设工程有限公司,,,,
东海县广迈贸易有限公司,,,,
江苏恒兴环保科技有限公司,,,,
大新（连云港）投资有限公司,,,,
江苏海湃实业发展有限公司,,,,
灌云林洋新能源科技有限公司,,,,
连云港澳洋置业有限公司,,,,
易家网络科技有限公司,,,,
江苏战友国际贸易有限公司,,,,
江苏创瑞标准件设备制造有限公司,,,,
连云港艾迪尔环保材料有限公司,,,,
液化空气（连云港）有限公司,,,,
国网连云港综合能源服务有限公司,,,,
江苏连云港港宁投资开发有限公司,,,,
江苏新海连商业保理有限公司,,,,
江苏运达地产有限公司,,,,
江苏恒兑实业有限公司,,,,
江苏旺道自动化设备有限公司,,,,
连云港永业房地产开发有限公司,,,,
江苏绿标环保科技有限公司,,,,
连云港昭泰粮食加工有限公司,,,,
连云港中南能源工程有限公司,,,,
中铧丰建设（江苏）有限公司,,,,
连云港U豪呈实业有限公司,,,,
连云港沃晴实业有限公司,,,,
江苏东润食品发展有限公司,,,,
江苏汇富再生资源有限公司,,,,
灌南县培润置业有限公司,,,,
江苏福康建筑劳务工程有限公司,,,,
连云港诚瑞环保固废处置有限公司,,,,
江苏晶矿农业科技有限公司,,,,
连云港华圣俄能源国际贸易有限公司,,,,
连云港市巨鼎房地产开发有限公司,,,,
江苏丰茂物流有限公司,,,,
连云港宗泽能源技术有限公司,,,,
连云港金元信息管理咨询有限公司,,,,
江苏文昊贸易有限公司,,,,
连云港顺时针电气有限公司,,,,
连云港祥惠农业发展有限公司,,,,
连云港太连投资发展有限公司,,,,
连云港源盛祥实业投资有限公司,,,,
连云港市富洋建材有限公司,,,,
连云港潮河湾水上旅游娱乐有限公司,,,,
江苏硕银建筑工程有限公司,,,,
传优文化发展有限公司,,,,
江苏禹建农业开发有限公司,,,,
发呗共享科技（江苏）有限公司,,,,
灌云县玉娇农实业有限公司,,,,
江苏国之利建设有限公司,,,,
