江苏海雄商务信息咨询有限公司,3年,lygsp08.daili
江苏高驰新材料科技有限公司,,lygsp08.daili
连云港川川汽车贸易有限公司,,lygsp08.daili
连云港瑞裕福贸易有限公司,,lygsp08.daili
连云港康泽汽车销售有限公司,,lygsp08.daili
连云港久长物流有限公司,1年,lygsp08.daili
连云港华唐装饰工程有限公司,,lygsp08.daili
连云港市利亚奇汽车销售服务有限公司,1年,lygsp08.daili
连云港同道建材商贸有限公司,2年,lygsp08.daili
连云港市亮洁物业管理有限公司,1年,lygsp08.daili
南京肯德基有限公司灌南世茂餐厅,,lygsp08.daili
连云港迪唛文化传媒有限公司,1年,lygsp08.daili
连云港闪电优选供应链有限公司,1年,lygsp08.daili
连云港市豪木家居中心,,lygsp08.daili
连云港佳家缘酒店有限公司,,lygsp08.daili
连云区香榭美容院,,lygsp08.daili
友信(青岛)信用管理有限公司江苏分公司,,lygsp08.daili
连云港弘诚睿电子商务有限公司,,lygsp08.daili
连云港黛芙妮医疗科技有限公司,1年,lygsp08.daili
海州区沙O美甲工作室,1年,lygsp08.daili
连云港唐弓丰田汽车销售服务有限公司,3年,lygsp08.daili
亿企赢财税咨询服务（连云港）有限公司,1年,lygsp08.daili
连云港跃福运汽车贸易有限公司,,lygsp08.daili
江苏玖龄美容管理有限公司连云港分公司,,lygsp08.daili
连云区鲜品阁酒楼,,lygsp08.daili
连云港韬光教育咨询有限公司,,lygsp08.daili
连云港华唐装饰工程有限公司,,lygsp08.daili
连云港华唐装饰工程有限公司,,lygsp08.daili
连云港顺祺国际货运代理有限公司,,lygsp08.daili
连云区新思达教育培训中心,,lygsp08.daili
赣榆区青口镇靓之洁洗车服务部,,lygsp08.daili
连云港盛资汽车销售服务有限公司,2年,lygsp08.daili
连云港浩邦汽车销售服务有限公司,1年,lygsp08.daili
海州区向阳社区相恒睿形象设计工作室,1年,lygsp09.daili
连云港郁州骨科医院有限公司,1年,lygsp09.daili
江苏乾元物业管理有限公司,,lygsp09.daili
经济技术开发区卡娜理发店,,lygsp09.daili
连云港希雅图文化传媒有限公司,3年,lygsp09.daili
海州区贾圩社区阿布里肯餐饮店,,lygsp09.daili
海州区星月家园婴儿用品经营部,,lygsp09.daili
连云港君吉机械配件销售有限公司,,lygsp09.daili
连云港日腾暖通工程有限公司,2年,lygsp09.daili
江苏德惠物业服务有限公司连云港分公司,5年,lygsp09.daili
连云港咪腾服饰科技有限公司,,lygsp09.daili
连云港天宝银城娱乐有限公司,1年,lygsp09.daili
海州区新桥社区润吉汽车经营部,1年,lygsp09.daili
连云区海顺汽车修理厂,1年,lygsp09.daili
连云港振荣家具有限公司,4年,lygsp09.daili
江苏久千谷贸易有限公司,1年,lygsp09.daili
江苏永连餐饮管理有限公司,2年,lygsp09.daili
连云港市连战酒店管理有限公司,,lygsp09.daili
连云港郁州骨科医院有限公司,,lygsp09.daili
连云港市宝典劳保用品有限公司,1年,lygsp09.daili
连云港九网络科技有限公司,1年,lygsp09.daili
连云港市晓雯教育咨询有限公司,,lygsp09.daili
连云港和美品居家居贸易有限公司,2年,lygsp09.daili
连云港市全胜木业有限公司,,lygsp09.daili
连云港市金恒塑料包装有限公司,1年,lygsp09.daili
连云港伟然建筑工程有限公司,,lygsp09.daili
连云港同路人营销策划有限公司,1年,lygsp09.daili
南京德汇通信技术有限公司连云港分公司,1年,lygsp09.daili
海州区盐河社区妮的衣柜服装店,,lygsp09.daili
海州区花果山街道楚年造型理发室,,lygsp09.daili
海州区任式食品经营部,,lygsp09.daili
连云港千君桌游有限公司,,lygsp09.daili
连云港林有矿美容服务有限公司,1年,lygsp09.daili
连云港全和房地产营销策划有限公司,1年,lygsp09.daili
连云港广隆天下企业管理咨询有限公司,,lygsp09.daili
连云港君吉机械配件销售有限公司,,lygsp09.daili
连云港君吉机械配件销售有限公司,,lygsp09.daili
连云港荣恒医疗器械销售有限公司,,lygsp09.daili
连云港鼎顺人力资源有限公司海州分公司,,lygsp09.daili
连云港福爱馨母婴护理有限公司,1年,lygsp09.daili
连云港花荟开化妆品有限公司,,lygsp09.daili
连云港无限大广告有限公司,,lygsp09.daili
连云港康诺科技有限公司,,lygsp09.daili
连云港广隆天下企业管理咨询有限公司,,lygsp09.daili
连云港君吉机械配件销售有限公司,,lygsp09.daili
连云港赣榆恒盛玛钢有限责任公司,2年,lygsp09.daili
连云港市连云区福奈特洗衣店,1年,lygsp09.daili
连云港花果山国际俱乐部有限公司,6年,lygsp09.daili
海州区马瑞美甲店,,lygsp09.daili
连云港鸿策商贸有限公司,,lygsp09.daili
连云港市新浦区艺北社区何勇阿香米线店,,lygsp09.daili
连云港盈川叉车有限公司,,lygsp09.daili
连云港金麦特精密机械有限公司,,lygsp09.daili
连云港市新浦区龙尾社区杨胜臣卤货店,,lygsp09.daili
连云港硕淦建筑材料有限公司,,lygsp09.daili
江苏君瑞汽车贸易有限公司,,lygsp09.daili
福士健康咨询（连云港）有限公司,,lygsp09.daili
