连云港市海州区天王星课外培训有限公司,1年,lygsp.daili
连云港科西嘉贸易有限公司,1年,lygsp.daili
海州区新海社区香缇女子美容会所,1年,lygsp.daili
海州区亚兰日用品经营部,1年,lygsp.daili
连云港海太尔防护用品有限公司,1年,lygsp.daili
海州区丹州海服饰店,,lygsp.daili
连云港天元宇宙网络信息科技有限公司,,lygsp.daili
新浦区蔷薇社区登安家具经营部,,lygsp.daili
连云港博达文化科技有限公司,,lygsp.daili
连云港市画点传媒有限公司,,lygsp.daili
江苏康爽生物科技有限公司,,lygsp.daili
连云港广积德中医诊所有限公司,,lygsp.daili
连云港臻鸿无惧科技有限公司,,lygsp.daili
连云港千雨达商贸有限责任公司,,lygsp.daili
连云港市嘉瑞宝商业发展有限公司,,lygsp.daili
连云港春来装饰工程有限公司,,lygsp.daili
连云港元木装饰工程有限公司,,lygsp.daili
连云港才智校外托管有限公司,,lygsp.daili
连云港浦瑞法科贸有限公司,,lygsp.daili
连云港市百汇餐饮管理有限公司,,lygsp.daili
江苏新能新材料有限公司,1年,lygsp.daili
连云港晋宇房地产经纪有限公司,3年,lygsp.daili
海州区美缔整形美容诊所,3年,lygsp.daili
连云港爱伦酒店管理有限责任公司,,lygsp.daili
连云港金公果业有限公司,,lygsp.daili
赣榆区城头镇麦德利蛋糕店,,lygsp.daili
连云港可信房产经纪有限公司,,lygsp.daili
连云港佑信房产有限公司,,lygsp.daili
连云港元木装饰工程有限公司,,lygsp.daili
连云港春来装饰工程有限公司,,lygsp.daili
连云港市金信包装有限公司,,lygsp.daili
江苏飓风医疗器械有限公司,1年,lygsp.daili
连云港旭泰网络科技有限公司海州分公司,,lygsp.daili
连云港拓绿农业开发有限公司,1年,lygsp.daili
连云港雨虹篷布制品有限公司,1年,lygsp.daili
江苏松霖餐饮有限公司,1年,lygsp.daili
连云港厚生餐饮服务有限公司,,lygsp.daili
海州区宗氏电器商行,2年,lygsp.daili
海州区李飞烘焙店,,lygsp.daili
海州区幸中社区乐惠便利店,,lygsp.daili
连云港爱彼迎住房租赁有限公司,,lygsp.daili
连云区天使宝贝儿童摄影馆,,lygsp.daili
海州区辣喜餐饮店,1年,lygsp.daili
连云港春旭滚塑科技有限公司,2年,lygsp.daili
海州区延东社区王志宇家居用品经营部,1年,lygsp.daili
连云港畅联网络科技有限公司,7年,lygsp.daili
新华人寿保险股份有限公司连云港中心支公司,3年,lygsp.daili
海州区万润社区严厨老坛酸菜鱼餐饮店,2年,lygsp.daili
连云港爱马茶叶销售有限公司,2年,lygsp.daili
赣榆区青口镇少侠汽车服务店,,lygsp.daili
赣榆县长丰建材经营部,,lygsp.daili
海州区向阳社区米兰贝贝摄影生活馆,,lygsp.daili
海州区嘉瀚烧江南烤肉店,,lygsp.daili
连云港千雨达商贸有限责任公司,,lygsp.daili
连云港玛尚商贸有限公司,1年,lygsp.daili
连云港龙塔研磨材料有限公司,2年,lygsp.daili
新浦经济开发区蓝灰红家具厂,2年,lygsp.daili
海州区香江社区漫辣餐饮店,2年,lygsp.daili
连云港鸿特文化传媒有限公司,1年,lygsp.daili
海州区果然优品农产品店,1年,lygsp.daili
华图设计院有限公司,1年,lygsp.daili
连云港市成市客厅餐饮娱乐有限公司,3年,lygsp.daili
海州区朐海社区车捷士汽车修理部,,lygsp.daili
连云港汇川法务咨询有限公司,,lygsp.daili
海州区河西社区周军餐饮店,,lygsp.daili
海州区忠清道餐饮店,,lygsp.daili
海州区台道炸串,,lygsp.daili
赣榆区青口镇皇爵理发店,,lygsp.daili
海州区郁州街道林夕百合家居经营部,,lygsp.daili
连云区喵汪宠物店,,lygsp.daili
连云港春来装饰工程有限公司,,lygsp.daili
江苏迈通新传媒科技有限责任公司,,lygsp.daili
江苏西之润实业有限公司,2年,lygsp.daili
赣榆区青口镇琦际美发店,1年,lygsp.daili
海州区河西社区刘翠玲餐饮店,2年,lygsp.daili
连云港乐尚装饰工程有限公司,1年,lygsp.daili
连云港吉顺贸易有限公司,2年,lygsp.daili
连云港思迈达机电工程有限公司,3年,lygsp.daili
海州区远超机械配件加工厂,,lygsp.daili
连云港赞诚贸易有限公司,,lygsp.daili
连云港鼎世国际货运代理有限公司,,lygsp.daili
开发区信力装饰用品商行,,lygsp.daili
连云区高小妖餐饮店,,lygsp.daili
连云港元木装饰工程有限公司,,lygsp.daili
赣榆区青口镇富瑶蛋糕西饼屋,,lygsp.daili
连云港许宁贸易有限公司,3年,lygsp.daili
连云港市海州区东方红教育培训中心,1年,lygsp.daili
连云港富龙达建材有限公司,1年,lygsp.daili
连云港市月富网络科技有限公司,1年,lygsp.daili
海州区副达汽车维修部,1年,lygsp.daili
连云港市三聚兴商贸有限公司,1年,lygsp.daili
连云港同达科技有限公司,2年,lygsp.daili
海州区越洋记餐饮店,,lygsp.daili
连云港港浦汽车销售服务有限公司,,lygsp.daili
连云港立轩体育文化有限公司,,lygsp.daili
海州区公园社区德寿食品店,,lygsp.daili
连云港千雨达商贸有限责任公司,,lygsp.daili
连云港唐秀文化传播有限公司,1年,lygsp.daili
连云港儒房房地产经纪有限公司,2年,lygsp.daili
连云港厚生餐饮服务有限公司,1年,lygsp.daili
连云港德易家不动产经纪有限公司,1年,lygsp.daili
连云港业莱贸易有限公司,,lygsp.daili
连云港古驿站酒店管理有限公司,,lygsp.daili
连云港佑信房产有限公司,,lygsp.daili
连云港可信房产经纪有限公司,,lygsp.daili
连云港儒房房地产经纪有限公司,1年,lygsp.daili
连云港鑫火汽车销售有限公司,1年,lygsp.daili
连云港东欣元电子商务有限公司,2年,lygsp.daili
连云港银城国际酒店管理有限公司,2年,lygsp.daili
广东华浔品味装饰集团江苏有限公司连云港分公司,,lygsp.daili
连云港佑信房产有限公司,,lygsp.daili
连云港恒诚建设工程有限公司,,lygsp.daili
连云港文驰房产经纪有限公司,1年,lygsp.daili
连云港市海州区原色艺术培训中心,8年,lygsp.daili
连云港市海州区市东社区卫生服务站,1年,lygsp.daili
连云港中晟汽车贸易有限公司,6年,lygsp.daili
连云港鼎逸企业管理咨询有限公司海州分公司,,lygsp.daili
海州区合记激情岁月饭店,,lygsp.daili
连云港臻鸿无惧科技有限公司,,lygsp.daili
连云港瑞尧生物科技有限公司,,lygsp.daili
连云港元木装饰工程有限公司,,lygsp.daili
连云港新福达汽车销售服务有限公司,1年,lygsp01.daili
海州区派特消毒用品经营部,3年,lygsp01.daili
连云港市八仙渔港酒店管理有限公司,3年,lygsp01.daili
连云港旭金房产经纪有限公司,1年,lygsp01.daili
连云港甲之源生物科技有限公司,,lygsp01.daili
连云港建祥钢结构有限公司,,lygsp01.daili
连云港汇成海网络科技有限公司,1年,lygsp01.daili
连云港知音文化传播有限公司,1年,lygsp01.daili
海州区山河饼局小吃店,1年,lygsp01.daili
福建省尚云亿家居家工程有限公司连云港分公司,1年,lygsp01.daili
赣榆区青口镇好莱客衣柜店,4年,lygsp01.daili
连云港尊诚汽车销售服务有限公司,,lygsp01.daili
连云港永利会计服务有限公司,,lygsp01.daili
连云港莲众企业管理有限公司,,lygsp01.daili
连云港联澳国际贸易有限公司,,lygsp01.daili
连云港易联智慧网络科技有限公司,,lygsp01.daili
连云区宝德宝家居店,,lygsp01.daili
连云港金公体育信息咨询有限公司,,lygsp01.daili
连云区峰艺琴行店,,lygsp01.daili
连云港万成装饰工程有限公司,,lygsp01.daili
经济技术开发区崔井伟汽车配件经营部,3年,lygsp01.daili
连云港星涌文化传媒有限公司,1年,lygsp01.daili
连云港宝竹商务酒店有限公司,1年,lygsp01.daili
连云港流逝留健身服务有限公司,,lygsp01.daili
连云区宝德宝家居店,,lygsp01.daili
赣榆区青口镇宇航软件销售部,,lygsp01.daili
连云港福斯特餐饮娱乐有限责任公司,,lygsp01.daili
连云港安泰房产经纪有限公司久和分公司,1年,lygsp01.daili
连云港金戈艺风文化传播有限公司,1年,lygsp01.daili
连云港市精益眼镜有限公司,1年,lygsp01.daili
连云港泉星和酒店管理有限公司,1年,lygsp01.daili
连云港喜捷诺科技有限公司,,lygsp01.daili
连云港欢朋餐饮管理有限公司,1年,lygsp01.daili
海州区灰墩羊肉馆,,lygsp01.daili
赣榆县青口镇小杨汽车配件经营部,,lygsp01.daili
海州区聚客优品生活超市,,lygsp01.daili
连云港恒源大药房连锁有限公司,1年,lygsp01.daili
连云港星希美术培训有限公司,2年,lygsp01.daili
连云港市道通汽车维修有限公司,,lygsp01.daili
连云港澜庭水汇企业管理有限公司,,lygsp01.daili
江苏华阳照明工程有限公司,3年,lygsp01.daili
连云港景瑞网络科技有限公司,1年,lygsp01.daili
连云港美味斋餐饮服务有限公司,1年,lygsp01.daili
连云港泓洋游乐设备有限公司,,lygsp01.daili
江苏靓车之家汽车服务有限公司,,lygsp01.daili
连云港文慧文化发展有限公司,1年,lygsp01.daili
连云港万众企业管理有限公司,1年,lygsp01.daili
江苏尚美物业管理有限公司,1年,lygsp01.daili
连云港市海州区沐恩课外教育有限公司,1年,lygsp01.daili
中国平安人寿保险股份有限公司连云港中心支公司灌云营销服务部,4年,lygsp01.daili
海州区东苑社区卢世东家具经营部,,lygsp01.daili
开发区鸿昱装饰材料经营部,,lygsp01.daili
江苏嘉会机电工程有限公司,,lygsp01.daili
中国平安人寿保险股份有限公司连云港中心支公司灌云营销服务部,1年,lygsp01.daili
连云港澜庭水汇企业管理有限公司,1年,lygsp01.daili
国行（江苏）商务服务有限公司,1年,lygsp01.daili
连云港联创专利代理事务所（特殊普通合伙）,1年,lygsp01.daili
海州区贤合庄餐饮店,,lygsp01.daili
连云区峰艺琴行店,,lygsp01.daili
连云港市天泰广告装饰有限公司,8年,lygsp02.daili
连云港卡熙文化传媒有限公司,,lygsp02.daili
江苏建院欧野科技有限公司,2年,lygsp02.daili
连云港新雨阳光新能源有限公司,1年,lygsp02.daili
连云港华耀国际贸易有限公司,1年,lygsp02.daili
连云港德和吊装有限公司,,lygsp02.daili
连云港启天智能科技有限公司,,lygsp02.daili
连云港众悦房产经纪有限公司,1年,lygsp02.daili
江苏快点装饰工程有限公司,1年,lygsp02.daili
连云港石化有限公司,2年,lygsp02.daili
连云港华协建设工程有限公司,1年,lygsp02.daili
阳光财产保险股份有限公司连云港中心支公司,1年,lygsp02.daili
连云港华务贸易有限公司,4年,lygsp02.daili
江苏润融企业管理咨询服务有限公司连云港分公司,1年,lygsp02.daili
连云港市美智艺术培训有限公司,,lygsp02.daili
连云港市中庆电梯工程有限公司,4年,lygsp02.daili
连云港瑞克麦斯国际贸易有限公司,,lygsp02.daili
连云港世华房地产经纪有限公司,1年,lygsp02.daili
连云港开发区人力资源开发有限公司,,lygsp02.daili
江苏昕锋消防工程有限公司,,lygsp02.daili
江苏中居不动产经纪有限公司,1年,lygsp02.daili
连云港赛豪国际贸易有限公司,1年,lygsp02.daili
连云港安泰房地产经纪有限公司,1年,lygsp02.daili
连云港点匠信息技术有限公司,,lygsp02.daili
赣榆区青口镇卫斯塔艺术培训中心,,lygsp03.daili
连云港市给力教育咨询有限公司,,lygsp03.daili
江苏科莱特建筑装饰工程有限公司,,lygsp03.daili
连云港市大自然婚纱摄影有限公司,,lygsp03.daili
连云港施蒂欧贸易有限公司,1年,lygsp03.daili
上云宸墅空间设计装饰工程（连云港）有限公司,,lygsp03.daili
连云港市大自然婚纱摄影有限公司,,lygsp03.daili
连云港花果山猴哥饮用水有限公司,1年,lygsp04.daili
紫金财产保险股份有限公司连云港中心支公司,,lygsp04.daili
连云港杰瑞澳斯特酒店管理有限公司,2年,lygsp04.daili
连云港晨旭健康管理咨询有限公司,1年,lygsp04.daili
连云港拓广贸易有限公司,,lygsp04.daili
苏飨（江苏）实业发展有限公司,,lygsp04.daili
连云港嘉海食品有限公司,,lygsp04.daili
连云港开发区欧派装饰工程经营部,,lygsp04.daili
连云港市新浦区扁担社区酷酷儿童摄影馆,5年,lygsp04.daili
连云港嘉皇文化传媒有限公司,1年,lygsp04.daili
连云港金喜鹊餐饮管理有限公司,1年,lygsp04.daili
新浦区扁北社区诗语鲜花礼仪服务部,,lygsp04.daili
连云港诺尔曼国际货运代理有限公司,,lygsp04.daili
连云港迷林文化传媒有限公司,,lygsp04.daili
连云港方星建筑装饰工程有限公司,,lygsp04.daili
连云港博瑞新能源科技有限公司,1年,lygsp04.daili
连云港宅小仙电子商务有限公司,4年,lygsp04.daili
海州区梦天建材商行,1年,lygsp04.daili
连云港德盛生物科技有限公司,2年,lygsp04.daili
连云港强之旭建筑装饰工程有限公司,1年,lygsp04.daili
连云港市乐迈工程项目管理咨询有限公司,,lygsp04.daili
千喜湖畔（连云港）酒店管理有限公司,,lygsp04.daili
连云港百贸网络工程有限公司,7年,lygsp04.daili
连云港俏妞妈食品有限公司,1年,lygsp04.daili
连云港融信房地产营销有限公司,1年,lygsp04.daili
连云港德天地产营销有限公司,1年,lygsp04.daili
连云港自然家装饰设计工程有限公司,2年,lygsp04.daili
连云港悦之家产后健康管理有限公司,1年,lygsp04.daili
连云港梓木装饰有限公司,,lygsp04.daili
连云港佳运道健身服务有限公司,,lygsp04.daili
连云港开发区欧派装饰工程经营部,,lygsp04.daili
江苏苏阳机电设备工程有限公司连云港开发区分公司,1年,lygsp04.daili
连云港天之乐商贸有限公司,1年,lygsp04.daili
海州开发区擎天建材商行,,lygsp04.daili
连云港梦昊影视文化传媒有限公司,,lygsp04.daili
连云港方星建筑装饰工程有限公司,,lygsp04.daili
连云港崛创贸易有限公司,4年,lygsp04.daili
连云港久屹装饰工程有限公司,,lygsp04.daili
连云港久伍装饰工程有限公司,4年,lygsp04.daili
连云港宅小仙电子商务有限公司,1年,lygsp04.daili
连云港市港城嘉宴企业管理有限公司,1年,lygsp04.daili
连云港博瑞新能源科技有限公司,2年,lygsp04.daili
连云港新飞雁毛毯有限责任公司,,lygsp04.daili
连云港城市之星装饰工程有限公司,1年,lygsp04.daili
连云港金津港汽车销售有限公司,1年,lygsp04.daili
连云港同道教育管理咨询有限公司,,lygsp04.daili
连云港海新旅游管理服务有限公司,,lygsp04.daili
连云港陈恒房产经纪有限公司,1年,lygsp05.daili
中国人民财产保险股份有限公司连云港市连云支公司,1年,lygsp05.daili
中国太平洋财产保险股份有限公司连云港中心支公司,1年,lygsp05.daili
连云港德刚商贸有限公司,,lygsp05.daili
连云港上和建设工程有限公司,,lygsp05.daili
连云港拓海人力资源有限公司赣榆分公司,,lygsp05.daili
上海晓行餐饮管理有限公司连云港分公司,1年,lygsp05.daili
连云港市正方建设监理有限公司,3年,lygsp05.daili
连云港三省堂健康管理有限公司,3年,lygsp05.daili
连云港湘冰酒店管理有限公司,1年,lygsp05.daili
连云港同福化工有限公司,,lygsp05.daili
东新国际货物运输代理（上海）有限公司连云港分公司,,lygsp05.daili
连云港聚隆贸易有限责任公司,,lygsp05.daili
连云港恒佰广告传媒有限公司,1年,lygsp05.daili
连云港舒健医药连锁有限公司,1年,lygsp05.daili
连云港飞人国际贸易有限公司,,lygsp05.daili
连云港市品匠阳光体育文化传播有限公司,,lygsp05.daili
连云港磊淘电子商务有限公司,,lygsp05.daili
连云港市居安暖通设备销售有限公司,,lygsp05.daili
连云港精选到家家政服务有限公司,,lygsp05.daili
连云港鑫纳装饰工程有限公司,,lygsp05.daili
连云港市沃佳房产策划营销有限公司,1年,lygsp05.daili
连云港胡旭再生资源有限公司,1年,lygsp05.daili
连云港树人酒店管理有限公司,,lygsp05.daili
连云港梯瓦口腔医疗有限公司,,lygsp05.daili
连云港腾锋通讯工程有限公司,,lygsp05.daili
江苏友安流体设备有限责任公司,,lygsp05.daili
江苏城市人家装饰有限公司,,lygsp05.daili
南京肯德基有限公司连云港利群广场餐厅,,lygsp05.daili
连云港励行体育管理有限公司,,lygsp05.daili
连云港励行体育管理有限公司,,lygsp05.daili
连云港岱润超市有限公司,,lygsp05.daili
连云港雅鑫装饰设计工程有限公司,,lygsp05.daili
连云港若森家具有限公司,1年,lygsp05.daili
连云港贝斯特机械设备有限公司,4年,lygsp05.daili
连云港益广渡商贸有限公司,,lygsp05.daili
连云港富裕酒店管理有限公司,,lygsp05.daili
连云港市康乐物流有限公司,,lygsp05.daili
连云港恒哲酒店管理有限公司,,lygsp05.daili
连云港宣祥广告有限公司,,lygsp05.daili
连云港比翼鸟婚恋服务有限公司,,lygsp05.daili
连云港精选到家家政服务有限公司,,lygsp05.daili
连云港励行体育管理有限公司,,lygsp05.daili
连云港励行体育管理有限公司,,lygsp05.daili
连云港诚纳贸易有限公司,,lygsp05.daili
连云港岱润超市有限公司,,lygsp05.daili
南京德邦物流有限公司赣榆分公司,,lygsp05.daili
江苏索亚建筑装饰新材料有限公司,1年,lygsp05.daili
连云港长脸叔叔艺术有限公司,,lygsp05.daili
连云港标点创意设计有限公司,,lygsp05.daili
连云港市静语轩茶业有限公司,,lygsp05.daili
江苏阿捷斯环保科技有限公司,,lygsp05.daili
连云港微城事网络科技有限公司,,lygsp05.daili
连云港金管家房产经纪有限公司,,lygsp05.daili
连云港木之峰建筑装饰工程有限公司,,lygsp05.daili
连云港泰凰域文化传媒有限公司,,lygsp05.daili
连云港云本生物科技有限公司,,lygsp05.daili
江苏阿捷斯环保科技有限公司,,lygsp05.daili
连云港岱润超市有限公司,,lygsp05.daili
连云港广津合商贸有限公司,2年,lygsp05.daili
江苏红动服饰有限公司,1年,lygsp05.daili
连云港云瑞登风课外培训有限公司,1年,lygsp05.daili
连云港养乃世家商贸有限公司,5年,lygsp05.daili
连云港鑫佳鑫贸易有限公司,,lygsp05.daili
连云港硕美建筑装饰工程有限公司,,lygsp05.daili
江苏阿捷斯环保科技有限公司,,lygsp05.daili
连云港励行体育管理有限公司,,lygsp05.daili
南京肯德基有限公司连云港利群广场餐厅,,lygsp05.daili
连云港大超宾馆有限公司,,lygsp05.daili
连云港岱润超市有限公司,,lygsp05.daili
连云港迅诚汽车销售服务有限公司,5年,lygsp05.daili
连云港耀仑电子科技有限公司,,lygsp05.daili
连云港冰港商贸有限公司,,lygsp05.daili
连云港二十一世纪不动产经纪有限公司,1年,lygsp06.daili
连云港市福韵阁房地产经纪有限公司,2年,lygsp06.daili
连云区康洁口腔门诊部,,lygsp06.daili
连云港泽沐迦健康养生服务有限公司,3年,lygsp06.daili
江苏荣升服务外包有限公司赣榆分公司,,lygsp06.daili
连云港众隆文化传媒有限公司,,lygsp06.daili
江苏连云港臻雨电子商务有限公司,,lygsp06.daili
连云港诚致国际货运代理有限公司,,lygsp06.daili
江苏连云港臻雨电子商务有限公司,,lygsp06.daili
连云港享悦时光母婴护理有限公司,,lygsp06.daili
连云港北峰通信科技有限公司,1年,lygsp06.daili
连云区盛世铭豪娱乐休闲室,2年,lygsp06.daili
连云港卡洛装饰工程有限公司,,lygsp06.daili
连云港方途建材科技有限公司,1年,lygsp06.daili
连云港华时通协众贸易有限公司,4年,lygsp06.daili
上海黑鸟企业管理有限公司连云港分公司,,lygsp06.daili
连云港聚祥国际物流有限公司,,lygsp06.daili
连云港海源国际旅行社有限公司,,lygsp06.daili
连云港恒享家房地产经纪有限公司,1年,lygsp06.daili
连云港社安消防安全科技服务有限公司,,lygsp06.daili
海州区利民社区指妍美甲店,,lygsp06.daili
海州区金艺福首饰店,,lygsp06.daili
海州区拉瑞美容店,,lygsp06.daili
连云港晟集旺企业服务有限公司,,lygsp06.daili
海州区潮童社儿童影像工作室,,lygsp06.daili
连云港米奇网络科技有限公司,,lygsp06.daili
元甲交通事故理赔代理服务（连云港）有限公司,,lygsp06.daili
连云港鸿辉装饰工程有限公司,,lygsp06.daili
江苏伟宏网络科技有限公司,1年,lygsp06.daili
连云港海东晶旅游开发有限公司,1年,lygsp06.daili
连云港水表有限公司,1年,lygsp06.daili
海州区潮童社儿童影像工作室,,lygsp06.daili
连云港鸿辉装饰工程有限公司,,lygsp06.daili
连云港久巨文化传播有限公司,1年,lygsp06.daili
连云港鸿辉装饰工程有限公司,,lygsp06.daili
江苏智者网络科技有限公司,2年,lygsp07.daili
连云港市腾迈文化传媒有限公司,,lygsp07.daili
连云港市长远电讯器材有限公司,,lygsp07.daili
连云港朗拓商贸有限公司,,lygsp07.daili
连云港长菱联华汽车销售服务有限公司,3年,lygsp07.daili
江苏海立威物业服务有限公司,2年,lygsp07.daili
连云港风夏教育信息咨询有限公司,,lygsp07.daili
连云港净洁餐饮管理有限公司,,lygsp07.daili
海州区浦河社区陆逸汽车修理厂,,lygsp07.daili
海州区悦澜川餐饮店,,lygsp07.daili
中碳能源（江苏）有限公司,3年,lygsp07.daili
连云港悟天房地产营销代理有限公司,1年,lygsp07.daili
连云港市景炫广告装饰有限公司,2年,lygsp07.daili
连云港小瓜科技有限公司,,lygsp07.daili
连云港万年红家具有限公司,,lygsp07.daili
赣榆区城头镇木而青艺术培训室,1年,lygsp07.daili
连云港苏晟庄建设工程有限公司,,lygsp07.daili
连云港来喔家餐饮服务有限公司,,lygsp07.daili
海州区金吉鸟健身馆,,lygsp07.daili
连云港企商云数据服务有限公司,1年,lygsp07.daili
连云港振飞物流有限公司,2年,lygsp07.daili
连云港一诺生物科技有限公司,1年,lygsp07.daili
海州区集光摄影工作室,,lygsp07.daili
海州区友帮干洗店,,lygsp07.daili
连云港市长远电讯器材有限公司,,lygsp07.daili
连云港宏硕企业管理有限公司,,lygsp07.daili
连云港市春辉教育有限公司,6年,lygsp07.daili
连云港保真连锁超市有限公司,3年,lygsp07.daili
连云港张掌柜餐饮有限公司,1年,lygsp07.daili
连云港博邦物流有限公司,,lygsp07.daili
海州区金吉鸟健身馆,,lygsp07.daili
连云港皓盛人力资源有限公司,,lygsp07.daili
江苏江铨贸易有限公司,1年,lygsp07.daili
连云港春暖花开贸易有限公司,1年,lygsp07.daili
连云港炙宝壹h餐饮管理有限公司,,lygsp07.daili
连云港市长远电讯器材有限公司,,lygsp07.daili
赣榆区青口镇爱巢美容店,,lygsp07.daili
江苏和记餐饮有限公司,6年,lygsp07.daili
江苏海立威物业服务有限公司,1年,lygsp07.daili
江苏升易有限公司,2年,lygsp07.daili
连云区万祥烘焙蛋糕店,,lygsp07.daili
海州区安琦手机通讯设备经营部,,lygsp07.daili
海州区梅莲餐饮店,,lygsp07.daili
海州区万润社区MM甜品店,,lygsp07.daili
江苏广久建设有限公司,,lygsp07.daili
赣榆区沙河镇依奕奶粉经营店,,lygsp07.daili
海州区多米烘焙店,,lygsp07.daili
海州区河西社区有菜有饭餐饮店,,lygsp07.daili
连云港龙河盛世营销策划有限公司,,lygsp07.daili
连云港蜂巢建筑装饰工程有限公司,,lygsp07.daili
连云港禾萌艺术培训有限公司,,lygsp07.daili
连云港蜂巢建筑装饰工程有限公司,,lygsp07.daili
连云港市长远电讯器材有限公司,,lygsp07.daili
连云港宝硕贸易有限公司,,lygsp07.daili
赣榆区青口镇爱度婚纱礼服店,,lygsp07.daili
海州区柒颜美容店,1年,lygsp07.daili
北京金辉锦江物业服务有限公司连云港分公司,2年,lygsp07.daili
连云港瑞业建设工程有限公司,,lygsp07.daili
江苏宝盈消防工程有限公司,,lygsp07.daili
连云港爱丽丝化妆品销售有限公司,,lygsp07.daili
江苏恒邦机电设备工程有限公司,,lygsp07.daili
连云港市长远电讯器材有限公司,,lygsp07.daili
连云港菲佑特电子科技有限公司,,lygsp07.daili
赣榆区青口镇志源建材经营部,,lygsp07.daili
连云港医武堂文化传播有限公司,,lygsp07.daili
连云港蜂巢建筑装饰工程有限公司,,lygsp07.daili
海州区贾圩社区金愿Ｖ楸Φ,2年,lygsp08.daili
江苏迎宾物业管理有限公司,5年,lygsp08.daili
连云港苏尚暖通设备工程有限公司,2年,lygsp08.daili
连云港市川帛国际贸易有限公司,1年,lygsp08.daili
连云港光程网络科技有限公司,,lygsp08.daili
连云港华唐装饰工程有限公司,,lygsp08.daili
连云港财汇项目管理有限公司,,lygsp08.daili
连云港连赛商贸有限公司,,lygsp08.daili
连云港沐湾推拿足疗保健服务有限公司,1年,lygsp08.daili
连云港九秀文化艺术传媒有限公司,2年,lygsp08.daili
江苏百事好实业有限公司,,lygsp08.daili
海州区欧美滋烘焙店,,lygsp08.daili
连云港弘诚睿电子商务有限公司,,lygsp08.daili
江苏鑫港业供应链管理有限公司,1年,lygsp08.daili
连云港鼎联财税管理有限公司,2年,lygsp08.daili
江苏钧丰实业有限公司,,lygsp08.daili
连云港市鑫文医疗器械有限公司,,lygsp08.daili
海州区骁峤食品经营部,,lygsp08.daili
连云港百仑生物反应器科技有限公司,2年,lygsp08.daili
连云港丰悦食品有限公司,1年,lygsp08.daili
