手机,京品手机Apple iPhone 11 (A2223) 128GB 紫色 移动联通电信4G手机 双卡双待,4399.00,手机收到真的太好看了，刚开始选颜色的时候还在纠结，最后还是选择了白色。白色的外观，看起来非常干净，简单大方。查了一下各方面是正品机器，质量没问题。手感很舒适，特意用了一周才来评价的。白色很适合女生使用，因为拍照有了超广角，然后拍照比以前的老机型好看多了。收到手机立即激活，很方便，原手机所有数据自动传输到新手机中。手机外形颜色质感和性能都很满意！苹果11外观时尚惊艳，超级耐看，LCD高清显示屏色彩显示均匀。A13芯片处理器性能强，日常使用运行流畅，反应速度快，玩游戏不卡顿。后置双摄像头聚焦快拍照清晰，图像处理色彩很好看。新电池续航比较长，使用一天没问题。拿着手感很好，大小刚刚好。屏幕清淅细腻，外放音质非常好。大广角镜头外出拍风景照片最好了，拍照一级棒，拍照效果显得特别真实，夜景拍出来很漂亮。ios手机系统运行非常流畅。,2021-07-27 21:43:17,5
手机,京品手机Apple iPhone 11 (A2223) 128GB 紫色 移动联通电信4G手机 双卡双待,4399.00,一直都在用苹果的手机，上个手机内存不足，所以换了这个iPhone11。还是喜欢黑色，黑色低调奢华，是我最喜欢的颜色，一如既往的好看，这次直接入手了最大内存的，256G，再也不用担心内存不够用了。手机拿到后外观很漂亮，6.1寸的刘海屏，还是经典设计的那个样子，手感非常不错，摸起来很有质感。一开始还担心屏幕黑边太粗，实物拿到手也还好，单手操作比较舒服，适合女孩子。女生喜欢拍照，苹果颜色还原的很好，不会像其他手机渲染的过分鲜艳夸张。A13的运行速度很快，不会卡顿，平时休闲喜欢打打游戏，完全没有压力。目前用了半个月，感受是待机挺好的，充电很快，信号也没问题。音效比较柔和，外放音乐不会刺耳，苹果双扬声器不是盖的。iOS系统的确好用，体验过的都知道，反应速度超快，没有卡顿现象。使用效果还是可以的。配送小哥也很贴心，当面还让打开核验。,2021-08-02 12:36:26,5
手机,京品手机Apple iPhone 11 (A2223) 128GB 紫色 移动联通电信4G手机 双卡双待,4399.00,iPhone11这个手机真的很不错，上个手机内存不足，所以换了这个iPhone11。还是喜欢白色，白色低调大气，是我最喜欢的颜色，一如既往的好看。特意用了好几天才来评价的。白色很适合女生使用，因为拍照有了超广角，然后拍照比以前的老机型好看多了。喜欢11的拍照效果，双摄，真的很不错了，我喜欢苹果的拍照风格，真就还原度很好。超广角镜头非常好用，拍照效果特别棒，尤其是夜景加补光，拍出来的不管是人像还是景色物体，都显得特别真实，跟姐妹拍照也是一种享受。6.1寸的刘海屏，还是经典设计的那个样子，手感非常不错，摸起来很有质感。11的音效比较柔和，外放音乐不会刺耳，苹果双扬声器不是盖的。A13的运行速度很快，不会卡顿，日常使用游戏，完全没有压力。很满意的购物体验。iOS系统的确好用，体验过的都知道，反应速度超快，没有卡顿现象。使用效果还是非常不错的！,2021-10-22 21:53:25,5
手机,京品手机Apple iPhone 11 (A2223) 128GB 紫色 移动联通电信4G手机 双卡双待,4399.00,手机收到真的太好看了，之前用了几年的苹果手机还是很好，就是64内存不够用，这次活动果断换新机，一如既往地好用，一直是苹果的真爱粉。直接入手了最大内存的手机，很喜欢11的拍照效果，双摄，真的很不错了，我喜欢苹果的拍照风格，真是还原度很好。超广角镜头非常好用，跟姐妹拍照也是一种享受。6.1寸的刘海屏，还是经典设计的那个样子，手感非常不错，摸起来很有质感。11的音效比较柔和，外放音乐不会刺耳，苹果双扬声器不是盖的。A13的运行速度很快，不会卡顿，日常使用多的还是游戏，完全没有压力。刚开始选颜色的时候还在纠结，最后还是选择了白色。白色的外观，看起来非常干净，简单大方。手感很舒适，特意用了好几天才来评价的。白色很适合女生使用，因为拍照有了超广角，然后拍照比以前的老机型好看多了。京东的小封条，看着就放心，配送小哥也很贴心，当面还让打开核验，很满意的购物体验。,2021-07-25 22:40:36,5
手机,京品手机Apple iPhone 11 (A2223) 128GB 紫色 移动联通电信4G手机 双卡双待,4399.00,外形外观：设计好手感很好四角圆滑屏幕音效：很不错感觉都是很清晰音质更好拍照效果：11拍照功能很完善配置很高不过个人感觉11拍人像不太好看6s拍照感觉还是很好看的但11也不差啦也能拍好看的看个人运行速度：很快流畅苹果系统一如既往的好待机时间：换了11电量可以用一天其他特色：11整体来说性价比是很不错的而且配置很好上一部是6s因为内存不够而且电池问题就换了优先考虑11是因为它整体上在一些内存运行配置上相对来说会好很多特别是待机时长真的让我摆脱带电宝的烦恼推荐推荐,2021-10-19 08:27:44,5
手机,京品手机Apple iPhone 11 (A2223) 128GB 紫色 移动联通电信4G手机 双卡双待,4399.00,苹果11屏幕分辨率很高颗粒感不明显很细腻音效也很不错对比安卓屏幕质感不在一个层次拍照效果：拍照效果很好特别是夜拍效果惊艳啊谁用谁知道运行速度：速度很快玩游戏发热但是快啊有些皮肤特效就是好看待机时间：一般一天一充吧，玩游戏消耗大一些这个懂得都懂其他特色：这个颜色很漂亮速度快就是把没有,2022-02-15 17:38:20,5
手机,京品手机Apple iPhone 11 (A2223) 128GB 紫色 移动联通电信4G手机 双卡双待,4399.00,从6s转11，体验极好，相对于之前用的小屏幕，感觉11真的太大了。用了三天了，给我感觉就是一个字，棒，续航真的没话说，我平时不打游戏，偶尔刷刷视频和聊聊天，电量最多能用两天！而且打开软件的速度很快，几乎完美！哈哈哈,2021-08-18 23:06:32,5
手机,京品手机Apple iPhone 11 (A2223) 128GB 紫色 移动联通电信4G手机 双卡双待,4399.00,苹果11手机白色款，外观时尚又大方，日常使用运行很流畅，反应速度特别快，无论是玩游戏还是看视频，完全不担心卡顿。苹果手机ios系统非常牛，外观好看又漂亮，设计的精美大气又上档次。非常适合女生。手感特别好，系统运行速度非常丝滑，用了很长时间，双摄像头，拍照清晰，续航能力长，关键还可以每天用水洗，手机很干净。屏幕在LCD届当属第一名。拍照真的没得说，非常清晰，充电速度也很快，买了六十五瓦的充电，一个多小时就充满。手机非常好用，质感很棒。收到手机立刻就激活了，非常便捷。原来手机所有数据会自动传输到新的手机，手机的外观，颜色，质感，性能都相当满意。一直以来都是用苹果手机，苹果11是一款非常棒的手机。处理器性能强，日常运行非常流畅，玩游戏不卡顿，反应也很快，后置双摄像头聚焦快，拍照清晰，图像处理色彩很均匀，电池续航能力长，使用一天完全没有问题。苹果手机十一真的很香，之前在实体店看过，实在价格太高，还是京东买最划算。屏幕很有质感，音效很好，各方面都非常完美。比安卓系统要好用太多。屏幕大，分辨率高，最好的就是lcd屏，毫不夸张，没有任何颗粒感。屏幕大，内存大，轻松使用一整天。,2021-04-03 21:09:46,5
手机,京品手机Apple iPhone 11 (A2223) 128GB 紫色 移动联通电信4G手机 双卡双待,4399.00,完美展示这手机的紫色美屏幕音效：屏幕虽然是LCD的，相较于三星amoled，分辨率显得较低，颜色也没有三星手机靓丽，但好在没有频闪，看久了很是舒服啊拍照效果：两个摄像头，你说牛不牛，平常拍照了，iphone拍照一如既往的真实，特别是两个摄影头带来了更多的玩法运行速度：A13是真的快，ios13也是真的牛皮。完全不掉帧，快的一批待机时间：待机时间超长，一天一冲完全够了，而且自己在网上买个快充套装，可以怼到18w，一个小时多一点就可以完全充满，临时出门，充半个小时也有百分之50，快充这个功能真的真的很实用其他特色：价位，跟上一代比算是良心价了，总体来说很满意，推荐大家购买！后摄像头会很丑，结果到手后颜值爆表，手感也很好！系统的运行速度没的说，很丝滑！唯一的不足是屏幕的ppi太低，没有三星的oled屏看起来细腻，不过用了两天也就看习惯了！总体还是很棒的！手机用了几天了，比较满意。手机外观漂亮，拿着手感很好，大小刚刚好。屏幕清淅细腻，外放音质非常好。大广角镜头外出拍风景照片最好了，ios手机系统运行非常流畅，用久了也不会卡机。新机子不玩游戏正常使用电量基本能用两天。表扬一下京东，送,2021-02-18 15:45:37,5
手机,京品手机Apple iPhone 11 (A2223) 128GB 紫色 移动联通电信4G手机 双卡双待,4399.00,外形外观：12有点复古，外观重新回归直角边框设计，直角边框使得屏幕边缘显得更窄一些，机身修长，外观更显得硬朗！屏幕音效：oled屏幕，更大更清晰，玩游戏看电影更加给力！显示效果细腻运行速度：系统流畅拍照效果：清晰，尤其夜景拍摄有了很大提升，非常出色,2021-11-28 23:19:54,5
手机,京品手机Apple iPhone 11 (A2223) 128GB 紫色 移动联通电信4G手机 双卡双待,4399.00,京东快递发货讯速，隔天到货618活动的价格超级给力，非常不错，性价比非常高，苹果11.128G用起来刚刚好，紫色外观真好看，运行速度很快，打游戏性能都很不错，估计可以再战个3年以上了，小城市5G覆盖不齐全还是苹果11的4G刚刚好用，很好,2021-07-11 20:39:45,5
手机,京品手机Apple iPhone 11 (A2223) 128GB 紫色 移动联通电信4G手机 双卡双待,4399.00,帮弟弟买的，感觉挺好的，反应很快，比我的8p反应快多了，大小也可以，总之很满意。外形外观：可以屏幕音效：挺好的拍照效果：可以运行速度：很快待机时间：还不清楚其他特色：黑色霸气,2022-02-24 18:47:46,5
手机,京品手机Apple iPhone 11 (A2223) 128GB 紫色 移动联通电信4G手机 双卡双待,4399.00,外形外观：6.1寸的刘海屏，浴霸摄像头，屏幕尺寸比之前用的6大很多屏幕音效：屏幕画质清晰，音效依然这么不错，超级赞拍照效果：拍照效果很棒，比之前用的6清晰很多，广角镜头很好用，赞运行速度：运行速度很快，应该可以坚持二三年,2021-06-27 16:54:09,5
手机,京品手机Apple iPhone 11 (A2223) 128GB 紫色 移动联通电信4G手机 双卡双待,4399.00,外形外观：第一次购买苹果手机，外观时尚漂亮，颜值担当，很适合小年轻。屏幕音效：屏幕点上去很舒服，触感超级好，听歌?音效很不错。拍照效果：虽然像素1200但是拍照的效果比安卓6400像素的还好，主要是每张照片不加修饰，还原度高运行速度：苹果系统运行速度不用多说，用个好几年也不会卡待机时间：不玩游戏，工作时候用，晚上差不多还有20电量，很耐用其他特色：真的很喜欢,2021-10-01 14:27:23,5
手机,京品手机Apple iPhone 11 (A2223) 128GB 紫色 移动联通电信4G手机 双卡双待,4399.00,"运行速度：我是用的仟元卷,省不少啊，追加里面说方法。苹果11手机绿色款,外观时尚又大方，日常使用运行很流畅，反应速度特别快,无论是玩游戏还是看视频,完全不担心卡顿。苹果手机ios系统非常牛，苹果产品的运行速度从未让人失望过,一如既往地快。电池容量提升很多，待机时间长。大品牌非常棒,外观颜色也很漂亮,看着很透亮，系统很稳定，手机大小正合适。颜色清新脱俗，不艳丽,很适合女生用，屏幕虽然是LCD的,相较于三星amoled,分辨率显得较低,颜色也没有三星手机靓丽，但好在没有频闪,看久了很是舒服啊。京东可以做12期的免息分期，可以缓解压力。屏幕在LCD界非常棒。想等Pro的,忍不住要换了,不知道还要多久才发布也不一定抢得到，考虑了很久还是决定换了11,幸好哥哥蛮推荐的，用这个京东活动限时绢1芊那,是聊天工具fut再连上了u8再989。总体来说都很棒!运行速度a13名不虚传全球第一。拍照真的没得讲,非常清晰,相当清晰,就是清晰,唯一的缺点就是拍得非常清晰。充电速度非常快，京东快递很快，值得表扬。",2021-04-11 22:41:53,5
手机,京品手机Apple iPhone 11 (A2223) 128GB 紫色 移动联通电信4G手机 双卡双待,4399.00,白色的外观很大气，看起来很上档次，很喜欢。双扬声器，音效特别棒。iOS14.7系统，丝般顺滑，拍照很苹果，很真实清晰，无论是广角还是变焦对焦都非常迅速，20瓦快充1个小时多一点就充满，电池也很耐用，轻度使用可以做到2天一冲！,2021-08-22 15:14:21,5
手机,京品手机Apple iPhone 11 (A2223) 128GB 紫色 移动联通电信4G手机 双卡双待,4399.00,真机比图片好看多了，颜色是我喜欢的那种绿色，拍照很清晰，速度很流畅，准备再入手一台，因为618每年只有一次，趁现在抓紧入手！,2021-06-19 07:46:37,5
手机,京品手机Apple iPhone 11 (A2223) 128GB 紫色 移动联通电信4G手机 双卡双待,4399.00,京东不错，这个手机一般般。,2020-08-25 12:20:09,3
手机,京品手机Apple iPhone 11 (A2223) 128GB 紫色 移动联通电信4G手机 双卡双待,4399.00,原来的手机外音坏了，又可以换手机了。4000左右加价性价比算是很高的了。外形外观：选的是白色看上去很清爽屏幕音效：放音乐的时候，把手机横着放着立体感很强的哦！运行速度：运行速度很快玩王者荣耀，开了好几个程序也不卡,2021-12-12 13:53:41,5
手机,京品手机Apple iPhone 11 (A2223) 128GB 紫色 移动联通电信4G手机 双卡双待,4399.00,媳妇一直想要一个iphone，正好她手机坏了，所以选了这款，买的时候正好降价，优惠力度很大，赚了个大便宜。这个紫色媳妇很喜欢，拿在手里爱不释手，拍照很高清，系统更不用说了，真的超级流畅，以前的手机卡的要命，给媳妇工作上带来很大不便，用了iphone11，啥都变快了，很赞！,2021-10-07 15:46:23,5
手机,Apple iPhone 12 (A2404) 256GB 黑色 支持移动联通电信5G 双卡双待手机,5699.00,手机很快收到了，AppleiPhone12的屏幕看起来太喜欢了。后感非常好，这应该是女生都喜欢的手机了吧，尤其是拍照效果真的太好了，双摄像头，后摄像头1200万像素，夜拍也很清晰，比起11，升级了很多。使用了一周了，感觉使用感受非常好，最喜欢的就是续航时间，充电一次可以用一天。这次的活动减下来价格还是很合适的，这款手机特别轻巧，比11要轻差不多30g左右，而且性能强大，搭载最新A14仿生芯片，流畅自然。充电特别快，有无线快充和有线直充的。黑色外观很炫酷，感觉黑色最适合全屏手机了，后盖玻璃看着典雅、大气。运行速度很快，苹果系统都是运行流畅，不卡顿，苹果运行软件速度特快，信号除外。音质很不错，苹果外壳拿着丝滑、顺手。iPhone12整体体验不错，各方面细节做得很好，没有发现绿屏的情况。屏幕分辨率也很好，屏幕显示细腻，升级之后的更好用，特别满意。,2021-07-26 22:26:19,5
手机,Apple iPhone 12 (A2404) 256GB 黑色 支持移动联通电信5G 双卡双待手机,5699.00,AppleiPhone12手机收到了，很好看的手机，买的是128GB的，内存足够用了。手机是紫色的，外观可以说是非常的好看，就很温柔的颜色，非常适合女生使用。机身拿着很舒服，手感是真的好，就喜欢苹果的系统。用起来流畅不会卡顿，oled的显示屏看着很舒服，不刺眼。感觉方框设计的回归更加时尚，边框也变窄了，非常漂亮的手机。真的很喜欢这个手机，拍照也很好看呀，夜景模式很不错！比11升级了很多，非常好的拍照模式。12的音质很好，各方面都挺喜欢的，对于我来说，2800毫安的电池，如果不打游戏，勉强一天一充是可以的。目前就是用了一段时间了，感觉这个手机真的很不错！最喜欢的还是颜色，紫色真的也太美了。光滑亮面的玻璃后盖，以及在磨砂质感金属中框的衬托下，显得更加的精致，非常美！原像机拍出来的相片还原度很高，而且相片很好看。保护个人隐私方面，苹果也是做得很好，非常满意！,2021-12-03 19:41:55,5
手机,Apple iPhone 12 (A2404) 256GB 黑色 支持移动联通电信5G 双卡双待手机,5699.00,之前就看好了这个手机，现在终于拿到手了。真的太喜欢了，中国红高贵，是那种很亮眼的红，但是不会很艳丽，这款手机颜值非常高。之前一直用的是小米手机，用了苹果手机感觉真的不是安卓手机能比的，系统流畅度太棒了，其他各方面也一样的强，运行非常流畅没有卡顿。oled的显示屏看着很舒服，不刺眼。感觉方框设计的回归更加时尚，边框也变窄了，非常漂亮。手感超好很喜欢。除了运行更流畅之外，它的机身手感真的是太惊喜了，摸上去质感很好。iPhone一贯都是做的比较轻薄的，但这次的iPhone12则是超薄了。拍照的很像非常的清晰、很好看，屏幕分辨率显示很高，眼睛看着很舒服，音质很好，厚度仅仅7.4mm，拿在手上非常轻薄。已经使用好几天了，体验感非常好，没有丝毫的卡顿迹象，运行APP都非常流畅。速度非常完美，尺寸比较合适，续航能力强，配合原装充电器，一个半小时充满电。,2021-07-25 22:31:25,5
手机,Apple iPhone 12 (A2404) 256GB 黑色 支持移动联通电信5G 双卡双待手机,5699.00,这是买的第三个苹果了，用惯了苹果的系统。手机很快收到了，使用了一周了，感觉使用感受非常好，最喜欢的就是续航时间，充电一次可以用一天。12的屏幕看起来太喜欢了。手感非常好，这应该是女生都喜欢的手机了，尤其是拍照效果真的太好了，双摄像头，后摄像头1200万像素，夜拍也很清晰，比起11，升级了很多。这次的活动减下来价格还是很合适的，这款手机特别轻巧，比11要轻差不多30g左右，而且性能强大，搭载最新A14仿生芯片，流畅自然。充电特别快，有无线快充和有线直充的。红色外观很炫亮，感觉中国红最热情了，后盖玻璃看着高大上。运行速度很快，真的是很喜欢用了，系统很流畅，而且没有垃圾广告，真的是很好。这部12的大小也正好，重量比之前的轻了，女生用的话正好合适，颜色也好看，貌似买了三个iPhone都很不错，这次买的是红色，以前就喜欢金色和黑色。,2021-07-27 21:39:35,5
手机,Apple iPhone 12 (A2404) 256GB 黑色 支持移动联通电信5G 双卡双待手机,5699.00,AppleiPhone12收到了，还是最喜欢黑色，黑色永远是经典色，永远那么百搭。很喜欢的怀旧风格，恢复了乔布斯时代的设计，外观很好看。用了一个星期了，才来评价的，手机收到真的太喜欢了。收到手机立即激活，很便捷，原手机所有数据自动传输到新手机中，手机颜色质感和性能都很满意。之前用了几年的苹果手机还是很好，就是内存不够用，这次活动果断换新机，一如既往地好用，一直是苹果的真爱粉。外形设计精美上档次，而且特别简洁。屏幕清晰明亮，音效效果非常棒。超广角镜头非常好用，记录生活也是一种享受。6.1寸的刘海屏，真的是很喜欢了，系统很流畅，而且没有垃圾广告，真的是很好。这部12的手感也很好，大小也正好，重量比之前的轻了，女生用的话正好合适，颜色也好看，貌似买了2个iPhone都是黑色，下次再换机的时候可以尝试一下别的颜色。就是很喜欢啦！,2021-11-15 07:42:22,5
手机,Apple iPhone 12 (A2404) 256GB 黑色 支持移动联通电信5G 双卡双待手机,5699.00,iPhone12手机收到了，打开非常的惊喜啊，白色也太好看了吧，白色感觉柔和，相较于其他配色又不失大气，非常的喜欢！这颜值真的爱了爱了，拿起来手感特别好，女生都喜欢的样子，高颜值的手机。一直都是iPhone的铁粉，12的新设计回归之前iPhone4方正边框时代，真的很好看，信号比之前11好很多，至少我目前呆的地方都是如此，5G网速很快，但是比较耗电，这反应速度是真的快。屏幕显示效果很好，OLED大屏幕很棒，边框比11细不少，颜值跟手感是真的好呀。音效也非常好，外放很清晰，重低音分明，音质非常清晰，音乐音质非常棒。12的做工非常好，手感握持度非常好，非常的有质感。拍照也是超级好，加上经典的相机模组设计，加入了超广角低加持，拍出的照片依然清晰明亮，适合女生的拍照手机。屏幕分辨率真的超级棒，A14的仿放生芯片说，整体运行非常流畅，非常不错的体验。,2021-11-02 20:56:32,5
手机,Apple iPhone 12 (A2404) 256GB 黑色 支持移动联通电信5G 双卡双待手机,5699.00,一直想换手机，最后还是喜欢买了iPhone12，还是选择的黑色，喜欢苹果的流畅。手机还是很好用的，苹果的手机就是流畅，进入到5G时代，大部分旗舰机型的机身都变的厚重，甚至有些手机的裸重都超过200g了。而iPhone12的裸重只有162g，厚度仅仅7.4mm，拿在手上那叫一个轻薄，单手持握非常轻松，手腕压力减轻不少。黑色是我非常喜欢的一个颜色，它的颜色是非常亮眼的，这个颜色配上光滑亮面的玻璃后盖，以及在磨砂质感金属中框的衬托下，显得更加的细腻精致。虽然我手上这台iPhone12才用没几天，但是它的体验已经让我感到非常满足！是非常好用的一款手机。用了一段时间没发现什么问题，自己另购了原装快充充电头，一个半小时就可充满电，不打游戏电池大概可用2-3天左右充一次电，外观、音效、拍照、运行速度没得说，包装也保护的很好，收到的时候非常完美！iOS系统的流畅那不是盖的，性价比很高。,2022-02-18 14:43:16,5
手机,Apple iPhone 12 (A2404) 256GB 黑色 支持移动联通电信5G 双卡双待手机,5699.00,收到iPhone12手机后，第一时间激活了手机，没有任何问题，手机非常流畅。iPhone12采用了iphone4s的那种直角边框，看起来方方正正得，拿在手中感觉还是很不错的，比iPhoneX那种圆滑的边框更有感觉，尤其是7.4mm的厚度，配上直角边框特别带感。手机看起来特别大气，颜值很高，自己买了充电器，用20瓦的充电器充电超级快，很快就充满了，5G网络特别好用，网速超快。屏幕显示效果很好，OLED大屏很棒！屏幕尺寸适中，拿在手里比较轻巧，尤其是对女性用户来说十分友好，这类型的用户适合入手。可以说苹果iPhone12是一款真正意义上的全球范围内的5G手机。个人觉得这款手机性价比很高，各方面性能都很好，身边朋友也有很多人用这个手机，口碑非常好，之前用的还是苹果8，这次换了新手机，感觉非常喜欢。白色手机的好酷啊，超薄，看起来简单大方！新手机待机时间很长。,2021-08-19 20:45:08,5
手机,Apple iPhone 12 (A2404) 256GB 黑色 支持移动联通电信5G 双卡双待手机,5699.00,iPhone12手机收到了，还是比较喜欢苹果的系统，128GB的就足够用了。白色的手机就是我最喜欢的颜色，看起来就简单大气，颜色是非常好看了。主要看重的是IOS系统，有自动清理垃圾的功能。所以一直用的是苹果手机，是刘海屏幕的，用着很舒服。以前用的苹果8已经没用了，但是依然不卡。非常信赖京东自营店的电子产品，产品的质量放心。12的拍照效果也是很好的，不过我比较少拍照，对于这个功能没有太大的要求。iOS系统的流畅那不是盖的，是真的顺畅，用起来不会卡顿，反应很快！手机非常的好用，而且手感也非常的好。而且128g的刚刚够用了，打游戏一点都不卡。音质音量也非常的清晰，非常的好！运行的速度很快，新手机使用非常的流畅！苹果A14运行流畅，之后几年估计也可以流畅的使用，视频里也能看到ios系统的动画很细腻，非常的流畅，看起来非常的舒服！值得购买的iPhone12。,2021-12-26 20:55:34,5
