手机,Redmi 9A 5000mAh大电量 1300万AI相机 八核处理器 4GB+64GB 晴空蓝 智能手机 小米 红米【电信新用户专享】,599.00,质量很好！物超所值！赞赞赞！,2022-02-14 09:52:46,5
手机,Redmi 9A 5000mAh大电量 1300万AI相机 八核处理器 4GB+64GB 晴空蓝 智能手机 小米 红米【电信新用户专享】,599.00,很好，在京东购买很放心，快递也很快,2022-02-14 09:49:17,5
手机,Redmi 9A 5000mAh大电量 1300万AI相机 八核处理器 4GB+64GB 晴空蓝 智能手机 小米 红米【电信新用户专享】,599.00,(?&bull;??&bull;?)??价格超优惠，性能也非常棒，完美的一次购物外形外观：物超所值，非常满意，期间有点小插曲，店家细致周到的服务让人很感动，祝生意兴隆，还会再来屏幕音效：非常好，宝贝很高大上，质量很好，看上去就给人一种高级感，价格也合适，这次网购很愉快，大赞?,2022-02-14 09:41:13,5
手机,Redmi 9A 5000mAh大电量 1300万AI相机 八核处理器 4GB+64GB 晴空蓝 智能手机 小米 红米【电信新用户专享】,599.00,京东速度就是快，省心。,2022-02-14 09:31:11,5
手机,Redmi 9A 5000mAh大电量 1300万AI相机 八核处理器 4GB+64GB 晴空蓝 智能手机 小米 红米【电信新用户专享】,599.00,此用户未填写评价内容,2022-02-14 09:26:29,5
手机,Redmi 9A 5000mAh大电量 1300万AI相机 八核处理器 4GB+64GB 晴空蓝 智能手机 小米 红米【电信新用户专享】,599.00,还不错，性价比高，挺适合老年人用的,2022-02-14 09:13:28,5
手机,Redmi 9A 5000mAh大电量 1300万AI相机 八核处理器 4GB+64GB 晴空蓝 智能手机 小米 红米【电信新用户专享】,599.00,送货挺快的，性价比很好。送货挺快的，性价比很好。,2022-02-14 09:12:12,5
手机,Redmi 9A 5000mAh大电量 1300万AI相机 八核处理器 4GB+64GB 晴空蓝 智能手机 小米 红米【电信新用户专享】,599.00,手机使用流畅，手感很好,2022-02-14 09:03:56,5
手机,Redmi 9A 5000mAh大电量 1300万AI相机 八核处理器 4GB+64GB 晴空蓝 智能手机 小米 红米【电信新用户专享】,599.00,送货快，价格平宜，服务好,2022-02-14 09:01:56,5
手机,Redmi 9A 5000mAh大电量 1300万AI相机 八核处理器 4GB+64GB 晴空蓝 智能手机 小米 红米【电信新用户专享】,599.00,包装完好。物流也快，手机效果还不错,2022-02-14 09:01:41,5
手机,Redmi 9A 5000mAh大电量 1300万AI相机 八核处理器 4GB+64GB 晴空蓝 智能手机 小米 红米【电信新用户专享】,599.00,送给老妈用了，她说不错！,2022-02-14 08:30:14,5
手机,Redmi 9A 5000mAh大电量 1300万AI相机 八核处理器 4GB+64GB 晴空蓝 智能手机 小米 红米【电信新用户专享】,599.00,国产机中的战斗机神机啊。上市这么久都不跌价。好用才是王道，待机久，信号好。不玩大型游戏就足够了。,2022-02-14 08:17:32,5
手机,Redmi 9A 5000mAh大电量 1300万AI相机 八核处理器 4GB+64GB 晴空蓝 智能手机 小米 红米【电信新用户专享】,599.00,很不错。,2022-02-14 07:34:21,5
手机,Redmi 9A 5000mAh大电量 1300万AI相机 八核处理器 4GB+64GB 晴空蓝 智能手机 小米 红米【电信新用户专享】,599.00,外形外观：很喜欢屏幕音效：很好拍照效果：很好运行速度：很快待机时间：电很斤用其他特色：颜色很好看质量很好，卖家服务态度很好，物流也很快，很喜欢！,2022-02-14 07:32:48,5
手机,京品手机Redmi K40游戏增强版 天玑1200处理器67W闪充 120Hz高刷直屏 8GB+128GB 暗影 游戏电竞智能5G 小米 红米,1699.00,RedmiK40游戏增强版手机收到了，1200旗舰处理器，配置还是很不错的。主要是为了打游戏，屏幕采用120赫兹高刷新率，非常适合打吃鸡打王者，画面刷新率高。OLED屏幕果然不是盖的，显示效果细腻清晰，眼睛很舒服。120HZ的高刷屏幕真的好，再去看别的屏幕就没办法适应了。拍照效果很好，6400万的主摄像头，效果真不错，对焦准确，喜欢拍照的日常够用了。运行速度是真的快，天玑1200，旗舰机的cpu，使用起来非常流畅，运行大型游戏毫无压力，平时使用完全足够了。待机时间还可以，5000毫安的电池，平时打游戏耗电也不会很快，这点非常喜欢！很喜欢的一部手机，机械手感非常棒，其次打游戏非常实用。这款手机的外观很好看，充满了电竞元素，非常好看的手机。红米k40游戏增强版，上面还有单独的游戏按键，目前也是联发科的顶级处理器，游戏性还不错，反应速度也很快。,2021-11-05 18:52:54,5
手机,京品手机Redmi K40游戏增强版 天玑1200处理器67W闪充 120Hz高刷直屏 8GB+128GB 暗影 游戏电竞智能5G 小米 红米,1699.00,RedmiK40这款游戏增强版小米手机收到了，收到非常的喜欢。今年最具性价比的游戏手机之一，买回来当备用机，拿来打手游的。颜值还是高的，边框是金属的，后盖的玻璃做出来金属的质感，质感非常的轻薄。从红米红米Note9到现在的红米k40增强版，一直是个游戏迷。配置外形都很不错，配置很齐全，非常不错的一款手机。手机外观很漂亮，屏幕音效比较大，拍照效果比较清晰，运行速度非常的快。机身仅有8.3mm厚度，205g，真的是很轻薄了，而且还好玩，手感超凡，不觉得厚重。充电是67瓦的，充电速度很快。充电器颜色有点骚气，游戏肩键比较适合射击类游戏，体验感很好，呼吸灯也很漂亮。包装盒非常的大气，然后开机后主题也是定制的，区别于其他miui系统，真的惊艳到我了。还是相当不错的，送的手机壳很贴合，我感觉比k40和其他品牌都要好。非常满意的手机购物体验。,2021-08-16 22:05:18,5
手机,京品手机Redmi K40游戏增强版 天玑1200处理器67W闪充 120Hz高刷直屏 8GB+128GB 暗影 游戏电竞智能5G 小米 红米,1699.00,红米k四零游戏增强版采用天机的芯片，很适合打游戏。屏幕采用120赫兹高刷新率。非常适合打游戏打吃鸡打王者，触控灵敏，刷新率高。电池也大，不用考虑电量问题。很适合年轻人使用。,2021-08-18 22:47:34,5
手机,京品手机Redmi K40游戏增强版 天玑1200处理器67W闪充 120Hz高刷直屏 8GB+128GB 暗影 游戏电竞智能5G 小米 红米,1699.00,外形外观：机械肩键。光刃外观，跑马灯特效，3个mic，双jbl音响，足足给了不少惊喜。屏幕音效：虽然是国产屏，显示效果不输同层次e3类显示屏。运行速度：12g运行＋256内存，足够用了，很流畅，搭配联发科天玑1200处理器，性能虽不如骁龙888/870，足够用了。待机时间：超长续航，一局王者荣耀下了四五个电，刷视频一上午还有60+电量，搭配67w充电器，充电很快！关于发热问题，可能我们这边温度不是很高了，发热量一般。其他特色：万能遥控太实用了，家里面美的，格力，tcl家具均能使用，包括网络机顶盒。第一次用小米手机给了不少惊喜，对比目前搭载天玑1200处理器的三款手机，最终选择了k40这款。性价比很高。,2021-09-08 13:39:54,5
手机,京品手机Redmi K40游戏增强版 天玑1200处理器67W闪充 120Hz高刷直屏 8GB+128GB 暗影 游戏电竞智能5G 小米 红米,1699.00,小哥送的很及时，外包装完好，打开后，卡针，说明书，三包凭证，透明手机壳，快充，数据线，主机，都在！手机壳不太理想，无法全包镜头，手机的做工精细，中框的金属材质做工很好，握持很有质感，屏幕很灵敏，指尖点触反应非常快，我很喜欢！,2021-09-04 18:15:39,5
手机,京品手机Redmi K40游戏增强版 天玑1200处理器67W闪充 120Hz高刷直屏 8GB+128GB 暗影 游戏电竞智能5G 小米 红米,1699.00,非常好用5000mah67w快充，超窄边框，打游戏非常合适，还有游戏肩键，吃鸡直接4指玩家，京东会员2044买的12+256，非常香，性价比无敌，充电线L头设计，打游戏非常方便，120hz高刷十分流畅！强力推荐！！！,2021-11-05 00:41:34,5
手机,京品手机Redmi K40游戏增强版 天玑1200处理器67W闪充 120Hz高刷直屏 8GB+128GB 暗影 游戏电竞智能5G 小米 红米,1699.00,非常方便实用的手机，效果还，大屏，看起来也是非常的爽，好用方便的手机，效果好，经济实用，方便使用，非常的不错，非常的好用的手机，打游戏效果也是非常的棒，非常的方便好用，很好的手机，飞醋喜欢，好用实用，使用好，不错的收据，安全可靠，效果还，经济实惠。,2021-09-25 17:13:09,5
手机,京品手机Redmi K40游戏增强版 天玑1200处理器67W闪充 120Hz高刷直屏 8GB+128GB 暗影 游戏电竞智能5G 小米 红米,1699.00,外形外观：右侧的肩键我用起来很舒服，屏幕音效：是从上下两侧发出声音，不戴耳机都很有立体感拍照效果：像素在旗舰机来看中规中矩运行速度：8G，打王者一点都不卡，和平也能带动，这可是游戏手机待机时间：大概一天半中度使用,2021-06-18 23:23:58,5
手机,京品手机Redmi K40游戏增强版 天玑1200处理器67W闪充 120Hz高刷直屏 8GB+128GB 暗影 游戏电竞智能5G 小米 红米,1699.00,外观酷炫颜值担当手感好8G大内存天玑1200联发科旗舰处理器运行流畅专属游戏按键游戏体验特别棒搭配67瓦快充充电速度杠杠的两千元档无敌好评,2021-09-08 13:32:22,5
手机,京品手机Redmi K40游戏增强版 天玑1200处理器67W闪充 120Hz高刷直屏 8GB+128GB 暗影 游戏电竞智能5G 小米 红米,1699.00,一直喜欢红米这个品牌，这次换的是第三台了，原来的手机内存差不多满了考虑换一台大内存的，这次选了很久，我不玩游戏，但还是最终被这款手机的颜值折服了，最终选了这款，游戏手机嘛，运行、显示、音效、电池容量等性能肯定要求是比较高的，也一定能满足我的日常使用，所以选择了这款，拿到手时也确实没让我失望，而且超出了我的期望，前晚下单第二天下午就到了，京东物流给力。如果对拍照要求不高的，推荐入手这款手机，不会让你失望的。,2021-08-07 23:11:19,5
手机,京品手机Redmi K40游戏增强版 天玑1200处理器67W闪充 120Hz高刷直屏 8GB+128GB 暗影 游戏电竞智能5G 小米 红米,1699.00,体验感非常好，手感也好。流畅度也不错，发热也控制的很好。不输那个888的。确实薄的不像话。Jbl的音响不是盖的，简直就是嘎嘣脆。,2021-11-05 11:47:02,5
手机,京品手机Redmi K40游戏增强版 天玑1200处理器67W闪充 120Hz高刷直屏 8GB+128GB 暗影 游戏电竞智能5G 小米 红米,1699.00,外形外观：机械式设计外观。视觉效果震撼。非常大气的设计风格。非常具有别具一格的体验屏幕音效：采用了最新的OLED屏幕。分效率超级高。显示非常细腻。音质非常清晰。听觉非常舒服。打游戏更好的与队友交流。拍照效果：后置三摄镜头。主摄6400万像素。一颗广角一颗长焦。拍摄人物风景。都十分到位。非常清晰的镜头运行速度：购买12+256的运行内存与存储空间。运行速度非常的快。使用起来丝滑流畅。一点没有顿挫感。太惊艳的体验。非常舒服。待机时间：内置了5000毫安大电池。加上67W的快充。一点不用担心平日的手机续航。一般来说。充一次？管一天待机没有问题。其他特色：采用了联发科天机1200芯片。6纳米的制造工艺。功耗非常出色。安兔兔跑分76万。打游戏妥妥的王者机器。,2021-08-23 01:29:51,5
手机,京品手机Redmi K40游戏增强版 天玑1200处理器67W闪充 120Hz高刷直屏 8GB+128GB 暗影 游戏电竞智能5G 小米 红米,1699.00,用了十几天了，期间没有任何问题，想要入手的朋友们赶紧入手吧。整体配置对的起这个价钱，主要用来打游戏了，，体验感相当好，质感也很不错，性价比，红米没输过。,2021-12-31 14:07:45,5
手机,京品手机Redmi K40游戏增强版 天玑1200处理器67W闪充 120Hz高刷直屏 8GB+128GB 暗影 游戏电竞智能5G 小米 红米,1699.00,手机外观很酷，灰色可太帅了像素也不错，清晰度挺好运行速度很快，屏幕很敏感音响效果特别好，声音质量不错画质挺好，播放感觉很舒服性价比太高了！,2021-11-07 12:15:50,5
手机,京品手机Redmi K40游戏增强版 天玑1200处理器67W闪充 120Hz高刷直屏 8GB+128GB 暗影 游戏电竞智能5G 小米 红米,1699.00,外形外观：外观好看屏幕音效：双扬声器音质很好拍照效果：还可以10倍变焦运行速度：可以待机时间：电池也很大其他特色：整体下来不错，当个游戏机用了，目前主流游戏农药精英都能带动，可以入手。,2022-02-08 13:45:53,5
手机,京品手机Redmi K40游戏增强版 天玑1200处理器67W闪充 120Hz高刷直屏 8GB+128GB 暗影 游戏电竞智能5G 小米 红米,1699.00,外形美观大气，屏幕音效响**，拍照效果一流，运行内存12G十256G，非常流畅，待机时间长，配67w充电器，四十二分钟充满，边玩手机游戏，边接电话，两不误，顶呱呱。非常满意，给五星好评，再次感谢京东快递，速庋扛扛滴。一次满意的购物。,2021-09-04 20:38:43,5
手机,京品手机Redmi K40游戏增强版 天玑1200处理器67W闪充 120Hz高刷直屏 8GB+128GB 暗影 游戏电竞智能5G 小米 红米,1699.00,"已经在京东买了好多手机了，这是最好的一款配置，没有一丁点儿的毛病。非常的大颜值，非常的美，待机时间非常久。主要是打游戏非常给力，比我的iPadmini5都快。活动搞促销买的非常的划算,物美价廉，物超所值，必须给全五分好评。外形外观:外观是直板方形，有点棱角，挺不错，暗影的颜色，显得有质感，我也喜欢。打孔屏比水滴屏要好看一点。屏幕音效:OLED屏幕果然不是盖的，显示效果细腻清晰，眼睛很舒服。120HZ的高刷也名不虚传，初期适应之后，再去看其他的屏幕，就没办法适应。拍照效果:6400万的主摄像头，效果不错，对焦准确，日常使用足够。运行速度:天玑1200，旗舰机的cpu,使用起来非常流畅,运行大型游戏毫无压力，日常的应用就不在话下了。待机时间:5000毫安的电池，打游戏还是不够用，不过有快充，也无所谓了。其它亮点:弹出式肩键，必须好好表扬一下，首先是机械手感非常棒，其次打游戏非常实用。总之，非常满意的一部手机。希望小米继续加油。",2021-08-08 15:12:43,5
手机,京品手机Redmi K40游戏增强版 天玑1200处理器67W闪充 120Hz高刷直屏 8GB+128GB 暗影 游戏电竞智能5G 小米 红米,1699.00,果然小米还是为发烧而生,2022-02-27 19:15:31,3
手机,京品手机Redmi K40游戏增强版 天玑1200处理器67W闪充 120Hz高刷直屏 8GB+128GB 暗影 游戏电竞智能5G 小米 红米,1699.00,很爽，充电快的起飞，流畅，手感好，音质好，屏幕好，像素高。完美了。还能打游戏。爱了。,2021-07-28 19:56:05,5
手机,京品手机Redmi K40游戏增强版 天玑1200处理器67W闪充 120Hz高刷直屏 8GB+128GB 暗影 游戏电竞智能5G 小米 红米,1699.00,外形外观：因为暗影没有库存了，就能买白刃了，外观看的还是很舒服的，开启肩键的时候还是很酷的。屏幕音效：全景杜比声的优化很给力。拍照效果：64MP的像素已经足够满足日常使用了。运行速度：运行速度：选的是12+256顶配，运行速度很流畅。待机时间：待机时间长，早上8:00到下午2:30才扣了10%的电。其他特色：充电速率高，OLED屏看着不会太伤眼。,2022-02-10 16:03:13,5
手机,小米 Civi 3200万双柔光自拍120Hz曲面原色屏 4500mAh大电量 立体双扬声器 丝绒AG工艺 5G 8G+256GB 黑色,2899.00,外形外观：颜值爆表，超级好看。屏幕音效：显示效果杠杠的，流畅度也非常好。拍照效果：拍照效果真实，清晰度高。夜景等待测试。运行速度：运行速度非常流畅，日常使用足够了。待机时间：4500毫安的电池应该不会太差吧？待测试。其他特色：外观音质爆表，手感轻盈。,2021-10-12 11:47:29,5
手机,小米 Civi 3200万双柔光自拍120Hz曲面原色屏 4500mAh大电量 立体双扬声器 丝绒AG工艺 5G 8G+256GB 黑色,2899.00,小米10S手机收到还是很开心的，拿在手上很有质感。后盖蓝色非常的漂亮，小米10S是对比了多款手机后的最终选择，真的太喜欢了。外观上6.67英寸曲面屏，骁龙870处理器个人觉得更稳定，散热也会更好。最喜欢的是10S双声道扬声器经过哈曼卡顿认证，音质真的太好了。精致的造型设计和外观，颜值无可挑剔，款式时尚大气很有档次。音效很好，拿着手上都有震感。曲面屏显示细腻，总体来说还不错。游戏90刷新率够用，也比较省电。屏幕清晰，一亿像素拍照很清晰。上下双喇叭听音乐更好听，还有一点是支持无线充电。手机使用两天了，手机运行速度很快，不用担心卡，手机音质没得说，非常好，同价位手机里最好的。性价比高，蓝色机身颜值很高，120hz刷新率也很舒服，运行流畅，厚度一般，重量则不算轻。功能齐全，无线快充，反向充电通通都有，小米优化的系统也很智能，微距相机也很棒。对这款手机很满意！,2021-07-19 22:02:52,5
手机,小米 Civi 3200万双柔光自拍120Hz曲面原色屏 4500mAh大电量 立体双扬声器 丝绒AG工艺 5G 8G+256GB 黑色,2899.00,外形外观：时尚秀气，很好看，女生很喜欢屏幕音效：音效特别的棒棒拍照效果：拍照很强大运行速度：运行速度很快哦，加上120hz屏幕简直太流畅了其他特色：特别的轻薄，真的是太轻了，还有大电量加持，真棒????????,2021-10-05 21:13:18,5
手机,小米 Civi 3200万双柔光自拍120Hz曲面原色屏 4500mAh大电量 立体双扬声器 丝绒AG工艺 5G 8G+256GB 黑色,2899.00,小米10S手机手机收到了，最喜欢的是10S双声道扬声器经过哈曼卡顿认证，音质真的太好了，对于平时喜欢听歌的我真的是太爱了。外观精致的造型，颜值真的无可挑剔，款式时尚大气，音效很好，拿着手里质感不错！120hz刷新率也很舒服，运行非常流畅，厚度一般，重量还可以接受。官网验机了是正品，屏幕显示很漂亮，显示效果极佳，对比我的mi11看不出明显差别。系统非常流畅，主要是冲续航才买的，一般正常来讲用一天还剩下30~40%的电量。小米大品牌，支持国产，黑色的非常酷炫，高端大气上档次。拍照效果很高清，说1亿像素还不错，反正是拍照很清晰。充电器充电的时候手机会比较烫，但是充完之后就恢复正常。剩下20%左右的电，一个小时就可以充满，充电速度非常快。小米10S，小米10的升级款，在888的衬托下，870显得更加成熟，附赠充电器。曲面屏第一次使用，特别的喜欢。,2021-11-03 21:39:00,5
手机,小米 Civi 3200万双柔光自拍120Hz曲面原色屏 4500mAh大电量 立体双扬声器 丝绒AG工艺 5G 8G+256GB 黑色,2899.00,外形外观：被小米10S拔掉的小米6的钉子户。比小米6大很多。屏幕音效：当然是迫不及待的感受世界第一的音质，立体声的音质果然很赞，对于喜欢刷视频听歌，看跳舞的人来说享受加倍。屏幕清晰，在评价里看到别人说这款手机有双侧发绿的现象，我感觉可能是曲面屏导致的视觉变形。至少我感觉没有什么问题。拍照效果：拍照当然很赞了，一亿像素不是盖的。运行速度：很丝滑，很流畅。90赫兹的刷新率很跟手。待机时间：感觉这款手机我老婆用确实是有点大了，有点重，但是续航就非常好。其他特色：后盖的淡蓝色非常漂亮，在太阳光下会有白色到淡蓝再到蓝色的渐变效果。双11的价格非常友好，以低配的价格买到了顶配的手机，非常满意。,2021-11-28 23:00:37,5
手机,小米 Civi 3200万双柔光自拍120Hz曲面原色屏 4500mAh大电量 立体双扬声器 丝绒AG工艺 5G 8G+256GB 黑色,2899.00,"送原装33瓦手机充电器,手机本身还送一个保护壳和耳机转接插头,都是很实用的东西。哈曼卡顿的外放音质真的很好。手机用了两天,电池续航可以,轻度用一天没问题,基本能用一天半,充电也很快,最多一小时充满,屏幕清晰,流乘炕,反应超级快,比我原来的手机快多了。小米10S采用了对称式双扬声器设计，在手机底部和顶部放置了双1216超线性扬声单元，等效1.2cc超大音腔。在扬声器内部采用7磁钢设计，最大振幅达到了0.7mm，从而提升了小米10S扬声器的响度与低频性能。手机照相非常棒,清晰,色彩真实,在暗光环境下依然能拍出清晰的照片来,总而言之,这是一款性价比很高的手机。关键是价格很nice，用了手机券+消费券+金豆+24期免息，真的是相当不错！用了一个星期了，总体感受良好，手机反应也挺快，最值得点赞就是音质了，效果特别好。唯一就是相机只有十倍变焦不安逸，其他的都很不错，性价比谈不上很高，但是也不错，希望小米出更多优质产品。",2021-11-07 19:11:11,5
手机,小米 Civi 3200万双柔光自拍120Hz曲面原色屏 4500mAh大电量 立体双扬声器 丝绒AG工艺 5G 8G+256GB 黑色,2899.00,手机收到用了几天了，各方面都非常满意，资深的米粉家人都是用小米的手机，这款外观漂亮，清薄，既有颜值，用起来也很顺手，非常帅气的曲面屏，拍照片美美哒，前置摄像还带补光灯，待机时间长，电池容量大，冲电也是超级快，送给媳妇不二之选,2021-10-13 11:43:25,5
手机,小米 Civi 3200万双柔光自拍120Hz曲面原色屏 4500mAh大电量 立体双扬声器 丝绒AG工艺 5G 8G+256GB 黑色,2899.00,米家的手机主题都是免费的，好爱它，嘻嘻(这可能就是我&ldquo;抛弃&rdquo;其他安卓机的一个小原因吧	白色yyds!拍照效果:图一是散步的时候随手拍的，在&ldquo;更多&rdquo;里选择108M的镜头，普通拍摄质感也很好看。我是那种醒着就手机不离手的人，打游戏，看剧，听歌逛tb、wb、xhs什么的~打游戏一局20min，大概用3-5个电，会热但是不烫手啊~像我这样用，基本一天两充，充电也快，放一边，从20%的电到充满一个小时左右通信音质:听歌，看剧，通话音质都很好!换了这个手机，外放几乎音量没在调到过50以上，声音很大，音色也好听，没什么杂音	送了一个黑色的壳!性价比什么的我不好说，反正这是我觉得在我能力范围内能选择的比较好的爪机了嘿嘿补充一句:它没有耳机孔，有带充电口转耳机孔的那个东东以上是我用了快一星期。中肯评价目前我的手机没有问题!暂时这样~新手机，没什么问题，打王者8g带的动	我对内存的需求大于允许,2021-06-20 21:55:50,5
手机,小米 Civi 3200万双柔光自拍120Hz曲面原色屏 4500mAh大电量 立体双扬声器 丝绒AG工艺 5G 8G+256GB 黑色,2899.00,快，快递快，机器快，反应快，充电快。声音很立体，很好听(?&bull;?_&bull;?)?屏幕好舒服(??)讲真的，塔和k40之间，我犹豫了很久但我去小米之家试了试，手感还是10s舒服，k40太轻了我喜欢重点的,2021-11-07 23:35:54,5
手机,小米 Civi 3200万双柔光自拍120Hz曲面原色屏 4500mAh大电量 立体双扬声器 丝绒AG工艺 5G 8G+256GB 黑色,2899.00,机子到货很快，质量手感很好。官网验机了是正品，屏幕没有坏点，显示效果极佳肉眼比对我的mi11看不出明显差别。系统非常流畅，主要是冲续航才买的，这个还需要体验。,2021-10-05 09:38:17,5
手机,小米 Civi 3200万双柔光自拍120Hz曲面原色屏 4500mAh大电量 立体双扬声器 丝绒AG工艺 5G 8G+256GB 黑色,2899.00,外形外观：曲面屏非常不错，尺寸可以。屏幕音效：音效很棒，两个喇叭?，声音很大。拍照效果：拍照?效果一般。运行速度：运行速度不错?。待机时间：待机时间很长，手机电池?容量很大。,2022-01-15 15:16:10,5
手机,小米 Civi 3200万双柔光自拍120Hz曲面原色屏 4500mAh大电量 立体双扬声器 丝绒AG工艺 5G 8G+256GB 黑色,2899.00,外形外观：曲面屏很高级，手感很棒！屏幕音效：这个音效不用说，比之前的k30s好得多。运行速度：12g运存，真香待机时间：870还是比888稳,2021-06-23 08:50:53,5
