手机,小米 MIX4 骁龙888+ 一体化陶瓷机身 全面屏 一亿像素三摄 哈曼卡顿双扬声器 12GB+512GB 影青灰 5G旗舰,5499.00,激动的心颤抖的手，终于等到了心心念念的mix4，这是我第二部mix系列，也是第六部小米手机了不得不说这个陶瓷的背颗摸起来很丝滑，但是又不沾指纹，一体化的机身，真的是很简约，比同时在手的小米11，看起来舒服多了，但是我还是很喜欢雷军特别版的配色。侧边的感觉MIX4就完胜了，相机模组没有ULTUR那么夸张另外，京东真是买手机的最佳选择，超值换新服务让我对迭代的MIX系列也充满了希望。屏幕方面，说实话，我看不出和2K的区别屏下摄像头是真的神奇，但是送的贴膜有个圆孔，有点闹心，对我们这种自拍要求不高的话，足够用了，就是看起来有的朦朦胧胧的感觉。期待MIUI12.5稳定版的表现。小米，我爱你，京东我爱你?。祝愿你们都成为中国之光。,2021-08-21 00:51:06,5
手机,小米 MIX4 骁龙888+ 一体化陶瓷机身 全面屏 一亿像素三摄 哈曼卡顿双扬声器 12GB+512GB 影青灰 5G旗舰,5499.00,很满意！做工精细，拍照棒棒哒，陶瓷机身手感很好显得上档次！打游戏也不卡，看视频也很好！运行速度很快，无论听歌打电话等声音都清晰，正面反面都漂亮！是小米最漂亮的一款手机了，可惜就是没有总裁的签字！等用一段时间了再追评吧！,2021-09-15 09:20:31,5
手机,小米 MIX4 骁龙888+ 一体化陶瓷机身 全面屏 一亿像素三摄 哈曼卡顿双扬声器 12GB+512GB 影青灰 5G旗舰,5499.00,外形外观：宝贝收到啦，实物真的好看，价格非常实惠，强烈推荐这款，超级喜欢屏幕音效：比平时要便宜，囤了不少，特别特别满意?，超级好看?，客服很有礼貌，很客气，良心商家，支持！拍照效果：品质一级棒，包装也不错，物流很快，而且价格合理，很实惠，很喜欢其他特色：功能很多还要逐渐摸索,2021-11-02 17:03:12,5
手机,小米 MIX4 骁龙888+ 一体化陶瓷机身 全面屏 一亿像素三摄 哈曼卡顿双扬声器 12GB+512GB 影青灰 5G旗舰,5499.00,上个手机用了近五年了，内存小，不够用了，换手机就提上了日程。京东上逛了一圈，远了小米MIX4。外观很时尚，全面屏很喜欢，拍照效果杠杠滴，12G+512G，运行飞快，再也不用让我频繁清理整理空间了，值得推荐。,2021-10-10 23:38:01,5
手机,小米 MIX4 骁龙888+ 一体化陶瓷机身 全面屏 一亿像素三摄 哈曼卡顿双扬声器 12GB+512GB 影青灰 5G旗舰,5499.00,外观:白色陶瓷真的颜值担当，好看！正面屏下摄像头更是一绝！隐藏的恰到好处吧！配置：MIUI12.5用的真的是习惯了，12+512内存妥妥的，游戏跑起来完全不担心，888+也没了888的炎龙模式，120w快充提速了不少，20+充满电没问题，双卡卡槽变小也是十分用心。另外，小米换机真心无敌，直接整机数据备份过来了，大大的赞！从小米note旗舰开始，到小米5、小米9，最后再到今天的mix4，小米给了太多的惊喜！会一直支持小米！加油！,2021-11-07 21:20:05,5
手机,小米 MIX4 骁龙888+ 一体化陶瓷机身 全面屏 一亿像素三摄 哈曼卡顿双扬声器 12GB+512GB 影青灰 5G旗舰,5499.00,手机第一时间上手感觉很有质感，摄像头处还有特殊花纹凸显光泽。机身特别薄上手感觉特别舒适，手感特别好！屏幕显示一般看不出摄像头的存在，完全一整块屏幕，真真正正的全面屏，观感特别优秀，屏幕色彩显示堪比三星屏幕，除了没办法120hz和防闪烁一起打开。。。。拍照就一个字绝，特别好的小米手机,2021-08-27 18:19:59,5
手机,小米 MIX4 骁龙888+ 一体化陶瓷机身 全面屏 一亿像素三摄 哈曼卡顿双扬声器 12GB+512GB 影青灰 5G旗舰,5499.00,最喜欢的陶瓷后盖终于回来了，中午消灭了前置摄像头这个短板了，太可了，mix3当时弹起式的真心不喜欢，舒服了，陶瓷后盖，可惜貌似没有ip68？京东的物流是真的快啊,2021-08-17 17:42:52,5
手机,小米 MIX4 骁龙888+ 一体化陶瓷机身 全面屏 一亿像素三摄 哈曼卡顿双扬声器 12GB+512GB 影青灰 5G旗舰,5499.00,初入小米MIX系列，刚入手的体验感受！很早就关注了这款手机，最吸引我的是全面屏及陶瓷机身，实体店上手感觉也很不错。有考虑过买11u但是强迫症的我依然选择了mix4。都说前置屏下很拉胯，这是不争的事实！毕竟前置屏下是创新，是未来趋势，但是后摄也不错，基本满足需求。120w充电确实很快，基本20分钟左右完全充满。但是大功率快充手机会发烫，是真的有点烫，温度至少45度以上吧！我看了很多关于mix4的文章及测评，说的有对有错，完全在于自己理解。人无完人，商品也一样。,2021-11-01 13:33:48,5
手机,小米 MIX4 骁龙888+ 一体化陶瓷机身 全面屏 一亿像素三摄 哈曼卡顿双扬声器 12GB+512GB 影青灰 5G旗舰,5499.00,MIX4真正全面屏手机，并且没有金属材质做边框，看起来更一体化?，纯粹只有黑白搭配更简洁！陶瓷的手感一级棒，系统流畅，照相OK，当然自己对于自拍要求不高！,2021-10-09 10:49:51,5
手机,小米 MIX4 骁龙888+ 一体化陶瓷机身 全面屏 一亿像素三摄 哈曼卡顿双扬声器 12GB+512GB 影青灰 5G旗舰,5499.00,双十一购买的，价格很合适，还赠送了小米礼盒。充电速度快，电池也很耐用。手感很好，用起来很方便。背面这个颜色爱了，低调有内涵。米粉购买吧！,2021-11-16 21:56:24,5
手机,小米 MIX4 骁龙888+ 一体化陶瓷机身 全面屏 一亿像素三摄 哈曼卡顿双扬声器 12GB+512GB 影青灰 5G旗舰,5499.00,始终是小米的忠实粉丝，小时候就被第一代mix的亮相所惊艳，但是因为那会还小没有能力购买，就一直关注小米MIX系列，等了那么多年终于到MIX4有了相对而言较为符合真全面屏的答案。京东快递很给力！早上10点开售付款后第二天早上就到了。MIX4一体中框，陶瓷后盖，手感温润，最重要的是，没有像小米11系列诡异的R角，上手真的很舒服温润如玉，一面科技，一面艺术，当之无愧！,2021-08-17 10:56:09,5
手机,小米 MIX4 骁龙888+ 一体化陶瓷机身 全面屏 一亿像素三摄 哈曼卡顿双扬声器 12GB+512GB 影青灰 5G旗舰,5499.00,小米，哈哈哈哈！小米！这就是mix4？？？,2022-02-20 14:18:25,3
手机,小米 MIX4 骁龙888+ 一体化陶瓷机身 全面屏 一亿像素三摄 哈曼卡顿双扬声器 12GB+512GB 影青灰 5G旗舰,5499.00,刚好手机坏了，看到mix4上新，就立马抢了一台如图，到手质感非常好，拿在手里也很有分量性能也不错，运行速度够快别看了，抢就完事儿了&hellip;,2021-09-02 16:14:18,5
手机,小米 MIX4 骁龙888+ 一体化陶瓷机身 全面屏 一亿像素三摄 哈曼卡顿双扬声器 12GB+512GB 影青灰 5G旗舰,5499.00,双十一下单，目前已上手使用三天，从收货到开箱，再到使用，这部机器一直在给我惊喜。首先，价格上毫无意义，性价比很高，当然抢首发的朋友会有点不舒服了，唯一遗憾的是没有抢到赠送的小米礼盒。拿到快递第一时间开箱，黑色烫金纸盒诚意满满，打开之后，相信&ldquo;世上没有完美，但总有人在追求完美&rdquo;这句话说到了无数完美主义者的心坎里，这也是我们愿意放弃优质前摄选择全面屏的原因。很多人喜欢白色，个人认为影青灰更胜一筹，入眼便是&ldquo;心纯净，温如玉&rdquo;之感，手感无需多言，是真的爱不释手，赠送的透明软壳也很好用。从陶瓷米6过来，用惯了裸机手感。附带的120W充电器用料很足，沉甸甸，充电速度是真的惊到我了，十分钟充满太给力了。目前不玩游戏，正常日用，一天一充或两天三充足够。前置摄像没有想象中那么差，尽量避免逆光拍摄还是可以的，相比起来后置一亿像素就很舒服。哈曼卡顿调校的音质很不错，屏幕显示也很出色。撕掉了原厂附带的软膜，到售后贴了钢化膜，目前唯一感觉到的问题就是指纹识别不够灵敏，有时候需要点两三下。总体而言，这部手机很是非常值得入手的。,2021-11-16 17:48:49,5
手机,小米 MIX4 骁龙888+ 一体化陶瓷机身 全面屏 一亿像素三摄 哈曼卡顿双扬声器 12GB+512GB 影青灰 5G旗舰,5499.00,外形外观：陶瓷后盖手感非常好，比玻璃更温润屏幕音效：真全面屏，就是奔着这个买的，双扬声器立体声效果很好拍照效果：1亿像素加广角加长焦，外出足够用运行速度：12G内存运行很多个应用后还剩余很多，足够用几年了，加上888plus处理器，游戏不在话下,2022-01-26 23:30:24,5
手机,小米 MIX4 骁龙888+ 一体化陶瓷机身 全面屏 一亿像素三摄 哈曼卡顿双扬声器 12GB+512GB 影青灰 5G旗舰,5499.00,手感好！不戴套，拿手上舒服至极！重量厚实！收款真全面屏，没有水滴效果真的非常棒！充电真的太爽了！日常使用都很棒！,2021-08-27 21:49:31,5
手机,一加 OnePlus 9 Pro 5G旗舰2K+120Hz 柔性屏8GB+256GB 闪银 骁龙888 65W快充 哈苏专业模式 超广角拍照,4199.00,外形外观：黑色很满意，比预想中的品质更好屏幕音效：屏幕效果很好，就是比较费电拍照效果：拍照效果在各种旗舰机中算是中等偏上了运行速度：运行速度绝对是杠杠的待机时间：这个要看使用情况，我一般正常使用一天一充，但是如果稍微中度使用就得充两次了，幸好65w快充给力，节省很多时间其他特色：还是很满意黑色的选择，原先一直在黑色和绿色间纠结，后来买了黑色配上这个壳太棒了,2021-07-10 23:09:45,5
手机,一加 OnePlus 9 Pro 5G旗舰2K+120Hz 柔性屏8GB+256GB 闪银 骁龙888 65W快充 哈苏专业模式 超广角拍照,4199.00,外形外观：墨绿这颜色大爱，后背颜值高，AG工艺，不沾染指纹，摸起来滑滑的，在光线折射下显得高级感满满，一加在手机外观设计上一直都是颜值在线，玻璃AG工艺就是一加带起来的，一加6老用户了。屏幕音效：顶级的屏幕素质，2K，观感很舒服。120hz刷新率搭配colorOS灵动的量子动画引擎，操作丝般顺滑。LTPO自适应刷新率技术加入，兼顾屏幕高刷新率与功耗，杜比全景声和各种屏幕增强技术加持，看视频挺享受。拍照效果：索尼IMX789，IMX766，都是定制超大底主摄，不得不说这两颗镜头素质确实好，联合哈苏调教，出片色彩丰富，双原生ISO，HDR照片宽容度高(亮处不过曝，暗处显细节)。超广角镜头得益于自由曲面镜片的加入可矫正大角度图像的畸变。当然，还有哈苏相机特有的快门声音，听着会上瘾，哈哈。运行速度：高通骁龙888，满血版LPDDR5内存，运行速度快，搭配colorOS的调度策略，牛奶般丝般顺滑。待机时间：智能5G切换模式下，室外中度使用，亮屏时间4个多小时，连接WIFI使用亮屏6小时左右，中规中矩，毕竟是2K屏，120hz刷新率。其他特色：65W超级闪充，电池0到100%，30分钟搞定。出门前看到没电再接上充电器极速&ldquo;回血&rdquo;的体验太棒了！,2021-04-10 20:15:08,5
手机,一加 OnePlus 9 Pro 5G旗舰2K+120Hz 柔性屏8GB+256GB 闪银 骁龙888 65W快充 哈苏专业模式 超广角拍照,4199.00,4月2号下单8+128闪光银，4月4号晚上到手，京东快递不负我。激动开箱，被大红色盒子惊到，盒子包装很用心，还贴了专门的撕扯标签。官方标配：一充电器（很有分量），usb线（两端都typec接口，所以充电器不能与家里其他设备共用），一个软壳，一手机（屏幕已贴膜）和其他说明书等。手机配了一个拨键实现静音，振动，正常三功能，在屏幕右边，特别方便。经15秒左右开机（速度好快），先看了内存，剩下一百G，够用了。手机上手很快，感觉系统有一个很方便的地方是返回键的设定，屏幕左右往中间滑动即可，具体可以看视频（我是第一次用这功能，可惜京东只能放15秒，录了很长被截掉，总之谁用谁知道好），此外掉出后台和软件切换功能都挺方便，唯一不希望的是指纹验证往上走走就好了（只能放8图，没法显示）。拍照：屏幕本来就超级给力，加上哈苏影像，出来的照片简直太美和逼真，打开相机直接冲着两个功能：超级微距和超级防抖，效果都非常出色（防抖视频没法放），详细看图，超级微距可看清手纸的孔。最后试了试专业模式，发现照片拍出来亮丽，感觉很多功能需要慢慢挖掘。其中操场图是黑夜拍的，惊吓到了。牛！总之，很值得。,2021-04-05 17:05:28,5
手机,一加 OnePlus 9 Pro 5G旗舰2K+120Hz 柔性屏8GB+256GB 闪银 骁龙888 65W快充 哈苏专业模式 超广角拍照,4199.00,外形外观：颜值非常非常好看绿色很高级屏幕音效：大屏高刷非常清晰拍照效果：哈苏联名超级赞运行速度：一个字快其他特色：充电半小时充满太爽了,2021-12-17 01:53:52,5
手机,一加 OnePlus 9 Pro 5G旗舰2K+120Hz 柔性屏8GB+256GB 闪银 骁龙888 65W快充 哈苏专业模式 超广角拍照,4199.00,外形外观：选择的是闪银色，背面从上到下是渐变的镜面效果，既低调也酷炫，摄像头模块的设计较大气，整机手感也很ok。屏幕音效：2k+120hz的屏幕素质不必多说，显示效果顶级，触控也丝滑无比；曲面弧度不算大，微曲面设计在外观和实用性上保持了很好平衡；音效感觉中规中矩，但达到了一般旗舰手机的水准。拍照效果：色彩还原度相当不错，之前一直用三星手机，相比三星的艳丽，9pro的色彩更接近真实世界；从广角到主摄到3.3倍光学变焦的过渡也很平滑，特别值得一提的是广角镜头，素质应该是市面上主流旗舰手机中的最顶级之一。运行速度：旗舰手机，性能肯定溢出，特别对于不玩游戏的我，运行速度绝对可以满足，已经不是考量的因素了。待机时间：刚刚到手，没特别留意待机时间，我不玩游戏，常规情况下一天一充肯定是够的，65W的充电速度也非常快，差不多半小时就能充满。其他特色：从三星的OneUI过度到ColorUI没有半点不适，一加9pro的ColorUI可能是定制过的原因，感觉比较清爽，预装的软件也很少，省去了卸载时间；另外对我来讲，IP68是刚需，不管是脏了直接冲水，还是洗澡带进浴室，我都习惯了，这点也正合我意。,2021-04-05 17:45:20,5
手机,一加 OnePlus 9 Pro 5G旗舰2K+120Hz 柔性屏8GB+256GB 闪银 骁龙888 65W快充 哈苏专业模式 超广角拍照,4199.00,配送次日就到了，快递速度是顶呱呱，包装非常漂亮，没有磕碰痕迹外形外观：这次选的颜色是绿洲，但带上一加配送的黑色磨砂壳后，感觉手机提高了不止一个档次，值得一赞的是一加送的手机壳，磨砂手感非常好，耐脏，不染指纹，非常棒，比oppo的findx3pro的透明壳好太多了屏幕音效：10亿色，2K分辨率，120hz高刷，动态插帧，这屏幕的效果可以跟高端电视直接PK，有一说一，屏幕颜色太过鲜艳，但却又是非常讨好眼球，不能接受太过鲜艳颜色的朋友可以选择电影模式，还原度会比较高一点拍照效果：一加和哈苏合作的摄像头拍照效果没得说，很高程度还原了照片的色彩，另外屏幕值得赞一个运行速度：运行速度：骁龙888，LPDDR5，UFS3.1，性能三件套全部齐全，加上120HZ高刷，流畅度可以说是本年度数一数二的手机，抛开价格不说，直接可以吊打三星S21Ultra，Iphone12Pro等一众老机王，性价比非常高,2021-07-19 15:08:28,5
手机,一加 OnePlus 9 Pro 5G旗舰2K+120Hz 柔性屏8GB+256GB 闪银 骁龙888 65W快充 哈苏专业模式 超广角拍照,4199.00,首先说一下手感和外观吧，这次的闪银色惊艳到我，似蓝非蓝，若隐若现，非常nice。握持敢很舒服。其次是这块屏幕，网上说偏黄，但是给我的感受是相当棒的，尽管看很长时间眼睛都不会累，不会像我之前用某为的看久了眼睛都看不清东西了，而一加9pro给眼睛带来很舒适的感觉。再一个就是操作感，滑动和使用非常丝滑，让我真的只能用舒适来形容，我之前是用某为的，现在换这个之后给我印象真的太棒了游戏会变热，会掉帧，最好不要戴着壳玩游戏。我试的是王者，飞车，吃鸡。充电速度不用说，非常快，刚好弥补续航差的问题，但是续航总体来说还是可以的了。,2021-08-13 16:59:51,5
手机,一加 OnePlus 9 Pro 5G旗舰2K+120Hz 柔性屏8GB+256GB 闪银 骁龙888 65W快充 哈苏专业模式 超广角拍照,4199.00,外形外观：清爽、简洁，重量控制的还可以，充电速度快。屏幕音效：屏幕曲率很小，接近直屏的外观，清晰度不错，音质很通透。拍照效果：哈苏影像加持，成片效果不错，夜景照片很美。运行速度：速度顺滑，体验不错。待机时间：待机时间体验还可以。其他特色：手感很舒适，有亲肤质感。,2021-06-22 00:02:01,5
手机,一加 OnePlus 9 Pro 5G旗舰2K+120Hz 柔性屏8GB+256GB 闪银 骁龙888 65W快充 哈苏专业模式 超广角拍照,4199.00,外形外观：一加9pro在外观气质方面还是拿捏的死死的，非常好看，我从一加6一直用到一加9pro一直是忠实粉屏幕音效：屏幕音效打开就像个小音响哈哈这是本人观点哈本人也是个音乐迷对音效这块儿比较敏感，这一点一加一直做的还是可以的拍照效果：在拍照效果这块儿一加9pro就不用说了，很强大哦，大家都应该知道吧，我不用再多在这里阐述，大家用了就知道。运行速度：一加9pro速度运行也是很牛掰的，也是我很满意的地方，我自己用完全足够了待机时间：待机时间大家自己看怎么玩，我买来拆封到现在还没用完直到发这个评论都还是百分之八十几的电我觉得很OK了其他特色：其他特色:我自己选的的个颜色很好看，很喜欢值得推荐给大家,2021-11-01 15:06:18,5
手机,一加 OnePlus 9 Pro 5G旗舰2K+120Hz 柔性屏8GB+256GB 闪银 骁龙888 65W快充 哈苏专业模式 超广角拍照,4199.00,送货很快。包装很好很完整。正如刘老板所说的，那手感真的***爽啊，太舒服了。连那个手机壳的手感也很好。相比我的坚果阿兔，这个一加手机真的很轻盈，不重，再加上那舒服的手感，握起来真的太舒服了。系统是coloros，也是很给力，如果再加上坚果系统那个三大件就更完美了。晚上的待机很给力啊，待机时间长。充电也很快啊。,2021-10-25 18:55:44,5
手机,一加 OnePlus 9 Pro 5G旗舰2K+120Hz 柔性屏8GB+256GB 闪银 骁龙888 65W快充 哈苏专业模式 超广角拍照,4199.00,外形外观：颜色好看，外观大气，拿着舒服。屏幕音效：声音放大不破音，和音响有的一比。拍照效果：拍照效果：摄像头五千＋像素牌照很清晰，超级微距很好用。运行速度：骁龙888，12+256，速度杠杠的。玩游戏，刷视频时间久了，啥手机都发热，体验两天各方面满意。待机时间：24小时剩余46%的电量其他特色：充电超级快，屏幕刷新率真的高，手机系统流畅。,2021-10-26 23:29:28,5
手机,一加 OnePlus 9 Pro 5G旗舰2K+120Hz 柔性屏8GB+256GB 闪银 骁龙888 65W快充 哈苏专业模式 超广角拍照,4199.00,使用和外观，相机，屏幕，速度，都是旗舰标准，特别喜欢的一款手机，刚刚上手，感觉非常好，从一加3刚出就开始使用了，这次感觉自然好，系统优化也很不错，流畅，好用！,2021-11-06 15:10:27,5
手机,一加 OnePlus 9 Pro 5G旗舰2K+120Hz 柔性屏8GB+256GB 闪银 骁龙888 65W快充 哈苏专业模式 超广角拍照,4199.00,一加9pro绿洲色配色和苹果配色差不多，很好看，不张扬但是很高级，后盖玻璃采用双层AG工艺，从不同的角度可以反射不同的颜色，这配色真的很好看，一加9PRO作为一加最新旗舰，有如下优点：1、一加主打的哈苏专业影像系统，拍出来的照片自带高级感，同时支持4K120帧，很不错；2、LTPO2K120HZ三星E4发光材料，屏幕素质高，色彩很纯正，120HZ如丝般顺滑，试了下吃鸡，120HZ就是，说真的，不对比就没有伤害，用过120HZ后再用90hz和60HZ手机，还真的不习惯了，哈哈，120Hz就是一个字爽；3、骁龙888，2021年度旗舰CPU，作为安卓最顶级的，安兔兔测试83万分，这性能用个3年应该不会有问题，4、65w充电功率，29分钟充满，真的好快，充一下就可以解决缺电焦虑，之前用的苹果XR，对比之下真的太慢了；5、这次一加9pro搭载ColorOS系统，比原生原来的安卓系统就是好用，这也是一加9系统的一大亮点；6、一加手机两年质保，这一点真的很赞，其它品牌手机最多也就18个月质保，这一点看一加对自己的产品很有信心，对于我们一加用户用得安心。上述优点还有很多，手机很巴适，很赞,2021-06-06 08:08:36,5
手机,一加 OnePlus 9 Pro 5G旗舰2K+120Hz 柔性屏8GB+256GB 闪银 骁龙888 65W快充 哈苏专业模式 超广角拍照,4199.00,外形外观：外观细长型，背后摄像头的排列规则，让人看过去很舒服，亮银的后壳渐变色也是让人叹为观止。屏幕音效：屏幕的音质也很好，最让人喜欢的就是相机的拍照声音，那机械按键的声音简直让人着迷。以及音乐的声音，很清脆，音色很好。拍照效果：拍照很清晰，而且那个广角让人看的很自然，很舒服。还有那个哈苏专业模式下的拍照，让人有一种很新奇的感觉。运行速度：允许流畅度很高，感觉性能这一块做的是真的好，因为上一台手机是一加5，到要换这台一加9Pro，原本那台也还是很流畅的。待机时间：目前使用下，待机情况也是处于耐用的情况其他特色：我最喜欢这次的colorOS系统，因为我自己不会去搞那些黑科技的东西，所以当初一加五也没有各种刷机开发新功能，这次的新系统让人用的很舒服很方便。,2021-04-01 21:13:49,5
手机,一加 OnePlus 9 Pro 5G旗舰2K+120Hz 柔性屏8GB+256GB 闪银 骁龙888 65W快充 哈苏专业模式 超广角拍照,4199.00,买来使用一个多月，总体来说很不错，日常使用很流畅，拍照很清晰，双十一入手的，价格很划算，很香。屏幕刷新率120赫兹，使用流畅，这个微曲面很好，比7Pro的曲面屏好多了，我和7pro一样的话，我可能就不会买了，至少不用像7pro那样担心断触.游戏体验实在不好.当然缺点也有，续航一般，但是好在充电很快，65w的充电半小时就充满了，系统有点小bug，但不影响日常使用，玩游戏确实热，但是能接受，不知道是不是冬天的原因，不知道夏天怎么样，手冷的时候暖暖手不错，不打游戏的话，手机温度是温润的，我觉得它也仍然是一款不错的旗舰手机。客服很有耐心，也很细心，及时的帮我解决问题，售后没毛病，很满意。照片拿已经沦为备用机7pro拍的。,2021-12-09 20:01:36,5
手机,一加 OnePlus 9 Pro 5G旗舰2K+120Hz 柔性屏8GB+256GB 闪银 骁龙888 65W快充 哈苏专业模式 超广角拍照,4199.00,视频是我用了几天之后拍的我第一次用一加手机的是一加6T打游戏是真的爽都没说有发烫手感是真的好后来骑车的时候掉了?后来没钱买就没开始用外形外观：比我想象中的还要轻薄这次我买的是黑洞看着像磨砂摸起来又有那玻璃的质感非常好屏幕音效：音质没得说杜比全景音效无论是看电影还是听歌都是很好拍照效果：我不怎么拍照偶尔发发朋友圈随手拍很清晰成相看着很棒运行速度：搭配120赫兹12G运行速度2k5G特别细腻丝滑待机时间：早上8:00100%中午的时候看了一小时电影到晚上8点的时候还有百分之30第2天我就更新了系统续航更强了其他特色：屏幕微烫摄像头位置也是我打游戏的话都是用散热器没什么影响就是我下单太着急了忘记选手机套装买手机的时候选手机套装优惠很多希望对你有帮助希望一加越来越好??,2021-04-23 23:44:11,5
